episode_id,section_index,gender,minutes,partikkel,lause
20200826_riina_solman_ja_liina_kersna_roosast_kleidist_ja_riigi_vrikusest,1,F,5.349499999999996,aitäh,"Head sõbrad , aitäh , et vaatasite kuulmiseni ."
20210322_podcast_noorteaken_6__motivatsioon_eneseareng_ja_ajaplaneerimine,1,F,29.687333333333335,aitäh,"Mul oli väga tore sinuga rääkida , aitäh , et sa tulid , aitäh samast , ma loodan , et see jäi rahule kõikidele , siis , kes tahavad Anetega lähemalt tutvust teha , siis me paneme tema sotsiaalmeediakontot ka kindlasti alla ."
20210322_podcast_noorteaken_6__motivatsioon_eneseareng_ja_ajaplaneerimine,1,F,29.687333333333335,aitäh,"Mul oli väga tore sinuga rääkida , aitäh , et sa tulid , aitäh samast , ma loodan , et see jäi rahule kõikidele , siis , kes tahavad Anetega lähemalt tutvust teha , siis me paneme tema sotsiaalmeediakontot ka kindlasti alla ."
20210603_mida_peaksid_teadma_enne_kinnisvaraostu,2,F,2.291166666666671,aitäh,"Suur tänu teile terje ja hinge edu edukat päeva , palju tehinguid ja , ja aitäh , et võtsite aja siis harida meie meie kliente ja anda neile oma vanus ."
20210620_15_tandja_brnding__stuudios_ivi_aluoja_adven_ja_kristiina_kuuskme_fontes,1,F,44.687333333333335,aitäh,"Aitäh kutsumast , et ja aitäh märkamast meie meie tegevusi , et et jah , et meil , Advenis on võibolla selline süsteemsem ."
20210620_15_tandja_brnding__stuudios_ivi_aluoja_adven_ja_kristiina_kuuskme_fontes,1,F,44.687333333333335,aitäh,"Aga väga-väga põnev oli teiega siin vestelda , jälle , ma räägin , ma , ma olin ise lihtsalt noh , nii põnevil , sest mind teema tohutult huvitab ja , ja ma loodan , et need , kes kuulavad sa ikka hästi palju motivatsiooni juurde , sest et see ongi nii armas , kui siiralt sa sellest räägid ja et näha , et sa oled ju ka ise väga õnnelik seal tööd tehes , et see kiirgab igal juhul välja , aitäh teile ."
20200827_mailis_repsi_tabab_avameelsushoog,0,F,24.511333333333333,aitäh,"Head sõbrad , aitäh , et te vaatasite ."
20210201_keit_pentusrosimannus_autorollo_skandaalist,0,F,24.89816666666667,aitäh,"Hästi , Tiit Petus-Rosimannus , mul oli teile veel väga palju küsimusi , aga meie aeg on otsas , aitäh , et tulite stuudiosse ."
20210201_keit_pentusrosimannus_autorollo_skandaalist,0,F,24.89816666666667,aitäh,"Head sõbrad , aitäh , et te vaatasite ja vaadake teinekord ikka jälle kõike head , nägemiseni , kuulmiseni ."
20200116_112_saade__astroloog_anu_kallavus_teab_mis_on_veevalajaajastul_teisiti_kui_kaladeajastul,1,F,53.22666666666667,aitäh,"Võib lõpetada aitäh , Anu Kallavus huu ."
20200116_112_saade__astroloog_anu_kallavus_teab_mis_on_veevalajaajastul_teisiti_kui_kaladeajastul,1,F,53.22666666666667,aitäh,"Värviliseks kirevaks aitäh sulle , Anu , aitäh , Sirje , aitäh ."
20200116_112_saade__astroloog_anu_kallavus_teab_mis_on_veevalajaajastul_teisiti_kui_kaladeajastul,1,F,53.22666666666667,aitäh,"Värviliseks kirevaks aitäh sulle , Anu , aitäh , Sirje , aitäh ."
