episode_id,section_index,gender,minutes,tunnus,lause
20210422_episood_5_elu_surm_ja_kanade_lestus,0,M,83.633,noh,"Et me oleme arutlenud küll , et ütleme , kas ütleme , kui kui muusik ütleme , teeb kuskil lauluväljakul kontserdi või ta teeb seda kontserdi ööklubis , et kas siis ööklubis , siis , siis see ei ole kultuur , et et mujal on , et tegelikult , et looming on looming , et vahet pole , kus sa seda teed ja , ja ööklubid on täpselt samamoodi ju tegelikult paljudele muusikutele ütleme enamiku tööandjatest on ikkagi ööklubid ka selles mõttes , et , et noh , väljas sa talvel ei tee , et talvel ikka kolid sisse ja tihti tihti seal teatri ja kontsertsaalides , no ütleme Ütleme noh , nojah , päris päris , ma ei tea , mida ma öelda tahtsin , sellega aga igal ."
20210422_episood_5_elu_surm_ja_kanade_lestus,0,M,83.633,noh,"Tõenäoliselt , sest Eestis puudub see , noh , selline ringkond ehk siis see nii-öelda ööklubide ööelu kinni panemine lööb just seda sektorit muusikast , kes teenib elatist konkreetselt muusikaga Eestis , et see on hästi huvitav ."
20210422_episood_5_elu_surm_ja_kanade_lestus,0,M,83.633,noh,"Mis sina arvad , kas see koroona kui selline , et noh , me lähme nii-öelda uude reaalsusesse , kas see mõjub sellele osale hästi , et näiteks peale koroonat siis bändid tõesti ei peagi istuma , ma tean ise isiklikult mõnesid artiste , kes no lihtsalt , nad ei taha istuda seal kella üheni öösel , et saaks lavale minna ."
20210422_episood_5_elu_surm_ja_kanade_lestus,0,M,83.633,noh,"Eks ei , ma usun , et see tagasivajumine võtab ikka aastaid , sest et nüüd on ja inimesed nagu harjunud ikka noh , no kui ütleme , sõidad linnast läbi , siis peale kella kolme ei põle mitte ükski tuli kuskil ."
20210422_episood_5_elu_surm_ja_kanade_lestus,0,M,83.633,noh,"Et inimesed on juba harjunud varem magama ka , mine minema , aga hea see , et bändid nagu varem peale ja , või hiljem peale seda teemat ja me oleme päris paljude klubi omanikega juba varem ka nagu arutama , arutanud , et osad osad väidavad seda , et ronid sinna klubisse esinema , kui sa tahad kell 12 juba kodus olla , et mine tee enda kontsertsaalis ja vaata , palju tuleb , et noh , mõnes mõnes mõttes on nagu õige ka , et noh , et ütleme , koha omanik ütleb , et no et mina maksan sulle ja mina ütlen , mis kell sa lähed , onju ja kui ei taha , ega keegi käse ju tulla ."
20210422_episood_5_elu_surm_ja_kanade_lestus,0,M,83.633,noh,"Et kui sa ikkagi välja lähed , siis sa käid ikka kahes-kolmes klubis nagu klubist nagu läbi ja siis see tekitabki , et noh , mille , mille jaoks need , teised peavad bände võtma , et , et rahvas läks Läheks edasi ."
20210422_episood_5_elu_surm_ja_kanade_lestus,0,M,83.633,noh,"Et see , kui näiteks ütleme , bänd läheb tõesti kell 11 õhtul peale ja , ja süda lõpetab ja siis inimesed jäävad ja seal Meelelahutusprogramm läheb edasi , kas DJ mängib või midagi et , et see oleks tegelikult palju , palju mõistlikum , et siis võidaks , võidaks nii bänd , kui ka võidaks , võidaks ka siis ütleme klubiomanik , et rahvas ei jookse kohe minema , noh , kell 12 , inimene ära läheb , see , siis peab midagi klubil viga olema ."
20210422_episood_5_elu_surm_ja_kanade_lestus,0,M,83.633,noh,"Ja omast kogemusest on ka sama olnud , et ma olen oodanud niimoodi neli tundi , umbes , et no lähme peale ootame veel natuke aega , inimesed kogunevad alles , kell on juba niisugune üks või kaks , aga noh , see muusika , mida ma teen , ei ole niisugune nagu noh , niisugune öödisko nii-öelda siis , või kuidas kus iganes seda öelda , et noh , niisugune nagu pigem natuke rahulikum , niisugune popp , onju siis kell on üks 30 , siis hakkad mängima , seda inimesed on tegelikult juba mingis muus konditsioneer ."
20210422_episood_5_elu_surm_ja_kanade_lestus,0,M,83.633,noh,"Et kui ma siin Tartus suuremaid klubisid ise nagu ütleme , programmi poolt juhtisin , siis oli ikkagi ikkagi ma võtsin ikkagi vahepeal ühendust teistega , et kuulge , et teeme näiteks niimoodi , et noh , ütleme suuremate bändidega , et mina teen palgapäeva reedel , sina tee palga päeva laupäeval või sina , tee nädal ennem või nädal hiljem , et noh , et ei kattuks , sellised asjad on ju ."
20210422_episood_5_elu_surm_ja_kanade_lestus,0,M,83.633,noh,"Ja , ja et , et noh , ongi ja paljud paljud see listi teema on hästi et , et paneme listi ja laske tasuta ja noh siis klubi omanikud lasevad ki , et äkki ostad paar koksigi , siis vähemalt no kõik kõik ."
20210422_episood_5_elu_surm_ja_kanade_lestus,0,M,83.633,noh,"On üks ja sama , noh , seda , seda kõik üritame , üritame nagu ajada , aga , aga , aga välja ta ei tule , nii et peab ikkagi midagi midagi teistsugust ka vahepeal tegema ."
20210422_episood_5_elu_surm_ja_kanade_lestus,0,M,83.633,noh,"Ja rent jookseb , kommunaalkulud jooksevad , et , et see on nagu see on nagu tahes-tahtmata , et noh , näiteks ühes kohas on niimoodi , et on maja võetud omanike poolt nagu kagu pangalaenuga ja nemad ütlesid , et noh , et pank küsib nende käest ja meil ei jää midagi muud üle , et me ei saa teha nagu soodustust ."
20210422_episood_5_elu_surm_ja_kanade_lestus,0,M,83.633,noh,"Et , et noh , ütleme kange alkoholiga ei ole see , et kange , alkoholiga on see , et see nagu kestab kaua , aga ütleme , lahja alkohol ja see , see , see nagu läheb ära ja käest ."
20210422_episood_5_elu_surm_ja_kanade_lestus,0,M,83.633,noh,"Ei kõik , kõik on koondatud ja et , et kui , kui avame , siis ma vaata , noh , ma ikkagi suhtlen nendega vahepeal ja ikkagi olen uurinud , et noh , et kes meist nagu alles on ja noh , päris paljud on alles , aga osad jällegi on leidnud mingi mingi ütleme niisuguse nagu Nagu mingi mingi sellise töö , kus nad enam ei saa nagu tulla , et osadest osadest inimestest olen ma nagu selles mõttes ilma jäänud jah , et , et ."
20210422_episood_5_elu_surm_ja_kanade_lestus,0,M,83.633,noh,"Päris palju on ka ikkagi olnud noh , sellist asja , et on ju tehtud seda , mis on nagu keelatud ja siis ma ei tea , mina näiteks kogu aeg hakkan nagu mõtlema , et kurat , aga need inimesed on nii meeleheitel , et nagu mõnes mõttes sa saad neist nagu aru teisest küljest sa nagu taunid seda , et nad seda teevad , seepärast , et noh , miks te rikute reegleid vaata aga , aga see on ju hästi huvitav , aga ma tahtsin su käest küsida , kui , kui sina saaksid praegu öelda kaks valitsust on olnud selle aja jooksul mida nad oleks pidanud tegema , et ööklubisid , päästa ."
20210422_episood_5_elu_surm_ja_kanade_lestus,0,M,83.633,noh,"Mitte nii vajalik el , et , et , et noh , mina ikka mõtlen , et kui Need ettevõtted on riiki toitnud , siis halval ajal võiks riik midagi ka anda või vähemalt küsida , kuidas , kuidas on või kuidas me saame nagu paremini paremini nagu kasvõi kasvõi kontaktiski olla , aga , aga lihtsalt ei ei tule isegi mingeid vastuseid ega midagi ja see , see on nagu see on nagu kurb jah ."
20210422_episood_5_elu_surm_ja_kanade_lestus,0,M,83.633,noh,"Terve kultuurisektor on tegelikult elenenud samamoodi terve see aeg , et noh , ka siin põhimõtteliselt mina kui osana nagu stuudiomeeskonnast , kes me oleme ka üritanud siin ikkagi nagu kuidagi ellu jääda , et et proovid ja suhtled ja noh , näited , et tegelikult oled ikkagi olnud nii aus , kui , nagu vähegi üldse saab , et noh , näita oma kõik maksud ette ja mis iganes sul kõik on , onju , aga vastust ei tule ja ega ei ole ka mingisugust noh , varianti , et kaalume midagi siis või niisugune täiesti nagu kõrvale jäänud , et , et selles mõttes on hästi kurb nagu kuulda üldse kogu selle kultuurisektori peale , et nüüd kuskilt ei olegi mitte midagi nagu ."
20210422_episood_5_elu_surm_ja_kanade_lestus,0,M,83.633,noh,"Kusjuures ma ise ma just hiljuti mõtlesin selle peale , et kevadel ma olin nagu sellel seisukohal , et noh Okei , toetame siis seda turismi ja hotellisektorit , sest see on nagu justkui riigi mõistes selline strateegiline loogiline sektor ."
20210422_episood_5_elu_surm_ja_kanade_lestus,0,M,83.633,noh,"Aga , aga jah , noh , eks ta nii läks , noh ."
20210422_episood_5_elu_surm_ja_kanade_lestus,0,M,83.633,noh,"Siis ta siis paremal küsis , et noh , vot nightClave , et sa oled ka nagu paar men ."
20210422_episood_5_elu_surm_ja_kanade_lestus,0,M,83.633,noh,"Nojah , selles mõttes , eks see on ka eks ta on ka ehitatud oli ehitatud niisugusel , et noh , tegelikult need siis natuke raskemas olukorras kultuuriettevõtjad , siis tegid selle asja valmis ja siis need kultuuriinimesed said siis teha noh , kellel ka sama raske oli , ehk siis noh , tegelikult see oli mingit niisugust rahaliikumist kui sellest otseselt väga suurt ilmselt ei olnud see elaski toetuste peal ja kui kellelgi ei olegi muusika , inimene kuulub muusikainimest kellelegi nagu toetada ei oleks , siis siis ta sinna seisma jääb ka nagu ."
20210422_episood_5_elu_surm_ja_kanade_lestus,0,M,83.633,noh,"Võtame kõik üksipulgi lahti ja hakkame vaatama , mis asi nüüd siin valesti võis minna või kuidas saab , mida paremini või kes ütles , et miks üks ütles , et kanal natuke kuiv , miks ta , miks ta on kuiv , noh , me näeme seal pärast tagantjärgi ära , kaua , kaua , kaua see transport sinna viis või või noh , et kuidas , et me lahkame , lahkame kõiki neid asju , et et see on ka nagu suht suht pull nagu lähenemine , et , et et jäigi mõte , et kui teha , siis teeme seda hästi ja , ja kui hästi ei tee , siis ei tee , et täpselt samamoodi , et kui meil näiteks üks nädal oli samamoodi Viljandis kastmed hakkasid otsa saama , kana veel on , kõike on , inimesed tellivad ja näiteks originaalkaste sai otsa ."
20210422_episood_5_elu_surm_ja_kanade_lestus,0,M,83.633,noh,"Ma just mõtlesin nagu seda , et noh , sa ju sa ütlesid , et detsembris tuli idee , et praegu meil on aprilli algus ."
20210422_episood_5_elu_surm_ja_kanade_lestus,0,M,83.633,noh,"Et kas , kas , noh , kas , kas see nagu riskantne veits ei ole või , või kuidas sa ise arvad ?"
20210422_episood_5_elu_surm_ja_kanade_lestus,0,M,83.633,noh,"Enne me ei tahtnudki üldse kuskile Tartust välja laieneda , kui , kui see esialgne menüü ei ole paigas ja et me ei aja seda suureks , et et noh , ma olen näinud igasuguseid putkasid , kus on terve sein on menüüd täis , siis ma mõtlen , et kuidas see tooraine sinna sisse ära mahub , vaata ."
20210422_episood_5_elu_surm_ja_kanade_lestus,0,M,83.633,noh,"Aga ei jaa , mul on , mul on nagu selles mõttes , mul on nagu hästi äge tiim ja , ja eks ma ise olen ka nagu hunt , kriimsilm , et ma räägin , et ma ei , ma ei viitsi nagu ühe koha peal passida ja ja , ja teine asi , mida ma soovitan ka kõigile , et kes ütleme sellist mõttetööd ja ja ütleme Tahab nagu , kui palju teha , siis ma soovitan teha tööd öösiti siis segavaid faktoreid 100 korda vähem , et l juba mitukümmend aastat niimoodi , et noh , ma ise olin ju DJ varem kunagi ja , ja , ja ja mina elan niimoodi , et ma lähen hommiku nelja-viie ajal magama ja ärkan lõuna ajal iga päev niimoodi , et see ütleme südaööst kuni kella viieni , see on minu kõige produktiivsem aeg , nagu siis ma saan rahulikult teha ."
20200505_episood_10__estpluatatsioon_november__malev,9,M,5.1418333333333335,noh,"Professionaalsed näitlejad , et noh , tõde ja õigusega sellist asja ei tehtud ."
20200505_episood_10__estpluatatsioon_november__malev,9,M,5.1418333333333335,noh,"Ja põhimõtteliselt tegelikult see film selle raamatu levile või selle raamatu nii-öelda taas populaarseks saamisele eriti nagu kaasa ei aidanud tegelikult uue sihtgrupi ees on ju , kes on meist nooremad inimesed jah , sest noh , see on küll ."
20200505_episood_10__estpluatatsioon_november__malev,10,M,4.069833333333334,noh,"Et noh , et see ongi mingis mõttes on , noh , võib võrrelda sellega , et november tegi sama asja , ta ei suutnud tuua seda said kuigi vaadake positiivsetest asjadest , ka need , kuidas kratte oli tehtud ."
20200505_episood_10__estpluatatsioon_november__malev,15,M,7.989833333333339,noh,"Aga mis ei ole absoluutselt läbi mõeldud selles suhtes , et sul on naine , mis sul järgmises stseenis on hunt , kes jookseb ringi lihtsalt mööda talve põhimõtteliselt või noh , vabandust , novembri hilissügist on ju ?"
20200505_episood_10__estpluatatsioon_november__malev,17,M,7.306666666666668,noh,"Et noh , see , ma saan nagu aru sellest , ma saan mingis mõttes aru , et see kunstlik vabadus absoluutselt ja noh , siin ongi nagu see , et mul ei ole nagu kerge võtta mingisugust ühe ühe ühe jala seisukohta ja teisest nurgast ma saan väga hästi aru ka sellest , kui inimesed ütlevad , et noh , tehke rahvale ka , vaata et see ei tähenda ju alati seda , et see peab olema mingisugune meie mees , uus album ."
20200505_episood_10__estpluatatsioon_november__malev,18,M,10.637833333333331,noh,"Niisugune kangelane oli a la noh , ta on Conan Conan de berberian , noh , lihtsalt see , et võeti vastaste kätte ja siis ta õpib vastaste käes , siis tuleb koju tagasi , et umbes oma oma inimesed ära päästa ."
20200505_episood_10__estpluatatsioon_november__malev,20,M,7.633000000000008,noh,"Jaa , aga nagu selle selle klassi kokkutulekuga on küll see , et see formaat on sisse ostetud , noh okei , see selleks , aga mind veits ajas kettasse see , et hakkas muutuma Eesti kiiret vihasteks , nagu et noh , teeme veel , teeme klassi kokkutulek , neli teeme klassikokkutulek viis , et umbes nagu rohkem asju ei saa enam üldse teha , nagu see on nagu ainukene komöödiaar , mis me nüüd teeme edaspidi ."
20200505_episood_10__estpluatatsioon_november__malev,20,M,7.633000000000008,noh,"Jaa , aga nagu selle selle klassi kokkutulekuga on küll see , et see formaat on sisse ostetud , noh okei , see selleks , aga mind veits ajas kettasse see , et hakkas muutuma Eesti kiiret vihasteks , nagu et noh , teeme veel , teeme klassi kokkutulek , neli teeme klassikokkutulek viis , et umbes nagu rohkem asju ei saa enam üldse teha , nagu see on nagu ainukene komöödiaar , mis me nüüd teeme edaspidi ."
20200505_episood_10__estpluatatsioon_november__malev,21,M,1.1978333333333315,noh,"Et ja noh See on kuidagi Ülikarismaatiline , kuigi see film ise suht sit nagu ja ta on ülilähenetav ja ta on ülimeeldejääv ka , sest seda ei juhtu tihtipeale ma mäletan , kui keegi palub mul malevast mingi seik öelda või kes seal näitles , tegelaste nimed on ju tsiteerida seda natukene , mul tuleb kohe peast nagu ."
20200505_episood_10__estpluatatsioon_november__malev,23,M,6.308166666666663,noh,"Jällegi seal on Sharmi , aga noh See on , mis ta on , on ju ?"
20200505_episood_10__estpluatatsioon_november__malev,23,M,6.308166666666663,noh,"Ei minu poolt saab ka kolm , viiest see noh , see on lihtsalt , no ei , tuleb ikkagi jääda objektiivseks , et sa ei saa ."
20200505_episood_10__estpluatatsioon_november__malev,23,M,6.308166666666663,noh,"Jah , täpselt , et noh , mingi sellised emotsioonid , et ma ei saanud mitte midagi aru , aga mulle meeldis ja ma tahan veel ."
20220104_mehed_ei_nuta_kontaveidi_fnnid_liialdasid_vehklejate_rappimisega_spordiaasta_suured_ksimused,0,M,6.2645,noh,"Päris asju , kui nagu päriselt , noh , tulid Eestisse siis ma vaatasin küll siis ad olid küll naljakas ."
20220104_mehed_ei_nuta_kontaveidi_fnnid_liialdasid_vehklejate_rappimisega_spordiaasta_suured_ksimused,0,M,6.2645,noh,"Ei , noh , see , sa oledki enda jast kõik paika mõtelnud , nojah , see on eelnevalt ."
20220104_mehed_ei_nuta_kontaveidi_fnnid_liialdasid_vehklejate_rappimisega_spordiaasta_suured_ksimused,1,M,15.986666666666665,noh,"On jah , et noh , ma olen nagu 100 100 protsenti nõus nagu selle kommentaariga , mida Märt kirjutas , et et üks asi on head vaidlust pidada ja , ja käia neid argumente edasi-tagasi ja kui ära ei tüüta , siis iga aasta kas või teha seda ."
20220104_mehed_ei_nuta_kontaveidi_fnnid_liialdasid_vehklejate_rappimisega_spordiaasta_suured_ksimused,1,M,15.986666666666665,noh,"No lihtsalt noh , nagu me näeme seda lainena praegu , et kui tuleb see üks-kaks sul võistkonda , siis on aja küsimus , enamasti kui see üks-kaks kasvab viieks kuueks või hokimeeskonna puhul ilmselt veel üle 10 Just et , et noh Ma ma isiklikult arvan , et olümpiamängud algavad ja kuidagimoodi ka lõpevad , aga , aga mis seal toimuma hakkab , noh , seda me , ma lähen kahjuks koha peale vaatama ."
20220104_mehed_ei_nuta_kontaveidi_fnnid_liialdasid_vehklejate_rappimisega_spordiaasta_suured_ksimused,1,M,15.986666666666665,noh,"On jah , et aga ka kõige rõõmsam selle uudise juures minu arust on ikkagi see just , et et noh , meie koondis on tegemas läbi ilmselgelt põlvkondade vahetust ja , ja see sidemängija küsimus noh , oli üks valus öelda valusamaid meie jaoks siin kodusel EM-finaalturniiril , eks , et et kui nüüd üks kahest meie Kert Toobali mantlipärijast saab sellise sammu oma karjääris teha , siis , siis selles sisaldub justkui nagu lootust päris palju ka meie koondise tuleviku jaoks ."
20220104_mehed_ei_nuta_kontaveidi_fnnid_liialdasid_vehklejate_rappimisega_spordiaasta_suured_ksimused,2,M,14.309833333333332,noh,"No kuskil ikkagi peaks hakkama see nagu kell ka tiksuma , et noh , nagunii ega ka Itaalias ta väga palju mängida ju hooaja alguses ei saanud , onju , et nüüd iga nädal põhimõtteliselt , mis läheb mööda ilma otsuseta ja ilma mingisuguse Satsiga liitumiseta , no on , on tegelikult selles vanuses ikka suhteliselt nagu hapu lugu , koondise aken ka aina läheneb ."
20220104_mehed_ei_nuta_kontaveidi_fnnid_liialdasid_vehklejate_rappimisega_spordiaasta_suured_ksimused,2,M,14.309833333333332,noh,"Ja jah , aga tegelikult see , see on nagu tava , et , et rallisõitjatele kingitakse kingitakse need autod , millega nad siis maailmameistriks tulnud , noh , Tommy Mäginen on , eks oma Mitsubishi ja ja , ja kellel siin on ?"
20220104_mehed_ei_nuta_kontaveidi_fnnid_liialdasid_vehklejate_rappimisega_spordiaasta_suured_ksimused,3,M,25.564166666666665,noh,"Ja ei seda kindlasti , et aga noh vaevalt et Allar Levandi veel kuhugi tagasi tuleb ja Ago Markvart Aga võiks küll , ei no ütleme Tore on mõelda aga selline sportlane , kes võiks nagu päriselt päriselt tagasi tulla , ehk et ta tuleb tagasi ja , ja jõuab , noh ma ei ütle päris kunagi kunagise tipptasemele , aga nagu selle lähedale noh , et selliseid sportlasi selles vanuses ikka noh , no tegelikult ei olegi ."
20220104_mehed_ei_nuta_kontaveidi_fnnid_liialdasid_vehklejate_rappimisega_spordiaasta_suured_ksimused,3,M,25.564166666666665,noh,"Ja see on päris äge , tuleb vaadata , et kuidas neil seal nagu välja kukub Ja , ja kui kas meie sinuga seal toimetuses või kuidas arutasime , et kui Kristiina miku suusad jalga paneks , istikatele tuleks ja praegust suusaseisu arvestades et noh , võiks ka seal ju üht-teist teha ."
20220104_mehed_ei_nuta_kontaveidi_fnnid_liialdasid_vehklejate_rappimisega_spordiaasta_suured_ksimused,3,M,25.564166666666665,noh,"Mäletad , kui see Julia Beljajeva ja Erika Kirpu kaks aastat hiljem , kui ta sinna naiskond tuli , et noh , millised kollanokad nad kõik olid ja sa meenutad , kuidas sa rääkisid , küsisid , tegid nendega juttu ja kõik ja nüüd on olümpiavõitjad ."
20220104_mehed_ei_nuta_kontaveidi_fnnid_liialdasid_vehklejate_rappimisega_spordiaasta_suured_ksimused,4,M,2.4730000000000016,noh,"Ja , ja kui selgub , et Hyundai või sport on paremad , siis noh , kes sealt maailmameistriks ainukene , kes ma sealt näen , on Elfin Evans ."
20200524_see_on_ikkagi_hiphopi_saade_056_24052020,11,M,6.058666666666666,noh,"Meil on Pärnu saade ja , ja meil on , meil on Pärnu saade igatahes selle hiphophääletuse kohta tahtsin veel seda öelda , et kõik Pärnu teema , mis listi jõudis , oli mul oli rusikas üleval ja jube et noh , seal oli Kristjan , loomi oli tantsijatest me krüptolil ."
20200524_see_on_ikkagi_hiphopi_saade_056_24052020,34,M,13.362666666666662,noh,"Teda ma olen nõus kuulama igal pool kuni elu lõpuni suure tõenäosusega , et noh , see üks alustalade vend , mida ei ole öelda , et pigem jah , mitte tanklan , vaid just pastarand nagu ainuke vana , kes nagu mulle on tõsiselt meeldib ."
20190101_mehed_ei_nuta_suur_uusaastasaade_absoluutne_tde_ehk_eelmise_spordiaasta_top25_edetabel,2,M,38.38016666666667,noh,"No ikka on tore , kui oma mees mängib , kuigi noh , ütleme klubi on selline , noh , ütleme randga naer ei ole just see , mida nüüd peaks hirmsasti fännama , eks ole , või mida oleks siiamaani hirmsasti fännanud , aga ei tore värk ja , ja mees mängib noh ."
20190101_mehed_ei_nuta_suur_uusaastasaade_absoluutne_tde_ehk_eelmise_spordiaasta_top25_edetabel,2,M,38.38016666666667,noh,"No kusjuures , see ei ole ju selles mõttes loogiline , et ega me võime rääkida , et see suve võistlemine ja , ja suvesuusatamine , et noh , see , seda ei ole mõtet võrrelda lumel suusatamisega aga see ei olnud ka mingisugune umbluu ikkagi , et ta seal liikus korralikult ."
20190101_mehed_ei_nuta_suur_uusaastasaade_absoluutne_tde_ehk_eelmise_spordiaasta_top25_edetabel,2,M,38.38016666666667,noh,"Et , et , et noh , see maailm natukene toimib seal ja nii nagu poksimaailm mõnes mõttes toimib ikkagi natukene teistsuguste reeglite järgi , et , et seal üsna värske juhus oli Seal on selline vend nagu vist oli John Jones üks üks kõvemaid mehi , kes on korduvalt jäänud dopinguga vahele ja saanud mingid võistluskeeldu ja asju ."
20190101_mehed_ei_nuta_suur_uusaastasaade_absoluutne_tde_ehk_eelmise_spordiaasta_top25_edetabel,2,M,38.38016666666667,noh,"Et eks Kaia Kanepi on nagu palju andnud ka Eesti tennisele , et noh , tegelikult võib-olla noh , teadma kõiki detaile asja juures , ma leian küll , et oleks võinud selle raha ikkagi leida ."
20190101_mehed_ei_nuta_suur_uusaastasaade_absoluutne_tde_ehk_eelmise_spordiaasta_top25_edetabel,2,M,38.38016666666667,noh,"Sest sa noh , sa ei , sa ei tuleks selle peale , kui sa vaatad Raivo ja tammele otsa poolteist aastat tagasi , et , et see mees üldse on suuteline selliseid asju tegema ja , ja see ei ole ainult minusugune kõrvaltvaataja , vaid isegi spetsialistid ."
20190101_mehed_ei_nuta_suur_uusaastasaade_absoluutne_tde_ehk_eelmise_spordiaasta_top25_edetabel,2,M,38.38016666666667,noh,"Ja kui ta kirjeldab , et , et pikk treeninglaager ja iga päev jooksis mingi ligi 40 kilomeetrit ja siis 10. päeval on juba vaim niimoodi , et kõik piiri peal siit enam edasi ei lähe ja vot edasi viibki see , kui sa suudad vaimu nii ja siis kuidas ta kirjeldas , et noh , et kõige raskem on allamäge jooks ja ütles , et noh , mitmed varbaküüned tulid küljest ära , eks , ja kõik nii ja vend räägib täiesti rahulikult , eks ."
20190101_mehed_ei_nuta_suur_uusaastasaade_absoluutne_tde_ehk_eelmise_spordiaasta_top25_edetabel,2,M,38.38016666666667,noh,"No vägev , aga ütleme , see , see on niisugune huvitav asi , et jah , et Vipsi arengut on huvitav vaadata muidugi , ja , ja sõitis tublisti seal sel hooajal oma sarjas ka , aga , aga ainuüksi see , et ta sinna reetpulli sai , nüüd , ega see ei ole veel mingi garantii , et ta nüüd kuhugi veel jõuab , eks ole , nüüd on vaja arengut jätkata , mis see protsent oli 17 vist , eks ole , kes nendest jõuab siis vormel ühte , noh , tegelikult ei ole nii , väike protsent , aga ei ole ülemäära suur muidugi , et 10-st ikkagi 10-st siis isegi ."
20190101_mehed_ei_nuta_suur_uusaastasaade_absoluutne_tde_ehk_eelmise_spordiaasta_top25_edetabel,2,M,38.38016666666667,noh,"See on nagu totrus , tegelikult kõik saavad ju aru , et tema tase ei ole ju seal , aga miks ta siis seal peab olema , noh , see on ."
20190101_mehed_ei_nuta_suur_uusaastasaade_absoluutne_tde_ehk_eelmise_spordiaasta_top25_edetabel,2,M,38.38016666666667,noh,"Ja natuke muidugi , eks Vassiljev enda jäärapäisues on ka natuke asi kinni , et noh no kurat , kui sa , spordimees , no mida sa jamad seal anna siis järgi ja ja , ja ."
20190101_mehed_ei_nuta_suur_uusaastasaade_absoluutne_tde_ehk_eelmise_spordiaasta_top25_edetabel,2,M,38.38016666666667,noh,"No kahjuks lihtsalt ei tea , kui suured käärid seal nüüd klubi ja Vassiljevi nõudmiste vahel nagu on , et noh üks üks äärmuslik olla see , et kõik see palk , mis on vaja veel nii-öelda lepingu lõpuni kätte saada , et isegi kui ma lähen ära , siis makske mulle see välja , see ei ole ebatavaline tegelikult lepingute seas , et noh , vaatame palju siin Murino näiteks Manchester unitedist kinga saamise eest veel raha peale sai , see võrdlus ei ole päris , aga no ütleme , see , see nagu see on tegelikult üks muster , mismoodi lepinguid lõpetatakse , kui klubi ikka väga tahab ja noh , siis on teine , teine pool , eks ole , kus võib-olla klubi , kes ütleb , et okei , võid ära minna , aga me ei maksa sulle sentigi , eks ."
20190101_mehed_ei_nuta_suur_uusaastasaade_absoluutne_tde_ehk_eelmise_spordiaasta_top25_edetabel,2,M,38.38016666666667,noh,"Anvar Samosti saadet raadiost ja seal räägiti sellest puidu rafineerimistehase loost ja sellest , et et noh , jah , kuskilt paistab küll , et see asi võibolla , et seal kuskil on veel mingi maailm , millest tegelikult ajakirjandus ei ole suutnud nagu läbi hammustada ennast alates sellest , et mis oli võibolla kogu selles tehase ärajäämises Tehase nagu ettevõtluse mõttes konkurentide roll näiteks kuskil nagu nii-öelda nagu kulisside taga niiditõmbajana , onju , aga vot seda me ei tea ."
20190101_mehed_ei_nuta_suur_uusaastasaade_absoluutne_tde_ehk_eelmise_spordiaasta_top25_edetabel,2,M,38.38016666666667,noh,"Paraku , elu on selline , et noh , sina oled ju tegelikult see , kes määrab tennisist , on see , kes määrab ."
