episode_id,section_index,gender,minutes,tunnus,lause
20220216_kristina_kallas_eesti_200_ei_tegele_kersti_kaljulaiu_teemaga,0,F,20.730666666666668,noh,"Kui me ainult toimetame selliste nelja-aastastes tsüklitega , mida vanad erakonnad päris tihti teevad , et noh , mida me nelja aasta jooksul suudame inimestele ära lubada , selle paneme valimisprogrammi sisse , ülejäänud asjadega ei tegele , aga ülejäänud asjad on jäetud tegeleda ametnikkonnale ."
20220308_sodiaagisosinad_07031303_tundekllane_ndalalpp_loob_unenolise_atmosfri,0,F,17.593000000000004,noh,"Ka sellist , pigem nagu tunnete väljendamiseks ja tundemaailma väljendamiseks , et kui tahad väljendada midagi abstraktset ja et noh , aga see ei sobi nagu hästi selliste numbritega ega tegelemiseks ja nagu mingi sellise ütleme , kas see finantspoolega tegelemine on natukene keerulisem sellel ajal ja nagu raamatupidamine ja kõik selline asi on raskendatud , et noh , võib tulla igasuguseid veidrusi sinna sisse , et mõistus töötab nagu teisel tasandil Õnneks läheb Merkuur muidugi kuu lõpus juba jää ."
20220308_sodiaagisosinad_07031303_tundekllane_ndalalpp_loob_unenolise_atmosfri,0,F,17.593000000000004,noh,"Et see on nagu see hea pool , aga noh , jah , siin on ka ka see päris suurnukuga oht on just nimelt see , et ."
20220308_sodiaagisosinad_07031303_tundekllane_ndalalpp_loob_unenolise_atmosfri,2,F,15.383333333333333,noh,"Läheb hästi nagu jah , kui ta loob selle kontakti , ta läheb sinna hästi sisse nagu , et noh , tahab nagu nagu lõpuni minna kõiges ."
20220308_sodiaagisosinad_07031303_tundekllane_ndalalpp_loob_unenolise_atmosfri,2,F,15.383333333333333,noh,"Ja mõnes mõttes , kui , nagu suhetes see sünastrias on aktiveeritud see kupido , aga ütleme , et on ka muud asjad , mis selle suhte tugevaks teevad siis iseenesest see kupido igal juhul ta lisab sellist särtsu ja sellist põnevust ja lisab seda , et , et selles suhtes ei hakka jah , võib-olla igav , et , et noh , see võib aeg-ajalt neid nooli nagu uuesti tulla ja niimoodi , et tuleb ja läheb , aga et ta nagu selline jah , et ta võib-olla hoiab nagu suhte natukene ka noorusliku ja värskena tegelikult kui seal on natukene kupidot sees ."
20220308_sodiaagisosinad_07031303_tundekllane_ndalalpp_loob_unenolise_atmosfri,2,F,15.383333333333333,noh,"Ja võibolla isegi jah , sinu , sinu , see salarelv on ka sinu , see jah , sinu fantaasia , sinu maagia nagu tegelikult , sest noh , kalad on ka selline maagiline ."
20190408_68_saade__hingamisterapeudid_annavad_npuniteid_kuidas_end_terveks_ja_nnelikuks_hingata,0,F,39.77,noh,"Kui kuulan siin silmad on nullis peas , noh , mina olen nagu aru saanud , et me lihtsalt hingame valesti , et naised siin ei hingamisavalt kõhuga , vaid oma kaelaga , tood selle hingamise kaela , on ju ."
20190408_68_saade__hingamisterapeudid_annavad_npuniteid_kuidas_end_terveks_ja_nnelikuks_hingata,0,F,39.77,noh,"Ma tahtsin veel lisada selle kohta , et noh , öeldakse või no nagu kui rääkida sellest , et kuidas see sünnikogemus meid mõjutab , et siis nagu nagu sa ütlesid ka , et loed , et siis on nagu okei , aga kui sa päriselt ka kujutab ette , nagu sa ütlesid , et tuleb , et beebi tuleb sealt sellest sünnikanalist läbi , ta teeb tööd ja siis meie ajal , kui me sündisime , siis arvati , et beebi ei ole teadlik , eks ju , et lihtsalt on üks keha ja tuleb sealt teisest kehast välja ja ja , ja ema ka ei olnud tavaliselt kontaktis endaga ega beebiga ja mõtles , et tema siin teeb seda üksi peab siin siin tundma kõike seda , eks ju , intensiivselt ja siis beebi ikkagi ka püüdis kaasa aidata ja kui ta siis lõpuks välja saab , on hoopis sellest soojast hoitud , hoitud toetatud keskkonnast , kus tal on kõik seal hapnik ja , ja söök ja kõik on olemas , eks ju , ja soojas vees mõnus kaitstud toitu tunne ja siis tuleb siia välja siis noh , et mida siis tavaliselt tehti , eks ju , kohe hakati seal hõõruma seal külma hoopis külmemas keskkonnas ilma kaalu peale ja valgus on ."
20190408_68_saade__hingamisterapeudid_annavad_npuniteid_kuidas_end_terveks_ja_nnelikuks_hingata,0,F,39.77,noh,"Ei ole enam üldse turvaline , noh , see on see esimene mõte , võib-olla , et see elu ikka ei ole turvaline , eks ju , siin teises keskkonnas ja , ja siis ja siis järsku peab hingama just kohe selle hingamisega seotud süsteem , eks ju , tööle hakkama , ilma et ta saaks nagu rahulikult läbi nabanööri veel hingata ja siis hakata harjuma , et ahah , et mul on nüüd kopsud ja nüüd ma hakkan neid natuke nagu laiendama ja , ja õhku sinna laskma , et selle sedasi saab ka hingata , et siis hiljem nagu see nabanöör läbi lõigata ."
20210220_podcast_noorteaken_4__vaimne_tervis,2,F,48.436166666666665,noh,"Mantlipärijad saavad edasi arendada , et noh , tegelikult ka see , et kuidas me enda liikmeid nagu veel paremini kaasame ja et kuna meil on nii palju ägedaid noori , kes tahavad ise midagi nagu selles valdkonnas muuta , et kuidas me neid kõige paremini toetame ja tõesti nende tegudeni aitame , et ma arvan , et see on ka niisugune arengu arengukoht tegelikult no ressursi rakendamine ."
20210220_podcast_noorteaken_4__vaimne_tervis,2,F,48.436166666666665,noh,"Ka on hästi individuaalsed , et noh , võtame hästi lihtsa näite mida depressioon tihti mõjutab , mõjutab söögiisu , näiteks mõne inimese puhul ühes suunas mõne inimese puhul teises suunas , kes , kellel , kellel nagu kaob toit , söögiisu pigem pigem ära , kellel läheb see rohkem selliseks näiteks , et nagu püüan seda , seda ."
20210220_podcast_noorteaken_4__vaimne_tervis,2,F,48.436166666666665,noh,"Ja , ja on kindlasti selliseid riskitegureid mis nagu soodustavad erinevate murede või selliste ga tõesti vaimse tervise häirete teket ja neist hästi paljud tulenevad ka lapseeast , sest et Meie ajud tegelevad arenemisega väga-väga-väga intensiivselt nagu tegelikult kuni mingi 25. eluaastani välja aga veel eriti selles mingi esimese kolme eluaasta jooksul , nii et kui , kui nooruses nagu oleme , noh , inimesed on trauma sid kogenud , keda on näiteks ka väärkoheldud või , või ka tegelikult ei pea olema üldse nii nii-öelda Nii nii sünge sünge juhtum või ebatavaline , aga ka see , näiteks , et vanemate vanemate lahutused Lihtsalt see , et kui me jääme mingitest olulistest , teistest suhetest , sõpradest , sõpradest , ilma , Kasvamine tegelikult näiteks ka asenduskodus ehk et ehk et kõik sellised ebakindlad ja mitteturvalised suhted näiteks lapsepõlves , et need , need annavad väikse riskiteguri riskiteguri juurde ja , ja mis noh omakorda ."
20210220_podcast_noorteaken_4__vaimne_tervis,2,F,48.436166666666665,noh,"Aga aga jah , et noh , et ühelt ühelt poolt , et kui nagu neid erroreid on sisse sisse tulnud ja et noh , me ei saa muuta seda , millises perekonnas me üles kasvasime ."
20210220_podcast_noorteaken_4__vaimne_tervis,4,F,37.53383333333333,noh,"Ehk et kui midagi jääb nagu , nagu et noh , täitsa tegemata , kui on midagi , mis sind nagu pidevalt mõtetes mõtetes häirib , kui näiteks meeleolu madalam juba no ütleme paar nädalat ."
20210220_podcast_noorteaken_4__vaimne_tervis,4,F,37.53383333333333,noh,"Kõik need kontaktid , kus saab ka nagu vaadata , on ju , aga aga kuidas selline kiire nagu , kuidas me saame oma vaimset tervist hoida , selline kiire hügieeni , mida me saaks iga päev kõik teha , on ju , et noh , hamba hambapesu hambapesuks , aga nagu mis on see , et kuidas me saaks oma vaimset tervist nagu hoida , et Ta jääks nagu mina võin ühe soovitasin öelda , et mina mulle meeldib joonistada ja maalida , näiteks tegema siis teen seda , et kui mul on nagu päris halb olla , siis ma võtan kätte ja maalin või kaunistan midagi või mis ma olen hiljuti avastanud , mulle meeldib hullult neid ."
20210220_podcast_noorteaken_4__vaimne_tervis,4,F,37.53383333333333,noh,"No kui tema tõi välja siin maalimise , siis üldse oma hobiga tegelemine kas või 10 minutit , selleks võib olla lugemine , kiire trenn , joonistamine , kudumine , noh , tegelikult seal võib olla ikkagi väga palju ."
20210220_podcast_noorteaken_4__vaimne_tervis,4,F,37.53383333333333,noh,"Nagu vau , see meeldib proovida uusi asju , seega toob positiivset emotsiooni sellise Sa saad rutiinist välja , mis väga oluline tegelikult , et noh , proovid uusi maitseid , loed asju nagu imelikust pidi , nagu väga paljudele näiteks meeldib see , et ma võtan neist suvaka raamatu hakkab , kes käib lugema lihtsalt ju ."
20210220_podcast_noorteaken_4__vaimne_tervis,4,F,37.53383333333333,noh,"Kuidas , kui minu lähedane näiteks on kimpus , kuidas on see , mis on see esimene asi , mida mina saan teha selleks , et teda suunata kuhugile nagu parem , et , et ta ei jääks üksinda , et soovitus nüüd , et kui mõni vaataja näiteks või kuulaja arvab , et või tunneb , et tema sõber on kuidagi väga väga madalale endaga jäänud , siis mis on see , mida tema saaks teha lisaks sellele , et ta läheb ja küsib talt näiteks , on ju , et kuidas sul päriselt läheb või et lohutab teda või midagi sellist , et noh , kuidas saaks nagu , võimalikult efektiivselt nagu aidata ja samas , et sa ei teeks ka nagu endale haiget sellega , et et sa võtad tema mured endale ja pärast oled sina see , kes on , vajab hoopis nagu siin abi , et mis see oleks , see soovitus , et ."
20210220_podcast_noorteaken_4__vaimne_tervis,4,F,37.53383333333333,noh,"Et väga tihti näiteks me lähme üldse kuhugile välja sööma , kus on vähe rahvast , noh , räägid rahulikult omaette või näiteks kevadisel perioodil Emajõe äärde lihtsalt saad võtta omaette , täiesti oma aja , võtta oma sellised oma hetke söögi kõik selline õhkkond on hoopis teine kui see , et sa koolis mööda minnes küsid ."
20210220_podcast_noorteaken_4__vaimne_tervis,4,F,37.53383333333333,noh,"Ja , ja tõesti muudest tegevustest osa saada , igasugused koolitused , üritused , matkad , mis iganes ideid tuleb ja ma arvan , et meil on väga palju liikmeid , kes on leidnud endale oma mõttekaaslasi ja just oma hobidega , klappivaid inimesi , et väga paljud on saanud sellised lähemaid sõpru kaasa mina ise , et noh , selles mõttes , et sa , kuna sa tutvud väga paljude erinevate inimestega , siis sa võid ka sealt oodata , et sind aktsepteeritakse nii nagu sa oled ."
20190417_73_saade__risti_nia_maagilised_vlusnumid_rasketeks_hetkedeks,0,F,2.8245,noh,"Niivõrd-kuivõrd , ma olin 60-st lõpuks kaheksas , kaheksas päris hästi ja ma olin kaheksas saates kuues kokku , nii et päris hästi tegelikult , sest noh , iga see võttepäev oli ju terve suvi , neid möllasid ."
20190417_73_saade__risti_nia_maagilised_vlusnumid_rasketeks_hetkedeks,1,F,12.842666666666668,noh,"Ja ei , selge , mõned möödalaskmised olid ka , aga ma olin alles Võnnus ja siis mulle nüüd noh , rahvaga kohtumas me käisime ja siis mulle meenus , mida ma tegelikult ju rääkisin , eks ole , seal ja ma tean ka hiljem tagasisidet selle pere käest , et noh , mis sealt poolt tuli ja siis , kui ma nägin , et minust oli kolmveerand lõppkokkuvõtteks saates pärast noh , välja lõigatud , siis selge , et keegi võitma , keegi peab kaotama , et , et meil ei olnud nii suuri lõhesid , kui oli , ütleme , saates kokkupanduna seda küll ."
20190417_73_saade__risti_nia_maagilised_vlusnumid_rasketeks_hetkedeks,1,F,12.842666666666668,noh,"Et ma öösel näen mingit jumala kuni ja siis tuleb päeval mul klient , eks ole , siis ma tean juba , et ahhaa nüüd on see Aga kuidas selle unenägudega ikkagi on , vaata , räägitakse ju , et on mingid teatavad sümbolid , mida sa näed , noh , mida praktiliselt kõik näevad ja mis tähendavad ühte ja sedasama või et , et ma näen näiteks , et ma astun sopa sisse , see tähendab , et ma jään haigeks või et ma söön maasikat , see tähendab , et mul hakkab kurk valutama ."
20190417_73_saade__risti_nia_maagilised_vlusnumid_rasketeks_hetkedeks,2,F,4.082666666666667,noh,"Teate , mis ma kogu selle loo peale kokku ütlen , et me neid kaarte paneme , mul on absoluutselt igasugune kaardipanemise isu kaob ära , mul on see varem ka olnud , et et miks ma ei käi kunagi ennustajate selgeltnägijate juures ja asjade juures , et ma isegi ei taha seda teada , et kui sealt nüüd tulevad sellised asjad , noh see võib kõik väga tore olla , ma võin ükskõik mida rääkida , et ma pean selleks valmistuma ja vot siis võib-olla pehmendan seda ."
20190417_73_saade__risti_nia_maagilised_vlusnumid_rasketeks_hetkedeks,2,F,4.082666666666667,noh,"Aga ma räägin praegu ma räägin praegu , kui inimene tuleb isiklikule vastuvõtule , kas siis on neid asju , millest sa Ka siis ma ei torgi nii-öelda kolmandaid inimesi , et kui ta küsib , kuidas mu poja tervis läheb haiglas raskes seisus või midagi sellist , et ma võtan , ma vaatan , millise kaardi ma võtan ja ma tean , et kui ma oleneb inimese vanusest , kes küsib , noh , ma ju ikkagi näen niidi vaata järgi ."
20190417_73_saade__risti_nia_maagilised_vlusnumid_rasketeks_hetkedeks,2,F,4.082666666666667,noh,"Ja selle loo järgi , kuidas ta küsib , mida ta küsib , mida talle vaja on tegelikkuses võib-olla hoopis et noh , selles mõttes mul on neid kaardipakke ju kümmekond siin , et et siis ma vaatan , kuskohast ma selle vastuse ikkagi ütlen ."
20190417_73_saade__risti_nia_maagilised_vlusnumid_rasketeks_hetkedeks,4,F,22.668166666666664,noh,"Aga sina kindlasti sellise selgeltnägijana ei või kunagi võtta sellist seisukohta , on ju , et sa ütled kellelegi , et noh , ütlebki , et mul on joodikust mees ja sina ütled näiteks , jäta ta maha , paneme needuse peale ja sa ei tohi seda öelda , eksole ."
20190417_73_saade__risti_nia_maagilised_vlusnumid_rasketeks_hetkedeks,4,F,22.668166666666664,noh,"No ta ei lähe selles elus täid , aga pane ta kirja , ta suunab su mõtteid liikuma , avardab ja need on sinu soovid , jäta kõrvale kõik kämmad , aiad , laste soovid sellised , noh , neid ei pane sinna listi ."
20190417_73_saade__risti_nia_maagilised_vlusnumid_rasketeks_hetkedeks,4,F,22.668166666666664,noh,"Et kui sa ju tahad minna midagi õppima või noh , sa võid ju muuta oma elu , kui sa paned kirja , lähed sammudega väikeste sammudega iga päev oma unistuste suunas ."
20190417_73_saade__risti_nia_maagilised_vlusnumid_rasketeks_hetkedeks,4,F,22.668166666666664,noh,"Nii aga kui räägitakse ikkagi , et noh , mingit sellist uhuu juttu ma ei taha praegu noh , näiteid nii-öelda tuua ."
20190417_73_saade__risti_nia_maagilised_vlusnumid_rasketeks_hetkedeks,4,F,22.668166666666664,noh,"Ma nii värskelt ei kuulu , need inimesed Muidu saavad aru , on aga , aga selles mõttes , et noh , sul ei saa , mitu ."
20190417_73_saade__risti_nia_maagilised_vlusnumid_rasketeks_hetkedeks,4,F,22.668166666666664,noh,"Ja , ja ei ole seal mingit , noh , energia ei jookse sul teistpidi , et sa saad olla vanaema , sa saad elada järgmised võib olla 20 30 aastat ."
20190417_73_saade__risti_nia_maagilised_vlusnumid_rasketeks_hetkedeks,4,F,22.668166666666664,noh,"Et , et ma ütlen , ma olen ise selles mõttes loodusravi poolt , et on toetav , ma võtan ise ka , kui mul on kurk valus , raudrohu , teed seal või nurmenukku , panen kokku , et noh , see ei ole probleem , kui ma tunnen , ma olen nad farmakoloogias läbi õppinud , mul on vanaemade emade õpetussõnad , eks ole , kuidas midagi teha ."
20190417_73_saade__risti_nia_maagilised_vlusnumid_rasketeks_hetkedeks,4,F,22.668166666666664,noh,"Et jah , et alles oli ka , keegi küsis endale mingi selja kohta midagi , et noh , mingid luud või noh , kõhrad või ma ei tea , midagi , oli selja selgrooga ja siis ma ütlesin , et noh , et mingi arst oli talle selle diagnoosi pannud , siis ma mõtlesin , et mis ta saab teha , mõtlesin , mine uju kusagil ja siis ta küsis , et aga kas ma võin selle tervendaja juurde minna , et see teeb ka mingit sellist , eks ole , mõtlesin , kui sa usud , siis mine , aga mina soovitaks , et sa noh , teeks oma lihastele sinna kõrvale trenni , et nad hoiaks selga veel kõike seda poolt , noh , mida on vaja ja saab nagu soloogiliselt , et noh , sinna tervendaja juurde võid ka minna ."
20190417_73_saade__risti_nia_maagilised_vlusnumid_rasketeks_hetkedeks,4,F,22.668166666666664,noh,"Et jah , et alles oli ka , keegi küsis endale mingi selja kohta midagi , et noh , mingid luud või noh , kõhrad või ma ei tea , midagi , oli selja selgrooga ja siis ma ütlesin , et noh , et mingi arst oli talle selle diagnoosi pannud , siis ma mõtlesin , et mis ta saab teha , mõtlesin , mine uju kusagil ja siis ta küsis , et aga kas ma võin selle tervendaja juurde minna , et see teeb ka mingit sellist , eks ole , mõtlesin , kui sa usud , siis mine , aga mina soovitaks , et sa noh , teeks oma lihastele sinna kõrvale trenni , et nad hoiaks selga veel kõike seda poolt , noh , mida on vaja ja saab nagu soloogiliselt , et noh , sinna tervendaja juurde võid ka minna ."
20190417_73_saade__risti_nia_maagilised_vlusnumid_rasketeks_hetkedeks,4,F,22.668166666666664,noh,"Et jah , et alles oli ka , keegi küsis endale mingi selja kohta midagi , et noh , mingid luud või noh , kõhrad või ma ei tea , midagi , oli selja selgrooga ja siis ma ütlesin , et noh , et mingi arst oli talle selle diagnoosi pannud , siis ma mõtlesin , et mis ta saab teha , mõtlesin , mine uju kusagil ja siis ta küsis , et aga kas ma võin selle tervendaja juurde minna , et see teeb ka mingit sellist , eks ole , mõtlesin , kui sa usud , siis mine , aga mina soovitaks , et sa noh , teeks oma lihastele sinna kõrvale trenni , et nad hoiaks selga veel kõike seda poolt , noh , mida on vaja ja saab nagu soloogiliselt , et noh , sinna tervendaja juurde võid ka minna ."
20190417_73_saade__risti_nia_maagilised_vlusnumid_rasketeks_hetkedeks,4,F,22.668166666666664,noh,"Et jah , et alles oli ka , keegi küsis endale mingi selja kohta midagi , et noh , mingid luud või noh , kõhrad või ma ei tea , midagi , oli selja selgrooga ja siis ma ütlesin , et noh , et mingi arst oli talle selle diagnoosi pannud , siis ma mõtlesin , et mis ta saab teha , mõtlesin , mine uju kusagil ja siis ta küsis , et aga kas ma võin selle tervendaja juurde minna , et see teeb ka mingit sellist , eks ole , mõtlesin , kui sa usud , siis mine , aga mina soovitaks , et sa noh , teeks oma lihastele sinna kõrvale trenni , et nad hoiaks selga veel kõike seda poolt , noh , mida on vaja ja saab nagu soloogiliselt , et noh , sinna tervendaja juurde võid ka minna ."
20210405_podcast_noorteaken_7__nipid_isolatsioonis_toimetulekuks_ja_tuleviku_plaanide_tegemiseks,3,F,28.698666666666668,noh,"Et kindlasti see , et noh , enam-väga raamatuid ei ole ülikoolis , onju pane arvuti padja alla ja mine magama ."
20210405_podcast_noorteaken_7__nipid_isolatsioonis_toimetulekuks_ja_tuleviku_plaanide_tegemiseks,3,F,28.698666666666668,noh,"Selline omamoodi episood oli täna ausõna , sellepärast et selline kuidagi teistsugune vaip oli täna ilmselt see on ka sellest , et noh , kevad hakkab tulema ja see oli minu peres ."
20220223_kersti_kaljulaid_kas_mu_silmad_plevad_vimujanust,0,F,25.137,noh,"Ja ma ei ole niivõrd üllatunud , kuivõrd noh , ma olen mures , et äkki mõnikord ei ole ka , et eks ma olen ju sedagi kohanud ja kuulnud ka neid jutupunkte noh kasvõi Valgevene sanktsioonide puhul , et et no ei tea , et ikkagi tavalised inimesed ka kannatavad , eks ole , et noh , tuligi üle küsida nagu Svitlana Tsihhanovskajalt , et mis tema arvab , kas on mõistlik kehtestada nagu rangeid sanktsioone , eks ole ja noh , tema muidugi ütles , et jaa loomulikult , sest et noh , raha läheb ju režiimile , tavaline inimene niikuinii elab peaaegu naturaalmajanduslikult , eks ole ."
20220223_kersti_kaljulaid_kas_mu_silmad_plevad_vimujanust,0,F,25.137,noh,"Ja ma ei ole niivõrd üllatunud , kuivõrd noh , ma olen mures , et äkki mõnikord ei ole ka , et eks ma olen ju sedagi kohanud ja kuulnud ka neid jutupunkte noh kasvõi Valgevene sanktsioonide puhul , et et no ei tea , et ikkagi tavalised inimesed ka kannatavad , eks ole , et noh , tuligi üle küsida nagu Svitlana Tsihhanovskajalt , et mis tema arvab , kas on mõistlik kehtestada nagu rangeid sanktsioone , eks ole ja noh , tema muidugi ütles , et jaa loomulikult , sest et noh , raha läheb ju režiimile , tavaline inimene niikuinii elab peaaegu naturaalmajanduslikult , eks ole ."
20220223_kersti_kaljulaid_kas_mu_silmad_plevad_vimujanust,0,F,25.137,noh,"Ma seda ei tea või on midagi muutunud temas , et et maailm on täis riigimehi , kes on temaga kohtunud märksa hiljem kui mina , ma arvan , meil on palju parem arusaam sellest , mida ta mõtleb , aga me ei peaks üldse püüdma prognoosida ja kavandada , me peaksime tegelikult kogu aeg lootma parimat , aga valmistuma ikkagi halvimaks ehk et olema valmis ja võimelised toetama Ukrainat sellega , millega keegi saab , eks ole , kes välihaiglaga , kes rakettidega , eks ju , noh , see on selge , et Ukraina sõdima peab ise suur küsimus on , noh , kui motiveeritud , siis on Ukraina armee , nad tunduvad olevat äärmiselt motiveeritud ."
20220223_kersti_kaljulaid_kas_mu_silmad_plevad_vimujanust,0,F,25.137,noh,"Ma arvan , te jagati , et , et see võib nii olla , mul võib olla ka arusaam , noh , kuidas teha näiteks rohepööret , eks ole , kuidas toetada , kuidas toetada nõrgemaid selles , kuidas panna Kredex tööle tõeliselt ühistute heaks , mitte lasta ühistutel , eks ju , võidelda Kredexi rahade eest ja nimel kuidas , kuidas meie haridussüsteem võiks olla tuleviku kindlam , kus rohkem õpetatakse lastele inimeseks jäämise kõrget kunsti , eks ole , juba lasteaiast peale , mul võib olla väga palju selliseid mõtteid , aga nüüd ja vaadake mulle otsa , kas mu silmad põlevad võimujanust , kas teile tundub , et mina olen see inimene , kes oskab teha seda , mida on vaja teha selleks , et lükata teised kõrvale ja tulla võimule ?"
20220223_kersti_kaljulaid_kas_mu_silmad_plevad_vimujanust,0,F,25.137,noh,"See kokkulepe Taanieliga on viis aastat vana ja , ja see kujunes niimoodi , et , et me teame , et noh , tegelikult on kirjutatud presidendi rollist ja tema tööst enamasti ikka mõni raamat ja me tahtsime , et Taaniel oleks meiega sellel viieaastasel teekonnal kaasas , vaataks , mõtleks ja siis kirjutaks talle omasel moel , nii nagu me teame , Danielit on kirjutanud praktika , aruanne on suurepärane raamat minu arust väga vahva ."
20220223_kersti_kaljulaid_kas_mu_silmad_plevad_vimujanust,0,F,25.137,noh,"Ma ei mäleta seda , ma arvan , et seda hetke ei ole , et , et on hetki , kus sa , noh , alguses ma sain väga hästi aru , et Eesti rahva ootus oli pigem nagu allpool nulli , eks ole , sest et eesti rahvas mind ei tundnud , ajakirjandus võib-olla mõnevõrra paremini , eks ole ."
20220204_tahad_elada_oma_unistuste_elu_need_kaks_naist_aitavad_sul_seda_saavutada,1,F,40.18816666666667,noh,"Aga kui inimene saab iseendaga kontakti oma puhta olemuse ga siis ta avastab , et vau ikka , et noh , milline ta on ja milleks ta võimeline on ja milline ta potentsiaal on ja , ja nii edasi ."
20220204_tahad_elada_oma_unistuste_elu_need_kaks_naist_aitavad_sul_seda_saavutada,1,F,40.18816666666667,noh,"See võib olla siis ka näiteks see , et ütleme , et noh , näiteks mul kodus kõik korras , eks ju , suhe on harmooniline , kõik on hästi ."
20210911_arco_akadeemia_podcast__lhv_panga_vaade_kinnisvaraturule,0,F,24.052833333333336,noh,"No tundub , et me oleme kevadest tagasi , et vähemalt selle septembri alguse pealt on küll näha , et , et sellel aastal mingisuguseid ennustusi teha on päris keeruline , et kui tavapäraselt mingid loogikat kehtivad , et siis siis hetkel on väga palju uut selles aastas , et noh , esmakordselt laekus Eesti inimeste kontodele selline summa vaba raha nagu 1,3 miljardit eurot , et , et me saame näha , kuidas seda kasutatakse ."
20220203_dr_annika_uue_dr_aime_keis_kukkumise_traumadest_ja_emo_igapevasest_tst,0,F,23.404166666666665,noh,"Ja me hindame patsienti tervikuna , eks ole , et mitte ainult tema vigastatud piirkonda ja probleemi ja ütleme , millist sekkumist ta nagu vajab kas või sedasama valuravi , kuni ta ootab , eks ole , siis kabineti pääsemist see tegelikult juba ka triaaži ajal ja patsiendi registreerimisel üsna sageli tehakse kindlaks või siis ka patsient küsib ise selles suhtes , et kui tal näiteks on valu sündroom tugev , siis ta võib ka alati ise seda öelda kohe registreerimisel ja , ja talle siis võimaldatakse valuravi ja esmane siis selline sekku kuni siis ütleme , kui ta kuulub sinna rohelisse kategooriasse , eks ole , sest et , et alati valu ei tähenda seda , et võiks olla taga selline tõsine luumurd , sest noh , valu valu võib ka olla erinev , eks ole , ja valu tugevus võib olla erinev ."
20220203_dr_annika_uue_dr_aime_keis_kukkumise_traumadest_ja_emo_igapevasest_tst,0,F,23.404166666666665,noh,"Jaa , kindlasti , et seda ka öeldakse ja toonitatakse , et ärge libedega õue minge , aga noh , inimesed ikka lähevad nii , et kas siis hinnatakse ennast üle või tõesti on väga vaja minna , et noh , ütleme näiteks jõululaupäev , eks ole , ja kui on libe , siis no mitte mitte ükski asi ei takista inimest surnuaeda minemas , mis on üks üks väga suur risk kukkumiseks jällegi , sest et surnuaia teed on libedad , nii et jah , ütleme , et inimesi hoiatatakse , aga see on inimese enda valik , mis ta siis teeb ?"
20220203_dr_annika_uue_dr_aime_keis_kukkumise_traumadest_ja_emo_igapevasest_tst,0,F,23.404166666666665,noh,"Sageli kurdetakse selle üle , et noh , inimesed tõesti võib-olla ei peaks selle murega EMOsse tulema , et kas selles osas on midagi muutunud , viimasel ajal ?"
