episode_id,section_index,gender,minutes,tunnus,lause
20201108_juubel_75_075_08112020,12,M,2.1673333333333327,noh,"Kuule , aga siin oli veel Karl ka pidi ehitama sulle Tuupakiga , aga noh , Saabek võttis loo , ma võtsin igaks juhuks kaasa , sest ma mäletasin seda juttu nagu nüüd on see koht , kui jälle võiks olla kuulnud , võiks olla kuulnud ."
20210124_kiire_saade_086_24012021,7,M,8.882666666666667,noh,"See on nagu must mees oleks jõpres , siis noh , sama nagu ."
20210928_bipolaarne_muusika_8,0,M,20.077333333333335,noh,"Et midagi analoogse ei no lihtsalt , ma mõtlen seda vaata et kui nagu noh , mingi veel paarkümmend aastat tagasi , et see nagu selline nagu tulevikunägemus oli helge ."
20210928_bipolaarne_muusika_8,0,M,20.077333333333335,noh,"Ei no aga seal ongi rohkem nagu alus tänapäeval , et noh , varem sul ei olnud nagu väga mingit sellist alust nagu eeldada ."
20210928_bipolaarne_muusika_8,1,M,40.22183333333333,noh,"Oota , aga mis , mis eluetapist on normaalne narkootikumi panna siis , et kui nagu noh , mingi ei , oleneb muidugi , mis narkootikume noh ."
20210928_bipolaarne_muusika_8,1,M,40.22183333333333,noh,"Alati maastus enamjaolt mingi see , et sõltub tujust , vaata nii seinast seina ja siuke mingid kindlad , mingit tujus vaata näiteks kui me siia tulime , kuulsin vana kooli räppi mingi seda pigit ja Icku ma pole ammu kuulanud , näiteks ma olin , vaata 14 siis ma kuulasin räigelt neid igasuguseid vana kooli räppareid nagu või noh , no sinult ongi mul külge jäänud ."
20210928_bipolaarne_muusika_8,1,M,40.22183333333333,noh,"Läksin , astusin sisse sinna , et noh , võtame süüa midagi , aga seal käis mingi piido , äkki oli bänd ?"
20210928_bipolaarne_muusika_8,1,M,40.22183333333333,noh,"Ma olen näinud , mida siis vennad räägivad vaata et ei , mis asja nagu , et küsime , oled oma poiss , ei ole , ja kui ei ole , siis noh , küsime kummapoole tahad , vajutame ära ka kohe mingi niisugune teema ilmselt ."
20210928_bipolaarne_muusika_8,1,M,40.22183333333333,noh,"Jäädi selle , seda , seda enam peres hakkad mingi , aga nagu seda enam siis sa tahaks minna kuhugi kohta , kus su lapsel on suurema tõenäosusega parem elu nagu , et noh , ma ei tea , suurte linna või male üleskasvanud suht nagu kesises selles ."
20210928_bipolaarne_muusika_8,1,M,40.22183333333333,noh,"Keskkonnas Sa ei oskagi , vaata elult midagi rohkem nagu tahta , selles mõttes mina tean raudselt , et mina , noh , tahan mina maal nagu elama , onju ma ei taha nagu linna noh , jääda elama ."
20210928_bipolaarne_muusika_8,1,M,40.22183333333333,noh,"Jah , sest noh , tööd ka ei ole , vaata oleks sul veel vaata mingi töö või mingi või nagu okei , sul võib olla mingi üks , üks laut kuskil on , onju , aga nagu seal väga mingid , ma ei tea , karjäärivõimalusi ei ole , onju kuhugi arenenud , seda ei ole , on ju , sa jäädki nagu sinna külasse ."
20210928_bipolaarne_muusika_8,1,M,40.22183333333333,noh,"Aga nagu vaata , ongi see , et kui sa nagu Eestis oled juba oma niši leidnud , siis noh , sa ei , sa ei saa inglisekeelse nagu tegema veits nagu suur papa üritus , aga nagu ."
20210928_bipolaarne_muusika_8,1,M,40.22183333333333,noh,"No lihtsalt ma mõtlesingi seda , vaatan , miks oli vist suur papa , see , kes vahepeal vaata , hakkas inglisekeelset muusikat tegema ja noh , kurat jah , aga nagu sa ei , sa ei saa teha lihtsalt sul ."
20210928_bipolaarne_muusika_8,1,M,40.22183333333333,noh,"Kütad oma katet seal ja siis teed vaikselt laivi , see oli nüüd on väike ja niisugune nagu ajaloo kõrvalpõie eile , aga vanasti nõuka ajal oli see vaata et kui sa olid mingi kunstnik või luuletaja , onju , et siis sa noh , ja sa seda mingit riigikranti ei saanud , siis sa läksid katlakütjaks , et nagu suur osa nendest katteküttetest olid tegelikult nagu kultuuriinimesed , aga point oligi see , et sul oli mingit tööd vaja ja see oli see töö , mida sa tegid , vähemalt vähemalt töö ."
20210928_bipolaarne_muusika_8,1,M,40.22183333333333,noh,"Nüüd on lihtsalt reklaami nagu tuld , nagu sellega saab raha tellida ja mingid muud , no samas samas nagu ikkagi see , et kui sa oled mingi näitleja , teatris see on noh vähemasti sul on nii suur palk olemas , et sa nagu , noh , sa ei pea nagu kõrvalt vaata tegema ."
20220206_kollektiivne_katk_14006022022,2,M,14.377,noh,"Noh , kui häält on , tuleb teha risk selles suhtes , nagu , kui sul , kui sa rääkida suudad , vaata ja mitte , et noh , Liisi Koiksoni ja meie meie atituud on ikkagi , las poiss nokitseb , poiss nokitseb ja teised poisid ka tüdrukud , et just nimelt et seal oligi , räägime seda räpitoa juttu veits , onju ."
20220206_kollektiivne_katk_14006022022,2,M,14.377,noh,"Li täitmata ala , vaata tegelikult see oleks , see oleks tore , kui keegi kuri tüdruk , kes nagu noh , tahaks laamendada , võib-olla on täidetud , me lihtsalt ei tea ka , vaat et andke meile teada , kuradi lollid , noh , seal mingid nimed käisid ja , aga ma kurt , ma ei viitsinud guugeldada , pange ."
20220206_kollektiivne_katk_14006022022,6,M,15.423333333333334,noh,"Tänapäeval , et siin on nagu jälle huvitav , et , et tavaliselt ongi elu kitsaskohtasid või ütleme , niisuguseid valu kohtasid kõige rohkem ongi kajastatud läbi muusika , eks ole , ja nüüd on see kitsaskoht käes ja nüüd needsamad artistid , kes laulavad seal vabadust est või et võitlen või mis iganes nüüd siis nii madalal käituvad , et hakkavad nagu hopsti nagu nad ise oleks need uuringud läbi viinud , mis seal kõik nagu tehtud on , et , et noh , ära ole ."
20220206_kollektiivne_katk_14006022022,6,M,15.423333333333334,noh,"Ja kohe nagu loomingut , noh , kuula , võib-olla võtsid need sellised artistid maha oma lood , kelle lugudes on niimoodi võit ."
20220206_kollektiivne_katk_14006022022,18,M,40.13216666666667,noh,"Ja ära soovita , väike soovitus ära tee 1000 lugu päevas vaid 1000 päeva sees üks lugu , vaata aga te korralik nagu või noh , kolme , mitte 365."
20220206_kollektiivne_katk_14006022022,18,M,40.13216666666667,noh,"No vot , et mina otseselt ei saa noh , kuna ise ühtegi , ma olen proovinud ikka natukene kitra passi näppinud ja trummi taga ka ja aga noh Kurat , ühte niimoodi eraldi välja tuua , minul ei , ma ei suuda ."
20220206_kollektiivne_katk_14006022022,18,M,40.13216666666667,noh,"Sinu näo ma saan , arbuusi saan ette ja see mulle vist isegi toidab nagu see viimane uus lugu mul kene ja seal refräänid sul või noh , nende Eesti räpp sis võib olla seal on nagu kõige kõvemad kraabitud , mida , mida üldse teha annab ."
20220206_kollektiivne_katk_14006022022,18,M,40.13216666666667,noh,"Ma praegu mõtlen ma varem mõelnud sina oled vähemalt seda suhtumist nagu meile toonud või nagu , et et ei tee kraabitsat kraabitsa pärast , vaid kraabitsale on oma koht , ta on nagu lisavend , kellel on midagi öelda nagu stilistiili indikaator minu hinnangul ette nüüd on tema osa on siin nagu et noh , mõnikord on küll need vaheaugud vaatan ja , aga teinekord Nagu on vaata breik näiteks see breikimis osa see klassikalises mõttes nagu ja siis on aabitsa osa ja tuleb räppar , siis krõb ."
20220206_kollektiivne_katk_14006022022,18,M,40.13216666666667,noh,"Aga mina poole kõrva silmaga vaatasin poole kõrva , no niimoodi , et noh , tegin muid asju , tegelesin lapsega seal ja mingi kuradi keetsin pel ."
20220206_kollektiivne_katk_14006022022,26,M,13.609,noh,"On mõttetu , muidu muidu ma olin mingi suvaline kantrivend või mingisugune Marju Länik , noh , ma ei taha midagi halvasti öelda , aga halb näide võibolla ."
20220206_kollektiivne_katk_14006022022,26,M,13.609,noh,"See on koos tegemine , umboelaks , siin kliimas on ju , kas ta teeks iseendale labakud valmis või , ja ma arvan , et aga väänaks traadist endale kuskil kuradi koopas kuskil kuuris , noh , Ma mis meie kliimas siin talvel murraks kivist välja endale labakad ."
20200412_puhas_eesti_episood__050_12042020,51,M,1.129000000000004,noh,"No kerge vast kerge , see on siililegi selge , ma selge , et pane luku oma Bergelegender ja seebi väike , ära kuula mu teksti , noh , ma olen õnnelik , et ma ei ole Eesti ka meie malejagu puumehe kiiri saates nõuab uuema piiri , et soorita tuiva ja noori da kuiva sooja nagu kuidas loos ."
20200424_kinnisvaraintervjuu_08_tnu_toompark_kinnisvarakool_ja_kaspar_kajuvee_estateguru_o,0,M,16.410666666666668,noh,"No selles mõttes , et noh , eks ikkagi natuke rohkem on näha sellist nii-öelda käibekapitali vajadusi , et , et see seda nüüd nüüd on küll jah , selgelt näha , et paljud vabastavadki raha , et , et siis nii-öelda hoida reserve ja jaja jääda nii-öelda Toimetama ."
20200424_kinnisvaraintervjuu_08_tnu_toompark_kinnisvarakool_ja_kaspar_kajuvee_estateguru_o,0,M,16.410666666666668,noh,"Et et , et noh , need on nagu need Nii-öelda kõige suuremad muutused muidugi on , on nii öelda investorite huvi natuke vähenenud , mille tõttu on ka rahastatud laenude ."
20200424_kinnisvaraintervjuu_08_tnu_toompark_kinnisvarakool_ja_kaspar_kajuvee_estateguru_o,0,M,16.410666666666668,noh,"Jaa , et noh , eks , eks siin peab ikkagi nagu vaatama tunnetama seda olukorda , et täna on nii öelda Meil võimalus paremaid tingimusi nõuda ja , ja seda me ka kindlasti teeme , et mis on nagu selged otsused , mis me oleme teinud , on , et ."
20200424_kinnisvaraintervjuu_08_tnu_toompark_kinnisvarakool_ja_kaspar_kajuvee_estateguru_o,0,M,16.410666666666668,noh,"Investorite seas , et aru saada , et mida , mis , mis investorid mõtlevad ja , ja miks nad mingeid nii-öelda otsuseid teevad , et , et noh , siin sellest küsimustikust tuli välja , et kuskil pool investoritest Ütlevadki , et nad võtavad raha välja nii-öelda igaks juhuks ."
20200424_kinnisvaraintervjuu_08_tnu_toompark_kinnisvarakool_ja_kaspar_kajuvee_estateguru_o,0,M,16.410666666666668,noh,"No selles mõttes , et et , et eile oli meil siin nii-öelda oma investoritele üks vebinar ja , ja kui ma mainisin seda , et noh , tegelikult tegelikult see Sieberi plaan on meil väga ammu olnud ja , ja kui sa mäletad ilmselt kas oli võis olla äkki 2018 oli meil üks üritus , kus me tegelikult hõikasime välja selle , et lähme , lähme sinna ja sa vist isegi küsisid , et millal ja kas saaks detaile ."
20200424_kinnisvaraintervjuu_08_tnu_toompark_kinnisvarakool_ja_kaspar_kajuvee_estateguru_o,0,M,16.410666666666668,noh,"Ma noh , ma tõin ka seda välja juba varem , et , et et , et , et noh , see , Ühes teises kõnes , et see kampaania ettevalmistamine on olnud mitmekuuline protsess ja see seedersi nii-öelda du dilligence või analüüs ja kontroll on päris põhjalik ."
20200424_kinnisvaraintervjuu_08_tnu_toompark_kinnisvarakool_ja_kaspar_kajuvee_estateguru_o,0,M,16.410666666666668,noh,"Põhjus , et teine , teine teine nii-öelda argument , mis on , et , et täna me oleme tegelikult meie kasv , ütleme võrreldes siin palju suurte Euroopa ettevõtetega ühisrahastusplatvormidega meie kasv ikkagi on suhteliselt selline noh , tagasihoidlik , et , et , et on väga palju ettevõtteid , kes on väga agressiivselt ja tugevalt laienenud ja , ja paljud on ka oma tegevuse selle pärast ära lõpetanud , et on liiga nii-öelda jõuliselt jõuliselt laienenud , meil on olnud kogu aeg , see nii-öelda piirang peal ka investorite poole pealt kui ka kui ka Rahavoogude poole pealt , et me oleme pidanud väga jälgima nii-öelda ettevõtte kulubaasi ja , ja nii-öelda ei ole kunagi üle kulutanud ja , ja teiselt poolt ka see , et kuna meil ei ole kunagi nii-öelda olnud sellist raha ülepakkumist siis siis ei ole olnud seda enam muret , et me oleks pidanud kiire , liiga kiiresti laienema või , või me ei oleks jõudnud oma mingisuguse riskianalüüs põhjalikult teha või ja mis , mis toob kõige selle juurde , et tänane nii-öelda selline kriisiolukord on võib-olla kõige parem olukord , kus seda kiiret laienemist siis hakata tegema , kui need turud on oma jõnksu ära teinud ja , ja võib-olla on selline ajutine segas kus mingisugused suuremad finantseerijad tõesti veel ei julge otsustada , siis , siis siis , Siis ma arvan , et see võib olla nagu võimaluse koht , et , et siin on , siin on mitmed meie konkurendid sarnased finantseerimisasutused , kes , kes on tegelikult eelmise kriisi põhjast tekkinud ja tänaseni toimetavad , et pangad , noh , LHV Pank tegelikult ju on nagu nii-öelda sealt sealt nüüd eelmise kriisi kriisi ."
20200112_kekkonenis_takeover__041_12012020,69,M,3.1498333333333375,noh,"Loota ei oleks võinud minu teada ka Saaremaalt pärit on , on , on , on , aga ei näinud , jah , noh , jõuluaeg võib-olla perega kodus ."
20200112_kekkonenis_takeover__041_12012020,101,M,1.485833333333335,noh,"Ipopi vinüüle , mis Eestis ilmub minu meelest , noh , ma võin ka eksida ."
20200422_kinnisvaraintervjuu_07_tnu_toompark_kinnisvarakool_ja_andree_raid_raid__ko,0,M,13.490666666666668,noh,"Mis , mis on siis need kaubad , mille vastu ostjad täna huvi tunnevad , sest noh , ostja peab vist täna julge olema , kui prognoositakse siin kõiksugu tagasiminekuid , mille vastu huvi tuntakse ."
20200422_kinnisvaraintervjuu_07_tnu_toompark_kinnisvarakool_ja_andree_raid_raid__ko,0,M,13.490666666666668,noh,"Mis , mis sinu arvamus on sellest , et kui täna on ikkagi tööjõuturg juba väga selge löögi saanud , noh , paar numbrit siia vahepeale ma just eile vaatasin ."
20200413_kinnisvaraintervjuu_05_tnu_toompark_kinnisvarakool_ja_neeme_liivlaid_goodson__red,2,M,3.281,noh,"Iga kinnisvaraühik on unikaalne tegelikult lõpkokkuvõttes , eks et meil , noh , me märkame ka , et kas siis on midagi funktsionaalsuses , midagi selle asukohaga Veel veel on võib-olla põhjapanevaid järeldusi raske teha ."
20200413_kinnisvaraintervjuu_05_tnu_toompark_kinnisvarakool_ja_neeme_liivlaid_goodson__red,7,M,6.552999999999999,noh,"Ja et noh , põhiline , nagu ma enne enne just mainisin , et , et et korteril püsiks , püsiks nagu rahavoog ."
20200413_kinnisvaraintervjuu_05_tnu_toompark_kinnisvarakool_ja_neeme_liivlaid_goodson__red,7,M,6.552999999999999,noh,"Selleks nagu valmis olla Jah , kui sina esindad omanike noh , sina oled , eks , omanike ja üürnike vahepealne lüli ja et kui , kui mina näiteks olen oma korterite omanik , mida ma ise välja üürin , kas , kas ma peaks siis selles ahelas järgmise Astme ga pangaga juba kuidagi eelnevalt suhtlema , et rääkima , mis seis mul on ja ."
20190102_esialgu_nimeta_podcast_ep_2,3,M,1.5433333333333337,noh,"Ma ütleksin , et siis , kui eestlastel on kodus selline niimoodi , kui on mingi mure , siis noh , kohe ei räägita siis meil see lihtsalt karjus välja ."
20190102_esialgu_nimeta_podcast_ep_2,13,M,14.116166666666665,noh,"Noh , et see on see , et , et võtad kätte ja teed ära Ma mõtlen praegu , noh , ma tulin , ma tulin nüüd kõrvalt , ma loodan , et ma nüüd räigelt pange ei pane , eks ole , aga nii palju kui ma aru ja ütelge mulle , kui ma panen , et nagu eestlaste ja venelaste läbisaamine vaata tühine maailmapilt on ju , et aga , aga vähemalt selles põlvkonnas , kus meie praegu elame , siis mina õnneks le jalgpalli mänginud kaua aega ja alati need mängud , kui oli venelaste vastu mängimine ."
20190102_esialgu_nimeta_podcast_ep_2,13,M,14.116166666666665,noh,"Et , et see oli vene keele õppimine , noh , ma tõin sinna veel selle teise vaatevinkli juurde ."
20190102_esialgu_nimeta_podcast_ep_2,13,M,14.116166666666665,noh,"Kuigi võib-olla see mõju on väike ja võib-olla see lõhe , noh , ma ei ütleks , võib-olla lõhe on üsna suur ."
20190102_esialgu_nimeta_podcast_ep_2,13,M,14.116166666666665,noh,"Selles mul lihtsalt ka tuli see lõhestumuse , järjekordne asi , et et noh , sa ütlesid , et need venelased , mõned kes ei viitsi Eest ja ei , loomulikult ma mõtlengi , et on eestlasi ja venelasi mõlemaid , kes ei viitsi nagu tegeleda ja siis antud juhul , mis ma räägin , nad ei viitsi õppida teineteise keelt ära ja siis nad jäävadki enda sellesse mulje , et noh , Lasnamäel ma tean , et on nagu juba noh , kogukonna ja on eraldi noh , kõik on ehitatud selle järgi , et inimene ei peakski lahkuma Lasnamäel ja ta jääbki sinna jääb enda vene keskkonda ."
20190102_esialgu_nimeta_podcast_ep_2,13,M,14.116166666666665,noh,"Selles mul lihtsalt ka tuli see lõhestumuse , järjekordne asi , et et noh , sa ütlesid , et need venelased , mõned kes ei viitsi Eest ja ei , loomulikult ma mõtlengi , et on eestlasi ja venelasi mõlemaid , kes ei viitsi nagu tegeleda ja siis antud juhul , mis ma räägin , nad ei viitsi õppida teineteise keelt ära ja siis nad jäävadki enda sellesse mulje , et noh , Lasnamäel ma tean , et on nagu juba noh , kogukonna ja on eraldi noh , kõik on ehitatud selle järgi , et inimene ei peakski lahkuma Lasnamäel ja ta jääbki sinna jääb enda vene keskkonda ."
20190908_bipolaarne_armastus_2,0,M,21.2325,noh,"No ütleme , armastus tekib ju kuidagi nagu on selline tunne , et noh , okei , liblika lendavad küll kõhus , aga mingi süda on ka kuidagi siuke teistsugune ."
20190908_bipolaarne_armastus_2,0,M,21.2325,noh,"Aga kas te vaatate õrnemat sugu poolt , noh , ma ei tea ."
20190908_bipolaarne_armastus_2,2,M,20.148166666666665,noh,"Et üks on selline nagu erootiline armastus , ongi see eros siis teine on filia , mis on nagu sõprus , et noh , need kaks minust peamist , mis võiks olla nagu eraldi pandud ja siis on veel Agape , mis on miskit nagu sellist ülimat armastust ."
20190908_bipolaarne_armastus_2,2,M,20.148166666666665,noh,"See on siis ei , kõik minu point oligi see , et Eestis võiks nagu kasutada rohkem erinevaid termineid , et ei nagu ei ajaks sassi vaata et kui , nagu et ma armastan sind , et see nagu noh , kui me praegu räägime armastusest , nagu ongi Eesti kontekstis nagu et kui me võrdleme nagu Eestis olevat nii-öelda inimeste vahelist armastust versus mujal maailmas , see on nagu tegelikult on ju suur vahe selles suhtes mis mõttes selles suhtes ütleme niimoodi , et nüüd armastuse väljend nagu et noh , mujal maailmas öeldakse palju rohkem , ah , kuule , ma armastan sind ja niimoodi ."
20190908_bipolaarne_armastus_2,2,M,20.148166666666665,noh,"Aga minu arust seal laulus ka nagu ei saada vastust sellele küsimusele , noh , minu meelest , sest , sest kohe järgmine lause , mis värvi on armastus , kes seda teab ?"
20190908_bipolaarne_armastus_2,2,M,20.148166666666665,noh,"Jah , jah , noh , midagi sellist ."
20190908_bipolaarne_armastus_2,2,M,20.148166666666665,noh,"Noh , kui sa kirjutad , tapsin täna kaks inimest , vaata , sa loed tapmist täna kaks inimest selga , paneme kinni , vaata , saada kaks südant , siis noh , kurat ."
20190908_bipolaarne_armastus_2,2,M,20.148166666666665,noh,"Sa oled ju nende inimestega koos kogu aeg , vaata sa oled nendega koguaeg ühte sama tööd ja asju , vaata , noh , okei , sul võib raha asju olla , onju , aga aga sa ei näe selle aja jooksul väga palju teisi inimesi ."
20190908_bipolaarne_armastus_2,2,M,20.148166666666665,noh,"Esimene see nii-öelda ongi , siis , sa pead ise nagu samastuma täpselt selle sama nagu inimese , keda sa , kellega sa või noh , keda sa näitled nagu jah , sa pead olema tema ."
20190908_bipolaarne_armastus_2,2,M,20.148166666666665,noh,"Saatke palun sinna meile joonistusi , noh , kirjad võivad ka olla , aga peamiselt joonistused meeldiks meile ."
20190908_bipolaarne_armastus_2,2,M,20.148166666666665,noh,"Noh , vaata , sa ei saa muidu silma jääda , no see on nagu ütleme , kui me võtame näiteks loomaringi on ju siis ju isas linnud on enamasti need , kes on värvilisema sulestikuga no pavooli nud näiteks noh üldse igasugused linnud nagu isegi , isegi nagu nad on värvilisem sulestikuga isegi siis , kui see nagu evolutsiooniliselt võiks olla nagu halb , nagu selles mõttes , et noh , neid on lihtsam märgata ja lihtsam süüa ja värki ."
20210313_episood_1_eesti_laul_aftekas__covidioodid,0,M,54.761,noh,"Mitte ühtegi lugu nende seas , mis võiks nagu eurovisioonil tõesti lajatada väga hästi , noh , me , me mäletame kindlasti , on ju , kui Elina Netzajeva oli Eesti laulu poolfinaalis juba , et siis , siis siis nagu noh , sa said kohe aru , on ju , see läheb kuskile , onju , aga praegu ma ei tea , ükski lugu minus nagu sellist tunnet tekitanud ."
20210313_episood_1_eesti_laul_aftekas__covidioodid,0,M,54.761,noh,"Ma ei vaadanud isegi , noh , nende pärast ma lihtsalt olin ühe sõbra juures ja siis temaga koos nagu vaatasime , aga miks ma ei vaata ."
20210313_episood_1_eesti_laul_aftekas__covidioodid,0,M,54.761,noh,"Siin on kohe juurde , mis sa arvad , noh , vaata , igal aastal on ikkagi noh , niisugune niiöelda teistsugune lugu , mis läks rohkem rahvale peale , mis sa arvad sellest , mis see nüüd oli ?"
20210313_episood_1_eesti_laul_aftekas__covidioodid,0,M,54.761,noh,"Aga ma ei ütleks , et kas ta siis tõesti või noh , mina ei tea , võib-olla ma siis tõesti ei tea mitte midagi , aga kas ta siis tõesti läks nüüd niivõrd palju rahvale peale , ta on nagu niisugune lugu , et ta on minu arust nagu huumor ."
20210313_episood_1_eesti_laul_aftekas__covidioodid,0,M,54.761,noh,"Ta on algusest peale nagu mulle tundub olnud huumor , et , et noh , selles mõttes selle järgi on äge teha , mingisugused lasteaiad teevad tantsuvideosid , onju , aga , aga kas ta nüüd selline tõsiseltvõetav lugu on ?"
20210313_episood_1_eesti_laul_aftekas__covidioodid,0,M,54.761,noh,"Jaja ei , ma olen nõus tegelikult ju noh , nagu ma aru saan , siis see formaat neil praegu näebki ette , et noh , mingil hetkel nagu unustati vaata ära , et noh , see ei ole siis eurolaulu eelvõistlus , et me teeme sellist kohta , kus Eesti artistid saavad platvormi ja , ja Eesti inimestele esineda ja , ja seda kõike , aga noh , reaalsus on ju see , et seal valitakse laulu eurovisioonile ."
20210313_episood_1_eesti_laul_aftekas__covidioodid,0,M,54.761,noh,"Jaja ei , ma olen nõus tegelikult ju noh , nagu ma aru saan , siis see formaat neil praegu näebki ette , et noh , mingil hetkel nagu unustati vaata ära , et noh , see ei ole siis eurolaulu eelvõistlus , et me teeme sellist kohta , kus Eesti artistid saavad platvormi ja , ja Eesti inimestele esineda ja , ja seda kõike , aga noh , reaalsus on ju see , et seal valitakse laulu eurovisioonile ."
20210313_episood_1_eesti_laul_aftekas__covidioodid,0,M,54.761,noh,"Ma olen ise mõelnud sellele , et tegelikult minu arust see praegune versioon mõnes mõttes hoiab muusikalist arengut nagu tagasi , sest vaata , kui me oleme , on mõlemad muusikud , me oleme näinud korduvalt , kuidas neid laule tehakse , noh , mitmel aastal on ju vähemalt mõnda tegelikult reaalsus on see , et sinna sinna laulu siis saates laulu tehes ei mõelda väga sellele , et Dawai nüüd ma tahan teha niisuguse laulu , mis võidaks eurovisiooni ja ma saadan sinna niisuguse laulu , mis võidaks eurovisiooni või konkureeriks seal või oleks väga tugev tehakse ikkagi selle mõttega , et näed , Eesti laul on ju , see on platvorm , ma teen mingi sellise laulu , mis kohalikul turul nagu töötab ja see ülejäänud osa siis on nagu täiesti unustatud , aga seega tähendab siis seda , et see latt on ju tegelikult piiratud , et ta teebki siis laulu Eesti turule , ta ei tee laulu , mis peaks konkureerima Euroopa turul , et ma selles mõttes ei saa , ma ei saa aru sellest formaadis , miks , miks seda on nagu vaja või , või miks , miks see parem on , et minu arust meil oleks nagu jah , jah , see meil tekiks see olukord , kus tõepoolest meil igasugused noh , rokklaulud on ju jääks välja nimistust , võib-olla , aga teisest küljest ma arvan , et kogu muusikatööstuse le oleks kõvasti parem variant ja sellel oleks ka üks lahendus ."
20210313_episood_1_eesti_laul_aftekas__covidioodid,0,M,54.761,noh,"Ma ütleks absoluutselt muidugi noh , muidugi selles mõttes ma ei isegi vist ei ole nagu hea puudutada seda teemat , et kuidas žüriil valida on , sest tegelikult kokkuvõtteks nagu ei olegi vahet nagunii on raske valida ja , aga noh , me siis anname lihtsalt puhtalt võimaluse rohkematele artistidele , mis on iseenesest väga hea , siis ongi see platvorm , kus noh , tegelikult kui sa Eestis tahad ka nagu muusikuna kuskile nagu jõuda , siis tegelikult see on see platvorm , kuhu sa peaksid nagu sisenema , lihtsalt , et noh , mida rohkem meil valikut on ja mida rohkem inimesed nagu näevad erinevaid , seda tegelikult nagu seda parem on ka ."
20210313_episood_1_eesti_laul_aftekas__covidioodid,0,M,54.761,noh,"See on jah , vaata noh , sihime küll välisturule , aga tegelikult nii nagu väikse hulga muusikaga , mis on täpselt see Eesti laulu platvorm , on see , kust nagu tegelikult seda välja suruda , seda Eesti muusikat nii-öelda minna nagu rahvusvahelisemaks , noh , kuulasin siin pärast seda , kui oli see ainus , eks muidugi , variante on veel , saad ju ka , noh , mingid võime lõputult rääkida mingite rad Attackidest ja nendest on ju , kes ongi välisturgudel väga edukad , aga noh , vaatasin , see on missikas ."
20210313_episood_1_eesti_laul_aftekas__covidioodid,0,M,54.761,noh,"Ja ja ma olen täiesti nõus , üleüldse ma nüüd vaatasin , on ju kõik need selleaastased Melodifestivale neid ära ja ma olen neid vaadanud iga aasta vahel ma kõiki ei ole jõudnud vaadata , sest noh , seal on räigelt saateid on ju , aga finaal on muideks laupäeval ma ei tea nüüd kas see meie botcast tuleb avalikuks enne või pärast , aga igatahes soovitan kõigil vaadata Melodifestivale nit finaali , siis seda saab järgi vaadata SVT siis Rootsi rahvusringhäälingulehelt ja võrrelda seda Eesti lauluga lihtsalt puhtalt laule , võrrelda laulude kvaliteeti , saate kvaliteeti ja nii edasi , et see vahe on nagu öö ja päev , see on tõesti nagu ja päev ."
20210313_episood_1_eesti_laul_aftekas__covidioodid,0,M,54.761,noh,"Aga aga ma arvan , et noh , me peaks nagu suuna poolest vaatama sinnapoole just see Eesti laulu formaat ."
