episode_id,section_index,gender,minutes,pos,tunnus,sona,lause
20210416_jutud_rohelises_stuudios_osa_4_madis_mumm,1,M,27.033,A,päris,kena,"Oi lapsepõlv oli mul päris kena , ma arvan , et sellist lapsepõlve , mis mul oli , võib-olla praegu saab , võib-olla ma ei tea , 10 inimest võib Valgamaal , et jah , et ma kasvasin üles talus ."
20210416_jutud_rohelises_stuudios_osa_4_madis_mumm,1,M,27.033,A,päris,keeruline,"Mõnusatest piltidest ja mälestustest , aga tegelikkuses on see ju päris keeruline ."
20210416_jutud_rohelises_stuudios_osa_4_madis_mumm,4,M,10.882666666666667,D,päris,laiali,"See oli päris laiali hõlmav , et alguses ma arvasin , et see on prügivabastused , aga hiljem selgus , et seal ikkagi kõik planeeringud , üldplaneeringu ja üleüldse keskkonna keskkonnakaitsenii-öelda , inimestega seotud probleemid ."
20210416_jutud_rohelises_stuudios_osa_4_madis_mumm,4,M,10.882666666666667,A,päris,keeruline,"No ma tean sind ka enam-vähem noh , nüüd natuke natuke täpsemalt täpsemalt vist ja on halb sõna öelda , aga umbes kaheksa-üheksa aastat ja ja , ja nii palju , kui mulle tundus see , mida sa vabal ajal teed , see , mis missugune hing , hing sinust nagu välja kumab , siis see ametniku töö tundus nagu kuidagi kummaline sinu poole , et et ongi niisugune natuke hipster ikka natukene selline vabameelsus ja siis siis nagu tõesti selline päris keeruline ametnikutöö , et kus tuli suhelda , on volikoguga , tuli suhelda , vallakodanikega , olla viisakas , täita ametnik ametniku rolle , kohuseid , et et aga , aga tagantjärgi ma mõtlen , et vist nagu tõesti sobis see sulle ."
20210416_jutud_rohelises_stuudios_osa_4_madis_mumm,4,M,10.882666666666667,A,päris,kõva,"Et kui ma kujutan ette , kui oleks tulnud mingi , ma ei tea , et kellegi ilus raba tahetakse üles kaevata ja mingi kodanikuaktsiooni d kindlasti siis oleks peavalu palju rohkem , aga ma arvan , minu eelkäija ja olid päris kõva töö ära teinud näiteks ju tõrva ."
20210416_jutud_rohelises_stuudios_osa_4_madis_mumm,5,M,17.14183333333333,D,päris,kaua,"Valgas läks ju päris kaua aega , enne kui see uus ekstreemspordihall Nagu tuli , et kui palju sa sinna praegu jõuad ja , ja mis mis nii-öelda siis lemmikosad seal hallis on ?"
20210416_jutud_rohelises_stuudios_osa_4_madis_mumm,5,M,17.14183333333333,A,päris,põnev,Päris põnev .
20190108_mehed_ei_nuta_aasta_suured_ksimused__kas_tnak_vidab_tiitli_kas_kirt_viskab_90_meetrit,1,M,24.004166666666663,A,päris,kena,"Aga loogiliselt igus , aga päeva suurem sündmus ma ütleks , siiski oli Eesti naiskonna mäng muidugi ja , ja Eesti naiskonna kolm üks võit Rootsi üle , mis jätab meile päris kena võimaluse veel pääseda finaalturniirile , mis oleks siis Eesti pallimängu naiskondade jaoks ükskõik millisel alal esmakordne noor reporter Roosna seireb ."
20190108_mehed_ei_nuta_aasta_suured_ksimused__kas_tnak_vidab_tiitli_kas_kirt_viskab_90_meetrit,2,M,21.29866666666667,A,päris,arvestatav,"Aga arvestades , et , et see ei toimunud Soomes , siis oli seal ikkagi päris arvestatavad sajad , vähemalt ma ei tea , tuhandete julge võibolla pakkuda eestlasi kergejõustikuareenil ."
20190108_mehed_ei_nuta_aasta_suured_ksimused__kas_tnak_vidab_tiitli_kas_kirt_viskab_90_meetrit,2,M,21.29866666666667,A,päris,hea,"See saaks päris hea vaidlus , oi , see on kõva vaidlus ."
20190108_mehed_ei_nuta_aasta_suured_ksimused__kas_tnak_vidab_tiitli_kas_kirt_viskab_90_meetrit,2,M,21.29866666666667,A,päris,uus,"Mis mark , pead meelde , need vanad bussid , neid olid kuidagi nagu viletsad ja see uus oli just välja tulnud ja ma päris uut ka ei tahtnud , nagu ta ."
20190108_mehed_ei_nuta_aasta_suured_ksimused__kas_tnak_vidab_tiitli_kas_kirt_viskab_90_meetrit,2,M,21.29866666666667,A,päris,kiire,"Aga meil on muidugi , meil on muidugi päris kiire ja ei rohkem , kui võta , lähme siis saatega edasi , kas me nüüd kappame kiiresti ?"
20190108_mehed_ei_nuta_aasta_suured_ksimused__kas_tnak_vidab_tiitli_kas_kirt_viskab_90_meetrit,2,M,21.29866666666667,A,päris,kindel,"Ma ei tea , kas ütleme , ma ei ole päris kindel , et , et see uus treener seal üksinda suudab midagi teha , et seal võib olla , peaks ka ikkagi seda koosseisu ka natuke natuke veel ümber vaatama ."
20190108_mehed_ei_nuta_aasta_suured_ksimused__kas_tnak_vidab_tiitli_kas_kirt_viskab_90_meetrit,4,M,5.474666666666667,D,päris,maha,"No novil ma päris maha ei taha kanda , aga , aga ütleme noh , ütleme kui me räägime kahestki mehest ja siis mingisugusest , ma ei tea mingist X - faktorist sealjuures , et see protsent , ma arvan , seal kuskil võib-olla 40 juures , kui rääkida , rääkida nagu üks-ühele kihlavedamisest ."
20190108_mehed_ei_nuta_aasta_suured_ksimused__kas_tnak_vidab_tiitli_kas_kirt_viskab_90_meetrit,5,M,20.710666666666665,A,päris,hea,"Sutsu pessimistid ka veel ja siis ja on nagu optimistlikult ütleb jah ja mingi mingil põhjusel ikkagi nagu Eestil läheb hästi või , või Eesti esindajatel , et antud juhul läheb , tundub mulle siis vastupidi , sest mul on tegelikult päris hea tunne Kalev Cramo praeguse meeskonna osas ."
20190108_mehed_ei_nuta_aasta_suured_ksimused__kas_tnak_vidab_tiitli_kas_kirt_viskab_90_meetrit,5,M,20.710666666666665,A,päris,hea,"Paraku jah , ma olen ka seda meelt , et jah , et kui kui mitte tänavu , siis millal siis veel , et esiteks meeskond on tõesti nagu saanud kokku päris hea ."
20190108_mehed_ei_nuta_aasta_suured_ksimused__kas_tnak_vidab_tiitli_kas_kirt_viskab_90_meetrit,5,M,20.710666666666665,D,päris,niimoodi,"Et et , et ei tule , see oli siiski suhteliselt erakordne ja , ja meil ei ole kõik need aastad ikka päris niimoodi kulgenud ."
20190108_mehed_ei_nuta_aasta_suured_ksimused__kas_tnak_vidab_tiitli_kas_kirt_viskab_90_meetrit,5,M,20.710666666666665,D,päris,nii,"Kas , kas meie vehklemine on nagu päris nii kõva ?"
20210413_episood_4_kas_vanasti_oli_muusika_parem,0,M,10.724166666666669,D,päris,palju,"Kuigi ma päris palju olen bändimuusikat teinud Jah , ja koore tegelikult mu ma tahaks , ma tahaks kunagi , kas kirikutes niisuguseid suur suuri ulatuslikke koore salvestada ?"
20210413_episood_4_kas_vanasti_oli_muusika_parem,2,M,24.133833333333335,A,päris,hea,"Meil on tegelikult ju väga äge Saksamängija , kõik muud asjad sinna juurde , et tegelikult see on ju tehnilised oskused on päris head ."
20210413_episood_4_kas_vanasti_oli_muusika_parem,2,M,24.133833333333335,D,päris,palju,"Ma võib-olla ütleks , et müra tase on meeletult tõusnud , sellepärast et kuidas kunagi ju vaata , muusikavaldkond toimis , oli see , et noh , olid suured plaadifirmad , eks ole , ja nemad kontrollisid päris palju raadioid ."
20210413_episood_4_kas_vanasti_oli_muusika_parem,2,M,24.133833333333335,A,päris,keeruline,"Ma arvan , et tegelikult need kaks maailma saavad üksteisele abiks olla , kui nad saavad jutule , aga need läbirääkimised ongi alati päris keerulised ."
20210413_episood_4_kas_vanasti_oli_muusika_parem,2,M,24.133833333333335,D,päris,kindlasti,"Et ma ei arva , et plaadifirmad on halvad aga ma arvan , et see on päris kindlasti alati keeruline asi ja inimene peaks minema plaadifirma alla lihtsalt puhtalt sellepärast et see on lahe ja et äkki siis saab staariks ."
20210413_episood_4_kas_vanasti_oli_muusika_parem,2,M,24.133833333333335,A,päris,vali,"Kui sa saad plaadifirma alla lepingu , ma kujutan ette , et siis su töö alles algab ja kui sa arvad , et sa oled enne palju tööd teinud , siis ma arvan , et see , see , see äratuskell tuleb päris vali nagu ."
20210413_episood_4_kas_vanasti_oli_muusika_parem,2,M,24.133833333333335,A,päris,huvitav,"See on , ei , tegelikult see on tõsi , vaata eks kui no kui mõelda nagu puhtalt äri poole , et ma ei tea , kuidas ju neil see äri on , sellepärast et need lepingud ei ole nagu niisugused , mida sa saad netist alla laadida ja vaadata ja lahata , eks ole , päris huvitav , kui saaks vaadata niimoodi , päris huvitav , ma oleks ka mõelnud , et täiega tahaks näha mõnda , et kuulajad , kui teil on kuskil mõni niisugune leping nagu näha , saatke kusagile , vaesed moosekandidaat , plan , pange oma lepingut teele me me et tegelikult oleks hullult äge , nagu näha , et mida , mis seal nagu on , oleks tore ."
20210413_episood_4_kas_vanasti_oli_muusika_parem,2,M,24.133833333333335,A,päris,huvitav,"See on , ei , tegelikult see on tõsi , vaata eks kui no kui mõelda nagu puhtalt äri poole , et ma ei tea , kuidas ju neil see äri on , sellepärast et need lepingud ei ole nagu niisugused , mida sa saad netist alla laadida ja vaadata ja lahata , eks ole , päris huvitav , kui saaks vaadata niimoodi , päris huvitav , ma oleks ka mõelnud , et täiega tahaks näha mõnda , et kuulajad , kui teil on kuskil mõni niisugune leping nagu näha , saatke kusagile , vaesed moosekandidaat , plan , pange oma lepingut teele me me et tegelikult oleks hullult äge , nagu näha , et mida , mis seal nagu on , oleks tore ."
20210413_episood_4_kas_vanasti_oli_muusika_parem,3,M,17.469833333333334,A,päris,reaalne,"Kusjuures see on ka päris reaalne probleem , sellepärast et aastal 2021 , meil ei ole albumitsüklit enam tegelikult sellist klassikalist nagu kunagi oli , et iga kahe aasta tagant album selles vahepealsel ajal sul on kirjutamisaeg ?"
20210413_episood_4_kas_vanasti_oli_muusika_parem,3,M,17.469833333333334,D,päris,teravalt,"Ja nüüd ongi see sinu otsus , kas sa annad alla ja , ja loomulikult see on hästi raske olukord , sellepärast et eriti Covidi ajal nüüd me tunneme seda päris teravalt , et mida me nüüd teeme , et muusikud ei saa raha teenida , nende nende jaoks ju kontsert on raha teenimine ja veebikontsert ei too mitte midagi , siis isegi siis , kui see või läheb umbes viraalseks mingil hetkel Youtube 'is , siis noh , nad tegelikult ei teeni seal tõe ."
20210413_episood_4_kas_vanasti_oli_muusika_parem,4,M,12.370666666666663,D,päris,noh,"Ja ebakindlus nagu meie valdkonnas on niisugune päris noh , ongi see ongi igapäevane , sellepärast et noh , siin olles ise vahetevahel stuudios kas produtsendi rollis või helimehe rollis , eks ole , helirežissööri rollis , siis täpsustan ."
20210413_episood_4_kas_vanasti_oli_muusika_parem,4,M,12.370666666666663,A,päris,hea,"Ja mõni vahetevahel lihtsalt kuuleb , et oh kurat , päris hea pet ."
20210413_episood_4_kas_vanasti_oli_muusika_parem,4,M,12.370666666666663,A,päris,põnev,"Ja eriti hulluks läheb siis , kui näiteks teed džässmuusikat , kui sa improviseerid seda teed muusikat ja sa mõtled käigu pealt midagi välja , et see , see on nagu täiesti pilbast ehk siis niimoodi , et ma ja , ja sellel kaalus , mulle õudselt meeldis see uuring , see , seda saab Youtube'ist ilmselt ka leida ja kui ta täpselt guugeldate , see , see on , seda , seda näha , see on päris põnev ."
20210413_episood_4_kas_vanasti_oli_muusika_parem,4,M,12.370666666666663,A,päris,raske,"Minu arvamus aga kehvemaks , sest kui sa nagu kirjutad oma hingest midagi välja , siis sul on päris raske ikkagi saada , nagu seda ."
20210413_episood_4_kas_vanasti_oli_muusika_parem,5,M,46.16899999999999,D,päris,palju,"No see sõltub , noh , siin on muidugi mitu aspekti , on ju , kui sa võtad seda näiteks nagu tehniliselt on ju siis selles mõttes ongi hästi lihtne , et sul on tegelt kui sa midagi oskad torenditega teha , on ju sa tegelikult saad endale päris palju asju lubada , põhimõtteliselt on ju ."
20210413_episood_4_kas_vanasti_oli_muusika_parem,5,M,46.16899999999999,A,päris,hea,"Kusjuures siia ütlesid päris hea , et garaaž , bänd , kuidas mina alustasin , enne kui ma hakkasin veel raha küsima selle asja eest ja niimoodi ."
20210413_episood_4_kas_vanasti_oli_muusika_parem,5,M,46.16899999999999,A,päris,suur,"Ja loomulikult ma ei kujuta ette , mis need rahad seal taga on , aga ma kujutan ette , et päris suured Loomulikult me tahaks suuremaid šõusid niimoodi ."
20210413_episood_4_kas_vanasti_oli_muusika_parem,5,M,46.16899999999999,A,päris,pädev,"Aga lihtsalt see vend , kes on elanud stuudios , ta isegi , nagu ma kujutan ette , Billie Eilis teeb oma mega hea loo magamistoas valmis aga tõenäoliselt keegi , kes on päris pädev miksimises , on seal asja üle käinud , kas ta vend siis või keegi või siis või siis saadetakse masterdusse täpselt kusagile abi rody stuudiosse , kus on nagu , eks ole , mingi selline vindigh keer , mis teeb selle master veel ka niisugus eriti cimi väga toreda ."
20210413_episood_4_kas_vanasti_oli_muusika_parem,5,M,46.16899999999999,A,päris,huvitav,Ja päris huvitav selline .
20210413_episood_4_kas_vanasti_oli_muusika_parem,5,M,46.16899999999999,D,päris,päris,"Aga siiski sa tunned seda nagu mingit energiat , mis on sellesse nagu pandud , see on nagu teistmoodi see , et Kadri Voorand oli aint vokaal ja aint siis nagu see Klaver , et seda on nii mõnus , kuidagi näha , see liigutab , aga ma lihtsalt olengi päris instrumentide austaja ja elektroonilist muusikat , ma lihtsalt kuulangi vähem päris instrumendid , lihtsalt need nad nagu päris päris instrumentalist on justkui ekspert , kes teeb oma Oma oma tegevust innuga ja vahete vahel on meeletult tore vaadata eksperti tegemast midagi , mida ta tõeliselt armastab ka , lihtsalt ainult jälgida teda sellepärast et ma olen see kriipar , eks ole , kes , et kui ma näen , et kitarrist tohutult naudib , kuidas sa mängib kitarri , seda , see on hüpnootiline lausa vaadata või vahetevahel , kui sa näed , et ma ei tea täpselt mingi torumees , paneb torusi kokku , aga teeb seda nii innuka see tegelikult on jumala äge vaadata , sellepärast et sa näed , et see inimene on selles nii sees lihtsalt ."
20210413_episood_4_kas_vanasti_oli_muusika_parem,5,M,46.16899999999999,D,päris,palju,"Iga eelnev aste loob järgmist ja noh ma arvan , et nüüd ongi huvitav , kuhu muusika võib välja jõuda , mul on tunne , et järgmised sammud on niisugune , rohkem hübriidid , et segatakse žanre päris palju , väga põnev on kuulata , mis toimub , et see mõttes , et ma olen leidnud ikka oma lemmikuidki täpselt niimoodi , et ma ei tea , kuhu neid enam nagu jagada ja ja see muusika on ikka sihuke ."
20210413_episood_4_kas_vanasti_oli_muusika_parem,5,M,46.16899999999999,A,päris,halb,See oli päris halb .
20210413_episood_4_kas_vanasti_oli_muusika_parem,5,M,46.16899999999999,A,päris,pikk,"Jah , aga ma arvan , et siit tõmbamegi otsad kokku tänaseks niigi tuli päris pikk ."
20210413_episood_4_kas_vanasti_oli_muusika_parem,5,M,46.16899999999999,A,päris,hea,"See tuli ikka päris hea , jah , aitäh sulle , Frank , et tulid meiega siia jutustama ja oma mõtteid jagama ."
20210416_aprill_epikojas__ro_puuetega_inimeste_komitee_arvamus_eesti_olukorrast,2,M,11.751333333333331,A,päris,põhjalik,"Üks selline dokument on nüüd valmis saanud päris põhjalik nende kõikide vestluste põhjal , et milline see olukord sealt poolt vaadates siis tundub ."
20201231_59_normaalse_elu_osa,5,M,37.325833333333335,A,päris,huvitav,"Et see oli päris huvitav oli kuulata minust se mingi Netfixi dokumentaal on sarnasel teemal , ma ei tea , kas täpselt samast asjast , aga nummi ja see hea akronüüm , see on tegelikult see New United Motor , Manifactore ing , Incorporated , nummi ."
20201231_59_normaalse_elu_osa,6,M,13.087999999999996,D,päris,nii,"Viibides koroona aga nakatunud inimesega Maskita siis sa nakatus kindlalt , et ta ütles , et see vist päris nii ei ole , sest paljud palju on neid , kes müstilisel kombel ei nakatu , kuigi nende elukaaslane on nakatunud ."
20201231_59_normaalse_elu_osa,6,M,13.087999999999996,A,päris,tugev,"Jah , et selles mõttes , et selles osas on vist päris tugevad andmed , et , et raskekujulist kiirust on ta vist kõik vaktsiinid põhimõtteliselt ."
20201231_59_normaalse_elu_osa,6,M,13.087999999999996,A,päris,kiire,"Aga üsna üsna hea , ikka päris kiire päris kiiresti ."
20201231_59_normaalse_elu_osa,6,M,13.087999999999996,D,päris,kiiresti,"Aga üsna üsna hea , ikka päris kiire päris kiiresti ."
20201231_59_normaalse_elu_osa,6,M,13.087999999999996,A,päris,tore,"Nii et iseenesest juba kasvõi see on ju päris tore , kui okei , et võib-olla sa jääd koju , pead köhima ja tunned ennast halvasti , aga kui sai vaja haiglaravi ja noh , seda me muidugi ei tea , kas pikaajalised vaata , on ka need inimesed , kes on pärast haigestumist veel tükk aega võib-olla isegi , kuid ennast halvasti tunnevad mingis , kas neil on mingisugused vaimsed hädad või on füüsiliselt ei ole , ei taastu nagu ."
20201231_59_normaalse_elu_osa,6,M,13.087999999999996,A,päris,hea,"Kui nagu need kaks on vähendatud , siis on juba , ma arvan , päris hea tulemus ."
20201231_59_normaalse_elu_osa,6,M,13.087999999999996,D,päris,palju,"Kantakse ikka jah , päris palju minu arust ."
20200326_kinnisvaraintervjuu_03_tnu_toompark_kinnisvarakool_ja_jaan_liitme_domus_fnd_o,0,M,14.496999999999998,D,päris,päris,"Aga kui võib-olla veidi pikemasse tulevikku vaadata , siis ma arvan , et need lähi ütleks isegi kvartali kahe päriselus tulenevad noh , väljakutsed ja , ja halvemal juhul ka sealt tulenevad laenude ümberkindlused , et need võivad nüüd nagu olukorda muuta , et , et ma ise väga loodaks , et siin paar kuud on selline uue , uue stressirohke olukorraga harjumine ja situatsioonist arusaamine ja selline tegelik suurem sügavam mõju seis selgub alles aasta teises pooles , mis kinnisvara laenamist üldisemalt puudutab ja , ja noh , need nii-öelda olemasolevad tehingud , mis on sellises arutelu faasis , et kindlasti seal on väljakutseks see , et kui nõudlus väheneb , et , et kas siis seda Vähenenud nõudlust on võimalik kuidagi testida , et kas siis seal äriplaanis toodud tulud peavad paika ja kui tulud paika ei pea , noh siis hakatakse loomulikult kulude poole vaatama , et et ma arvan , see on selline initsiatiiv , mille pank üles võtab iga ettevõtjaga , et , et kui ta oma laenutaotlusega vasta Et see on päris päris huvitav tegelikult , eks , et ühest küljest võiks arvata , et võib-olla nõudlus väheneb või noh , mis , mis arvate , eks see ole suhteliselt kindel , kui kui inimestel tööd palka pole , siis nõudlus väheneb , aga teisalt kui nüüd ka pangad jäävad ootele Et pilt selgineks siis , siis nemad võib-olla võtavad veel mingeid tehinguid turult ära , mis muidu ehk toimuda võiks , et mis see tehingute arvuga teha võib ."
20200326_kinnisvaraintervjuu_03_tnu_toompark_kinnisvarakool_ja_jaan_liitme_domus_fnd_o,0,M,14.496999999999998,A,päris,huvitav,"Aga kui võib-olla veidi pikemasse tulevikku vaadata , siis ma arvan , et need lähi ütleks isegi kvartali kahe päriselus tulenevad noh , väljakutsed ja , ja halvemal juhul ka sealt tulenevad laenude ümberkindlused , et need võivad nüüd nagu olukorda muuta , et , et ma ise väga loodaks , et siin paar kuud on selline uue , uue stressirohke olukorraga harjumine ja situatsioonist arusaamine ja selline tegelik suurem sügavam mõju seis selgub alles aasta teises pooles , mis kinnisvara laenamist üldisemalt puudutab ja , ja noh , need nii-öelda olemasolevad tehingud , mis on sellises arutelu faasis , et kindlasti seal on väljakutseks see , et kui nõudlus väheneb , et , et kas siis seda Vähenenud nõudlust on võimalik kuidagi testida , et kas siis seal äriplaanis toodud tulud peavad paika ja kui tulud paika ei pea , noh siis hakatakse loomulikult kulude poole vaatama , et et ma arvan , see on selline initsiatiiv , mille pank üles võtab iga ettevõtjaga , et , et kui ta oma laenutaotlusega vasta Et see on päris päris huvitav tegelikult , eks , et ühest küljest võiks arvata , et võib-olla nõudlus väheneb või noh , mis , mis arvate , eks see ole suhteliselt kindel , kui kui inimestel tööd palka pole , siis nõudlus väheneb , aga teisalt kui nüüd ka pangad jäävad ootele Et pilt selgineks siis , siis nemad võib-olla võtavad veel mingeid tehinguid turult ära , mis muidu ehk toimuda võiks , et mis see tehingute arvuga teha võib ."
20200326_kinnisvaraintervjuu_03_tnu_toompark_kinnisvarakool_ja_jaan_liitme_domus_fnd_o,0,M,14.496999999999998,D,päris,palju,"Tänaseks küll turul selle nime alt lahkunud Nordea oli näiteks äriettevõtted turul päris palju aktiivsem , võrreldes ülejäänud jäänutega ."
20200326_kinnisvaraintervjuu_03_tnu_toompark_kinnisvarakool_ja_jaan_liitme_domus_fnd_o,0,M,14.496999999999998,D,päris,kõvasti,"Ma arvan , see kuvand aitas nüüd päris kõvasti edasi , et , et ."
20210404_episood_3_emoosekandid_ja_co2paraad,0,M,52.372166666666665,D,päris,hästi,"Ta oli enne mingisugune life Kotsch , kes oli sisuliselt no badi , tal ei olnud mitte mingisugust platvormi , siis ta hakkas koroonateemasid postitama ja nüüd ta andis välja raamatu , mis on tegelikult kõik puhas raha , tal on ka mingisugused konsultatsioonid , ma olen vaatanud selle mehega , ma muuseas olen ka ise päris hästi kursis ja ma olen temaga isegi vestelnud umbes tund aega seoses oma tööga ja just nendest samadest teemadest ."
20210404_episood_3_emoosekandid_ja_co2paraad,0,M,52.372166666666665,D,päris,täpselt,"Mina ausalt öeldes ei saanudki päris täpselt aru , et mis seltskond see siis nagu oli või noh , jah , ürituse kirjeldus on ju põhimõtteliselt , rääkis piirangutest on ju , või noh , see see nii-öelda põhisõnum , mida siis korraldajad üritasid edasi anda , et me võitleme piirangute vastu , aga vaatame seda üritust ja kui me vaatame seda nagu kõlapinda , mis nende põhiliste promootorite poolt tuli , siis minul jääb nagu segaseks , et mille vastu nad siis võitlesid , kas , kas nad tahtsid öelda , et koroonat pole olemas , et mask ei , maskid on kahjulikud või siis ma ei , ei saa täpselt sellest aru , et nagu mida nad tahtsid öelda , seal oli mulle tundub , et seal koos nii erinev seltskond , et need inimesed ise ka ei saa aru , mille eest nad nagu selles mõttes võitlesid , et osad olid seal täiesti sellised padu , foolium , mütsikesed osad olid seal sellised , kes olid ainult piirangute vastu , aga kes noh , selles mõttes nad ei ole nagu statup , Wandenõu teoreetikud , et nad lihtsalt olidki piirangute vastu poliitilises mõttes , nagu me enne rääkisime ."
20190115_mehed_ei_nuta_kas_ott_tnak_peaks_olema_aeglasem_kas_lati_alt_jooksis_kullame_vi_klubi_omanik,2,M,14.613833333333332,A,päris,korralik,"Just , ja , ja , ja ega me sellest naiste võrkpallist ikkagi muffigi ei tea , ütleme võib-olla siin koduliigas tead , eks , et kunagi oli Kohila ja kes seal nüüd mängivad , aga see , et neid on niisugune punt üle maailma laiali ja kusjuures päris korralikes liigades ka ."
20190115_mehed_ei_nuta_kas_ott_tnak_peaks_olema_aeglasem_kas_lati_alt_jooksis_kullame_vi_klubi_omanik,2,M,14.613833333333332,A,päris,normaalne,"Et eks esiteks napib tüdrukuid , meil on väga vähe , tüdrukute vanuseklassis on võistkond see on üks asi , teine asi on see , et et ega meil mängib ju naisi ka , mõned mängivad päris normaalsel tasemel väljas , aga neid on palju vähem ."
20190115_mehed_ei_nuta_kas_ott_tnak_peaks_olema_aeglasem_kas_lati_alt_jooksis_kullame_vi_klubi_omanik,2,M,14.613833333333332,D,päris,raskelt,"No nüüd Janne Rits peatreenerina seal üritab ikkagi mingit niisugust uut uut süsteemi luua ja on toonud noori tüdrukuid koondisse ja ja , ja mingit Noh , nagu niisugust professionaalsemaks seda asja viia , aga see tuleb ikka päris raskelt tegelikult noh sest ega seda materjali nüüd nagu ülemäära palju ikka ole , et see naiste korvpall või tüdrukute korvpall ei ole nagu väga populaarne ka Eestis ."
20190115_mehed_ei_nuta_kas_ott_tnak_peaks_olema_aeglasem_kas_lati_alt_jooksis_kullame_vi_klubi_omanik,2,M,14.613833333333332,D,päris,laialt,"Ja järgmine asi on see , et , et jalgpall okei , naiste jalgpalliga hakati üsnagi hiljuti tegelema , aga , aga ma arvan , et ega siin viis-kuus aastat tuleb neile armuaega anda siis ka nõudma hakata finaalturniiridele jõudmist või vähemalt nii-öelda Euroopas 24 sekka jõudmist , sest no jalgpallil on , mida panustada naistesse ja tegelikult see naiste jalgpall on , on päris laialt siin ette võetud , aga jällegi mis tasemel kõik need treeningud on , selgub , et meil on väga head noortetreenerid , väga head noortetööd , tehakse väga head treenerid , kes suudavad need võrkpallinaised Euroopasse välja viia ?"
20190115_mehed_ei_nuta_kas_ott_tnak_peaks_olema_aeglasem_kas_lati_alt_jooksis_kullame_vi_klubi_omanik,2,M,14.613833333333332,D,päris,palju,Et naiste korvpalli juures päris palju me oleme näinud ikkagi selliseid .
20190115_mehed_ei_nuta_kas_ott_tnak_peaks_olema_aeglasem_kas_lati_alt_jooksis_kullame_vi_klubi_omanik,3,M,8.922666666666665,A,päris,suur,"Jah , aga teisest küljest on pisut kõhe ka , et see selle etapi saamine minu arust on selles suhtes päris suur vastutus , et sul peavad need tribüünid ka Otepääl täis olema ."
20190115_mehed_ei_nuta_kas_ott_tnak_peaks_olema_aeglasem_kas_lati_alt_jooksis_kullame_vi_klubi_omanik,3,M,8.922666666666665,D,päris,täis,"Muidugi , aga tahtsingi öelda , et , et see oli nüüd ikka mingi sõprusmängu tase kuskil noh , mitte päris täis koosseisuega ja väravad olid ilusad , eks ole ."
20190115_mehed_ei_nuta_kas_ott_tnak_peaks_olema_aeglasem_kas_lati_alt_jooksis_kullame_vi_klubi_omanik,3,M,8.922666666666665,D,päris,palju,"Ja veel mängus , kusjuures kus Eesti tõi ju päris palju uut verd ka ikkagi ikkagi Eesti koosseisu ja olgem ausad , selle teise värava juures oli näiteks Markus Poomil päris kandev roll ."
20190115_mehed_ei_nuta_kas_ott_tnak_peaks_olema_aeglasem_kas_lati_alt_jooksis_kullame_vi_klubi_omanik,3,M,8.922666666666665,A,päris,kandev,"Ja veel mängus , kusjuures kus Eesti tõi ju päris palju uut verd ka ikkagi ikkagi Eesti koosseisu ja olgem ausad , selle teise värava juures oli näiteks Markus Poomil päris kandev roll ."
