episode_id,section_index,gender,minutes,pos,tunnus,sona,lause
20210519_podcast_noorteaken_10__treening_toitumine_ning_tervis,5,F,21.693833333333338,A,päris,hea,"Variant , või siis on hästi , ma veits reklaamisiin on hästi lahe on see Elisa ilusti elustiili äpp , mis neil on ka niisugune eestikeelne mingisugune äpp või variant , millega sa saad toitu natukene siis trak i on see ingliskeelne nimetusega , et sa paned natukene kirja , pead , mingit toidupäevikut juba see annab sulle päris hea sellise ainsuse silmad , et kui palju sa tegelikult tarbid , mida sa võiksid muuta ja ja sealt jah , aga kuskilt tuleb alustada , see on nagu ja reegel number jälle üks mate , mitmendat korda ma esimene number üks reeglit ütlen ."
20210519_podcast_noorteaken_10__treening_toitumine_ning_tervis,5,F,21.693833333333338,A,päris,äge,"Aga rohkem ma väga ei oskagi välja tuua , et ma arvan , treeningute koha pealt jälle mina alati suunan Eesti erinevate äppide või Eesti siis platvormide suunas , et miks me peame seda välismaale , seda raha või nii-öelda kliente suunama , kui meil on endal ka päris ägedaid variante , et vist vit Ko on nüüd see , mis on samamoodi tehtud , selline onlain , platvorm Eesti treenerite ja treeningute peale , kus on eestikeelseid trenne päris palju , et näiteks see on stepi alt vist leiab selle üles , et stebi on endine sport idee sealt ja siis pit C on siis nende ."
20210519_podcast_noorteaken_10__treening_toitumine_ning_tervis,5,F,21.693833333333338,D,päris,palju,"Aga rohkem ma väga ei oskagi välja tuua , et ma arvan , treeningute koha pealt jälle mina alati suunan Eesti erinevate äppide või Eesti siis platvormide suunas , et miks me peame seda välismaale , seda raha või nii-öelda kliente suunama , kui meil on endal ka päris ägedaid variante , et vist vit Ko on nüüd see , mis on samamoodi tehtud , selline onlain , platvorm Eesti treenerite ja treeningute peale , kus on eestikeelseid trenne päris palju , et näiteks see on stepi alt vist leiab selle üles , et stebi on endine sport idee sealt ja siis pit C on siis nende ."
20210519_podcast_noorteaken_10__treening_toitumine_ning_tervis,5,F,21.693833333333338,A,päris,hea,"Kõik äpid ja lingid on muidu ka alt leitavad , et me paneme ka need sinna , et siis saate minna uudistama , mida mina kasutasin , vahepeal oli ka niktreening klaavi äpp , et tegelikult ma ei teinud , noh , mina nagu pigem kasutasin seda inspiratsiooni otsimiseks , et mis harjutusi nagu teha ja samas pinterssis ka nagu tegelikult ja Youtube 'is samamoodi , et noh , paned sisse , leiad juba hakka tegema , onju , et , et selles suhtes , et selliseks inspiratsiooni otsimiseks tegelikult päris hea ja mida mina näiteks ka kui ma olen , teen nagu trenni , ma ei saa teha kunagi mingi kindla kava järgi , et mul peab olema alati mingi enda sellised nagu noh , ma ei saa teha mingit harjutust , mis mulle päriselt nii nagu vastumeelne on , et ma ei taha seda teha , et mul on alati kõik need harjutused , mis mulle meeldivad , mida ma tahan teha ja see annab ka sellise positiivse tundet tegelikult trenni teha ."
20210519_podcast_noorteaken_10__treening_toitumine_ning_tervis,5,F,21.693833333333338,A,päris,naljakas,"Seda on päris naljakas kuulda , et keegi ütleb nii rõõmsalt , et talle meeldib joosta , sest tavaliselt on kõik inimesed nagu mina küll ei jookse , ei ."
20210519_podcast_noorteaken_10__treening_toitumine_ning_tervis,5,F,21.693833333333338,A,päris,hea,"See oleks päris hea võimalus , kui keegi teine teeks sinu eest ."
20210519_podcast_noorteaken_10__treening_toitumine_ning_tervis,5,F,21.693833333333338,D,päris,palju,"Kõigi treeneriamet nüüd kindlasti kõik treenerid , kes mind kuulavad , ütlesid , kuidas siis nii et nad ikka nädalavahetusel ka minema trenni ja aga nagu sa pead ise suutma ennast välja lülitada ja et sa ei vasta nendele meilidele nädalavahetusel , mis sulle tulevad ja sa vastad neile esmaspäeva hommikul , sest et nädalavahetus on puhkeaeg ja et see on nagu sellest töökoormusest võib-olla puhkamine , aga muidu füüsiline puhkamine ja ma arvan , meie keha ütleb meile päris palju , ise tuleb nagu iseennast kuulata , et mina saan aru päevadel või nagu mingitel hetkedel , kui ma hakkan väga ära väsima , siis ma otsin kaootiliselt niimoodi istumispaika alati ."
20210519_podcast_noorteaken_10__treening_toitumine_ning_tervis,6,F,7.120999999999996,D,päris,päris,"No igapäevaelus vist jah , üldjuhul näeme niimoodi naigis kuskil pealaest jalatallani jah , et ja ka isegi nädalavahetusel ja isegi ja päris päris palju , aga tegelt ei , mul on ikka jumala palju ka igast suvekleite ja muid riideid ka , et selles mõttes mul on vist pool ja pool tegelikult ."
20210519_podcast_noorteaken_10__treening_toitumine_ning_tervis,6,F,7.120999999999996,D,päris,palju,"No igapäevaelus vist jah , üldjuhul näeme niimoodi naigis kuskil pealaest jalatallani jah , et ja ka isegi nädalavahetusel ja isegi ja päris päris palju , aga tegelt ei , mul on ikka jumala palju ka igast suvekleite ja muid riideid ka , et selles mõttes mul on vist pool ja pool tegelikult ."
20190204_63_saade__niad_helve_ja_liina_soovitavad_armastust_maagiaga_mitte_meelitada,0,F,36.162,D,päris,palju,"Päris palju on neid , kes helistavad ja küsivadki , et ma tahan seda armuloitsu saada ja et kas mina tegelen nendega või ei tegele siis ma alati proovin alguses rääkida nendest tagamaadest ."
20190204_63_saade__niad_helve_ja_liina_soovitavad_armastust_maagiaga_mitte_meelitada,0,F,36.162,D,päris,kõvasti,"Ja , ja aga ma olen pidanud neid tagajärgi päris kõvasti lappima ."
20190204_63_saade__niad_helve_ja_liina_soovitavad_armastust_maagiaga_mitte_meelitada,0,F,36.162,D,päris,palju,"Aga tegelikult ei ole vaid päris palju , tuleb ikka vaadata sinna seda lugu niimoodi , et naine peab ikka , on ka ise süüdi ."
20190204_63_saade__niad_helve_ja_liina_soovitavad_armastust_maagiaga_mitte_meelitada,1,F,6.474666666666667,A,päris,ehtne,"Kõige armsam ja ohutum , et kui sul on sõpradega probleemid , et näed saatejuhiga , läksime omavahel raksuga , saadet on vaja teha , siis seda , selle tehnikaga on võimalik seda harmoniseerida t ja tegelikult siis on mul siin kokku keeratud päris ehtsate nende taimedega ."
20200608_liisa_pakosta__naistele_ks_palk_ja_meestele_teine,0,F,24.0745,D,päris,tegelikult,"Mitte päris tegelikult ma läksin kunstiakadeemiast sinna et vahepeal töötasin kunstiakadeemias , ei ole kahetsenud ."
20200608_liisa_pakosta__naistele_ks_palk_ja_meestele_teine,0,F,24.0745,A,päris,tähtsusetav,Ja niisiis päris tähtsusetav viitamine siiski ka ei olnud .
20200608_liisa_pakosta__naistele_ks_palk_ja_meestele_teine,0,F,24.0745,D,päris,palju,"Seda mõjutab päris palju asju , ehk kõige lühem vastus oleks sellele see , et mõjureid on hästi palju ."
20200608_liisa_pakosta__naistele_ks_palk_ja_meestele_teine,0,F,24.0745,A,päris,noor,"Palgalõhet ei ole päris noorte naiste hulgas ja ta väheneb omakorda siis hiljem , kui naised on vanemad ."
20200608_liisa_pakosta__naistele_ks_palk_ja_meestele_teine,0,F,24.0745,D,päris,palju,"Ikkagi me oleme saavutanud päris palju selliseid häid tulemusi just sellistes juhtudes , kus see diskrimineerimine on olnud , otsene otsene diskrimineerimine on siis , kui näiteks naine tuleb lapsehoolduspuhkusel tööle tagasi ja tema palk jäetakse sellepärast väiksemaks , et ta on olnud lapsega kodus ."
20200608_liisa_pakosta__naistele_ks_palk_ja_meestele_teine,0,F,24.0745,D,päris,nõus,"Ma sellega muuseas ei ole päris nõus , et see on alati olnud kahjulik , et tegelikult on see väga viimase aja küsimus ."
20200608_liisa_pakosta__naistele_ks_palk_ja_meestele_teine,0,F,24.0745,A,päris,oluline,"Kui me vaatame nüüd suuremat trendi jällegi maailmas , siis see , et naisi on nii vähe tehnoloogilisel erialadel mõjutab tegelikult palgal he või sissetulekute lõhe kasvu päris olulisel määral , et kui me vaatame suurt trendi , siis naiste ja meeste sissetulekute vahe maailmas kasvab ."
20210318_webinar_ettevtja_kinnisvararis,0,F,8.362666666666666,D,päris,hästi,"No ma arvan , et tere veelkord , muidugi ma arvan , et mul on tegelikult läinud päris hästi arvestades seda , et ma tulin ka tegelikult täiesti sellise nullkogemusega ja ka minuga juhtus see tegelikult ootamatult , et ma siia sattusin ja ma arvan , et see on mind väga palju nende selle vähese ajaga tegelikult juba arendanud ."
20210318_webinar_ettevtja_kinnisvararis,1,F,6.0778333333333325,D,päris,palju,"Sest kõik ei ole ilmselgelt roosamanna , seal on päris palju rasket tööd , seal on ka see tounsi ."
20210318_webinar_ettevtja_kinnisvararis,2,F,19.540166666666664,D,päris,ausalt,"Et see on tõesti väga-väga super , et ma ei ole tükk aega tegelikult päris ausalt , otsisin päris pikalt seda , seda uut väljakutset ja nüüd ma tunnen , et ma väga õiges kohas ja see on nagu väga-väga kihvt tõesti ."
20210318_webinar_ettevtja_kinnisvararis,2,F,19.540166666666664,D,päris,pikalt,"Et see on tõesti väga-väga super , et ma ei ole tükk aega tegelikult päris ausalt , otsisin päris pikalt seda , seda uut väljakutset ja nüüd ma tunnen , et ma väga õiges kohas ja see on nagu väga-väga kihvt tõesti ."
20210318_webinar_ettevtja_kinnisvararis,2,F,19.540166666666664,V,päris,kahetsema,"Aga ühes teises büroos ma lõin natuke põnnama ja ausalt öeldes ma päris kahetsesin seda , sest võib-olla praegu ma oleks juba teate veel edukam , aga jällegi ju siis ootas mind Arko vara , nii et ma arvan , et praegu on see õige aeg ."
20210318_webinar_ettevtja_kinnisvararis,2,F,19.540166666666664,A,päris,aktiivne,"CV Online mari andis viieks , et töötukassa lehe kaudu telefoni kaudu leiate arkovara ka Instagramist päris aktiivsed olema seal tegutsemas , nii et kui sa vähegi oled selline sotsiaalmeedia inimene , siis meie kanalid on kõik täidetud hommikust õhtuni erinevate , siis nii kinnisvara kui inimeste kui elulaadi kui elustiili teemadega , nii et veel kord suur aitäh kõigile kuulamast ."
20200330_1_lle_madise_intervjuus_eesti_inimeste_igusi_ei_tohi_ikka_grammigi_rohkem_piirata,0,F,11.714,A,päris,huvitav,"Eks selle üle saab nüüd igaüks ise juurelda , et sellest kirjutasin ka sotsiaalmeedias , muide see on päris huvitav arutelu , et keda huvitab siis Facebookis minu kontolt leiate selle päris põneva piikide ristamise , kus esitatakse väga palju minu meelest ka häid küsimusi ja neile siis oleme püüdnud vastata jõudumööda ."
20200330_1_lle_madise_intervjuus_eesti_inimeste_igusi_ei_tohi_ikka_grammigi_rohkem_piirata,0,F,11.714,A,päris,põnev,"Eks selle üle saab nüüd igaüks ise juurelda , et sellest kirjutasin ka sotsiaalmeedias , muide see on päris huvitav arutelu , et keda huvitab siis Facebookis minu kontolt leiate selle päris põneva piikide ristamise , kus esitatakse väga palju minu meelest ka häid küsimusi ja neile siis oleme püüdnud vastata jõudumööda ."
20200330_1_lle_madise_intervjuus_eesti_inimeste_igusi_ei_tohi_ikka_grammigi_rohkem_piirata,0,F,11.714,D,päris,täpselt,"No ma ei kujuta ka päris täpselt ette , et mis siin üldse arutada on , et see on üks välispoliitiline samm ja see eelnev arutelu Noh , ju ta poliitikute vahel oleks võinud toimuda , et miks sellist välispoliitilist sammu tarvis on , aga nüüd , kui me räägime juriidilises plaanis , et siis juriidilise plaanis on asi võrdlemisi selge , põhiseaduse kehtib edasi valitsusele see samm , mingeid laiemaid käsi ei anna , kõik see , mis oli lubatud enne , on lubatud ka pärast seda teadet , nii et et juriidilises plaanis ma seda arutelu vajadust nii palju ei näe , aga poliitiliselt eks iga riik kujundab oma välispoliitikat nii , nagu ta seda teeb , nii nagu kombeks on ja kultuur lubab ."
20200330_1_lle_madise_intervjuus_eesti_inimeste_igusi_ei_tohi_ikka_grammigi_rohkem_piirata,1,F,10.887333333333336,D,päris,selgesti,Ja Martin Helme on päris selgesti välja öelnud .
20210305_podcast_noorteaken_5__anne_noortekeskus,1,F,26.269833333333334,D,päris,niimoodi,"No ma tean , ma tahtsin ise ka tuubitama minna , aga mulle ei sobinud see kuupäev , nii et nii et ei , aga tegelikult näha on , et tõesti noored ju ikkagi võtavad osa , et ei ole päris niimoodi ilma tegevust ."
20210305_podcast_noorteaken_5__anne_noortekeskus,1,F,26.269833333333334,D,päris,korralikult,"No praegu hoid , hoiame pöidlaid pihus , et saab toimuda ja saaks toimuda natuke suuremalt kui eelmine aasta , sest et kui eelmine aasta see koroona tuli , siis ta tõmbas tegelikult selle maleva mahu ikka päris korralikult alla , et üle poole põhimõtteliselt , et vähem noori sai tulla kui tavaliselt , et kui on umbes 150 200 noort tavaliselt siis eelmine aasta sai malevakoha ainult 70 noort ."
20210305_podcast_noorteaken_5__anne_noortekeskus,1,F,26.269833333333334,D,päris,palju,"Bensiinijaamad ja mingid eestlased ka , onju , et tegelikult on päris palju võimalusi , kuidas leida nagu tööd ja et kuhu minna ."
20210305_podcast_noorteaken_5__anne_noortekeskus,1,F,26.269833333333334,D,päris,nii,"Aga Me oleme rääkinud , on ju natukene Anne noortekeskusest , me oleme natuke rääkinud sinust , me oleme rääkinud teie karjääri suunast ja sa oled natukene ka maininud , et Anne noortekeskuse hoov ei ole võib-olla päris nii kutsuv , et võiks kõik noored siia kutsuda ja vaba aega veeta , et mina tean , et teie soovite Anne noortekeskuse hoovi muuta natukene noortepärasemaks ja atraktiivsemaks , millised on need plaanid , siis on noortekeskuse hooviga teil praegu ?"
20210305_podcast_noorteaken_5__anne_noortekeskus,1,F,26.269833333333334,D,päris,kiiresti,"Tänane episood on päris kiiresti läinud , ütlen ausalt , ma ei olegi vist selle saate ajal ühtegi nii kiiret episoodi salvestanud ."
20210727_arco_akadeemia_podcast_viljandi_maakonna_kinnisvaraturu_i_poolaasta_levaade,0,F,2.201,A,päris,tore,"No need , kes käivad Viljandis kindlasti ühel hetkel või teisel hetkel , armuvad sellesse linna ja vaatavad , et seal on päris tore olla ja ma ei usu , et teiegi seal linnas elate , kui teile ei meeldiks see ja , ja endalegi , kui ma mõtlen Viljandi peale , siis selles on midagi erilist räägimegi kinnisvarast , sest see on seotud sellesama armumisega linna , sest ühel hetkel otsustab keegi pealinnast kolida Viljandisse ja , ja tahab seal omale kodu osta ."
20210727_arco_akadeemia_podcast_viljandi_maakonna_kinnisvaraturu_i_poolaasta_levaade,1,F,26.025333333333332,A,päris,huvitav,"Ja ja kui , kui seestpoolt nii-öelda ostjad ostjad tuleksid Absoluutselt uus arendused on üldse väikelinnades päris huvitav teema ."
20210727_arco_akadeemia_podcast_viljandi_maakonna_kinnisvaraturu_i_poolaasta_levaade,1,F,26.025333333333332,A,päris,suur,"Nii et anna , ma kujutan ette , et sa pead iga päev kuulma ostuhuvilistelt just nagu selliseid põhilisi , et millal tuleb ja millal saab ja et põhimõtteliselt see , see surve ikkagi nagu pakkumiste on päris suur , et neid tuleks juurde , sest asju on nagu vähe pakkuda ."
20210727_arco_akadeemia_podcast_viljandi_maakonna_kinnisvaraturu_i_poolaasta_levaade,1,F,26.025333333333332,A,päris,suur,"Et kui varasemalt oli see , et see kindlasti peaks olema Viljandi linnas , siis nüüd vaadatakse natukene juba väljapoole ka circa 10 kilomeetri raadiusesse Viljandist on huvi ikkagi päris suur ."
20210727_arco_akadeemia_podcast_viljandi_maakonna_kinnisvaraturu_i_poolaasta_levaade,1,F,26.025333333333332,A,päris,suur,"Kui rääkida nüüd me rääkisime nii palju kruntidest , et Aime , sa ütlesid , et need 60 krunti tegelikult müüsid uskumatult hästi ära , et kas sellest võib arvata , et Viljandi nüüd linnas ma saan aru , on kruntide nagu nõudlus päris suur , kuidas see maakonnas tundub ?"
20210727_arco_akadeemia_podcast_viljandi_maakonna_kinnisvaraturu_i_poolaasta_levaade,1,F,26.025333333333332,D,päris,palju,"Viljandi on ju nagu järvede maa , et seal on minu meelest neid järvesid päris palju , et võiks arvata , et tõesti , inimeste nagu huvi Viljandi just selliste talukohtade suhtes on kasvanud , et kuidas see teie praktika praegu tundub , et otsitakse neid talukohti ."
20210727_arco_akadeemia_podcast_viljandi_maakonna_kinnisvaraturu_i_poolaasta_levaade,1,F,26.025333333333332,D,päris,palju,"Väga väga , väga , väga , et Viljandi ümbruses on päris palju suvilapiirkondi ehk aiamajad , suvilad , neid on kohe tõesti päris palju ja , ja sinna võetakse hästi ."
20210727_arco_akadeemia_podcast_viljandi_maakonna_kinnisvaraturu_i_poolaasta_levaade,1,F,26.025333333333332,D,päris,palju,"Väga väga , väga , väga , et Viljandi ümbruses on päris palju suvilapiirkondi ehk aiamajad , suvilad , neid on kohe tõesti päris palju ja , ja sinna võetakse hästi ."
20210727_arco_akadeemia_podcast_viljandi_maakonna_kinnisvaraturu_i_poolaasta_levaade,1,F,26.025333333333332,A,päris,põnev,"Ja , ja uus uued hinnatasemed on , on kuulda , et praegu hetkel on vist eramajadest Viljandis kallim hind olnud , et 277000 nii-öelda eramu hind Viljandi järve ääres siis seal uusarenduse samamoodi , et sinna hinnaklassi 200 100 ja 300 vahel on kuulda , et on uued majad kerkimas , et see on päris põnev , põnev arendus seal ja siis seal on nagu igat masti maju tulemas , mida Viljandis varem ei ole olnud ."
20220216_kristina_kallas_eesti_200_ei_tegele_kersti_kaljulaiu_teemaga,0,F,20.730666666666668,A,päris,loll,"Enne veel , kui me jõuame reitingute juurde , ikkagi see Kersti Kaljulaiu küsimus , teie võite küll öelda , et ei tegele sellega iga päev , aga meedia mõtleb sellest iga päev ja mõnes mõttes olete te ju päris lollis olukorras , see on see , mida oodatakse ."
20220216_kristina_kallas_eesti_200_ei_tegele_kersti_kaljulaiu_teemaga,0,F,20.730666666666668,A,päris,selge,"Teil on tõepoolest väga hea toetus ja juba pikemat aega on päris selge , et Eesti erakonna maastik on põhimõtteliselt teisenenud ."
20220216_kristina_kallas_eesti_200_ei_tegele_kersti_kaljulaiu_teemaga,0,F,20.730666666666668,D,päris,tihti,"Kui me ainult toimetame selliste nelja-aastastes tsüklitega , mida vanad erakonnad päris tihti teevad , et noh , mida me nelja aasta jooksul suudame inimestele ära lubada , selle paneme valimisprogrammi sisse , ülejäänud asjadega ei tegele , aga ülejäänud asjad on jäetud tegeleda ametnikkonnale ."
20220216_kristina_kallas_eesti_200_ei_tegele_kersti_kaljulaiu_teemaga,0,F,20.730666666666668,D,päris,palju,"Kui tähelepanelikult jälgite isikutevahelist dünaamikat , on ju päris palju räägitud sellest , et poliitiline valitsemine valitsuses on keeruline just selle tõttu , et Ratas ja Kallas teineteisele ülearu hästi ei meeldi ."
20220216_kristina_kallas_eesti_200_ei_tegele_kersti_kaljulaiu_teemaga,0,F,20.730666666666668,D,päris,palju,"Hästi te ise panustasite 3500 eurot , seda on päris palju ."
20220308_sodiaagisosinad_07031303_tundekllane_ndalalpp_loob_unenolise_atmosfri,0,F,17.593000000000004,A,päris,eriline,"Noh , tegelikult see on päris eriline , see , et nüüd on ikkagi me lähme nüüd hästi sügavalt kalade energiasse sisse , kuna on ju etuna , on niikuinii see kalade valitseja Jupiter , kes on ka traditsiooniline kalade valitseja on ka kalades hetkel seal lähedal ja , ja noh , nüüd on päike ka seal nende vahel täpselt kusjuures praegu on täpselt päike Jupiteri ja neid tunninagu keskpunkti seal kalades ."
20220308_sodiaagisosinad_07031303_tundekllane_ndalalpp_loob_unenolise_atmosfri,0,F,17.593000000000004,A,päris,oluline,"Et praegu on päris oluline tegelikult , kuidas me oleme seesmiselt häälestatud , sest et asjad võivad nagu hästi kiiresti manifesteeruda mingisuguse välise sündmusena ."
20220308_sodiaagisosinad_07031303_tundekllane_ndalalpp_loob_unenolise_atmosfri,1,F,3.3610000000000015,D,päris,nii,"Midagi siis selle valitseva valitsevate vormidega ja ja struktuuridega , et nad ikkagi päris nii edasi enam ei lähe , nagu see on olnud ja nagu see praegune olukord on lihtsalt hästi tugev peegeldus sellest minevikust täpselt sellest kaljukese minevikust , kus me oleme nüüd välja astumas juba nagu ühe jalaga olemegi väljas tegelikult juba , aga mingi nagu varvas on veel seal sees ."
20220308_sodiaagisosinad_07031303_tundekllane_ndalalpp_loob_unenolise_atmosfri,2,F,15.383333333333333,D,päris,seal,"Et ta on just nagu see , et ta suudab nagu luua seda illusiooni , et mingi olukord näeb välja nagu armastus , aga ta on nagu rohkem selline , et noh et seal ei pruugi , et süda nagu päris seal sees alati ei ole ."
20220308_sodiaagisosinad_07031303_tundekllane_ndalalpp_loob_unenolise_atmosfri,2,F,15.383333333333333,D,päris,sageli,"Jah , ja seal hakkab mul see mu ülim veevalaja , liikus ka nagu üle sõitma , päris sageli , et et , et jah , oma seda põhiolemust suurt ei ole , et ma ikka väga kergesti jah , lähen nagu välja ka ."
20210112_abielurefendum_vib_lpetada_riigikohtus_viitab_lle_madise,1,F,4.169000000000001,A,päris,suur,"Eesti valitsus on siiamaani olnud pigem tubli , ma ütleks , sest kui me vaatame ringi , siis tundub , et paljud riigid on teinud päris suuri vigu ja see on ka see , miks ma ütlen , et teistelt riikidelt on ennekõike õppida , mida mitte teha , mitte seda , mida teha ."
20210112_abielurefendum_vib_lpetada_riigikohtus_viitab_lle_madise,1,F,4.169000000000001,D,päris,hästi,"Ja meil mulle tundub , on pigem läinud päris hästi , et on see teadusnõukoda , kus on oma valdkonna parimad eksperdid ."
20190408_68_saade__hingamisterapeudid_annavad_npuniteid_kuidas_end_terveks_ja_nnelikuks_hingata,0,F,39.77,A,päris,jube,"Jah , kõik me oleme sünnitanud , onju , ja teame , et päris jube on ."
20190408_68_saade__hingamisterapeudid_annavad_npuniteid_kuidas_end_terveks_ja_nnelikuks_hingata,0,F,39.77,A,päris,reaalne,"Ma olen väga uudishimulik , ma tahaks teada , mis toimub nagu mis , mis kehas konkreetselt toimub seal sel ajal , kui sa , et see ei ole ju mingi selline , mida me ette kujutame , nagu see nii-öelda siis esoteerika pool vaid see on päris reaalne inimene , hingab , mis , mis on selle , mis vahet sellel on , et kui ma noh , nii , ma saan aru , et see intensiivsem , aga mis mu kehas sest toimub ja mis nagu no ütleme , võtame sellesama klaasi vett , et kui siin põhjas on mingit sodi mustust ja , ja kui sa hakkad noh , liigutama lusikaga , siis see sodi tuleb nagu ülesse ja kui valla valada veel puhast vett nüüd peale ütleme , puhast õhku õhku , siis see sodi hakkab vaikselt välja voolama ja lõpuks on siis ikkagi meil puhas klaas ."
20190408_68_saade__hingamisterapeudid_annavad_npuniteid_kuidas_end_terveks_ja_nnelikuks_hingata,0,F,39.77,A,päris,tore,"Ja nii sünd kui ka siis sünnitus on tegelikult üks , üks asi , mis loob seda suhtumist maailma ja , ja ka üldse neid käitumismudeleid ja malle , et on päris toredaid ja vahvaid raamatuid sellest , kuidas kogu see raseduse aeg , mis me oleme seal kõhus , ema kõhus , kuidas see peegeldub meie elus ja tõsi ka kõik need mustrid ka , kuidas me sünnime ka sellel hetkel , kui meid vastu võetakse , et kas meid võetakse seal pumbaga välja või tangide tangidega ja ."
20210220_podcast_noorteaken_4__vaimne_tervis,2,F,48.436166666666665,D,päris,palju,"Aga , aga ma ei tea mulle isiklikult noh , kuna ma olen ka hästi palju nagu just selle teavitustööga ja koolides käimisega seos seotud olnud , siis minu jaoks kindlasti on ka nagu saavutus see , et me oleme jõudnud päris palju paljudesse kohtadesse üle üle Eesti ."
20210220_podcast_noorteaken_4__vaimne_tervis,2,F,48.436166666666665,D,päris,palju,"Et , et ühelt poolt samas nagu vaimse vaimse tervise toega head psühholoogi nõustajad , et neid mustreid , samas mida me oleme õppinud , neid on võimalik noh , märgata ja uusi ja turvalisemaid ja paremaid toetavamaid mustreid õppida ja , ja teiselt poolt , mis on ka nagu meie mõnes mõttes meie organisatsiooni selline tore , tore võimalus on see , et jah , kui sul võib olla mujalt , ei ole neid toetavaid suhteid , siis sa sest sa saad endale nagu samas selle toetava ringi ja nagu sõpruskonna ja nii-öelda teise perekonna nagu tekitada , et , et selles mõttes , et see kindlasti ei ole ka nii noh , mustvalge , et kui sa ei ole seda head stardi stardi kohta saanud , siis , siis annab ka samas päris palju ära ära teha nagu tulevaste tulevaste Võimaluste ja inimestega enda ümber , aga jah , minu olulisi mõtteid , et kui sul on , kui sul on head inimesed , siis ."
20210220_podcast_noorteaken_4__vaimne_tervis,4,F,37.53383333333333,A,päris,sünge,"No kuna on see õige hetk , siis , kui kus peaks pöörduma spetsialisti poole mitte ainult enesetkahjustava käitumisega , vaid ka , nagu , kui sa tunned ennast juba , et mõtted on sellised päris sünged ja et elu on jama ja ei nagu pigem ei tahaks , et kuna on see hetk , kuhu pöörduda ja kella poole kõige lihtsamini ja kust alustada ."
20210220_podcast_noorteaken_4__vaimne_tervis,4,F,37.53383333333333,A,päris,halb,"Kõik need kontaktid , kus saab ka nagu vaadata , on ju , aga aga kuidas selline kiire nagu , kuidas me saame oma vaimset tervist hoida , selline kiire hügieeni , mida me saaks iga päev kõik teha , on ju , et noh , hamba hambapesu hambapesuks , aga nagu mis on see , et kuidas me saaks oma vaimset tervist nagu hoida , et Ta jääks nagu mina võin ühe soovitasin öelda , et mina mulle meeldib joonistada ja maalida , näiteks tegema siis teen seda , et kui mul on nagu päris halb olla , siis ma võtan kätte ja maalin või kaunistan midagi või mis ma olen hiljuti avastanud , mulle meeldib hullult neid ."
20210220_podcast_noorteaken_4__vaimne_tervis,4,F,37.53383333333333,D,päris,päris,Ehk et ehk et seal saabki seda päris päris lihtsasti teha .
20210220_podcast_noorteaken_4__vaimne_tervis,4,F,37.53383333333333,D,päris,lihtsasti,Ehk et ehk et seal saabki seda päris päris lihtsasti teha .
