episode_id,section_index,gender,minutes,verb,lause
20210727_arco_akadeemia_podcast_viljandi_maakonna_kinnisvaraturu_i_poolaasta_levaade,1,F,26.025333333333332,tundub,"Viljandi on ju nagu järvede maa , et seal on minu meelest neid järvesid päris palju , et võiks arvata , et tõesti , inimeste nagu huvi Viljandi just selliste talukohtade suhtes on kasvanud , et kuidas see teie praktika praegu tundub , et otsitakse neid talukohti ."
20210727_arco_akadeemia_podcast_viljandi_maakonna_kinnisvaraturu_i_poolaasta_levaade,1,F,26.025333333333332,ütleme,"Võib-olla niisugune kommunikatsioon ka nagu olemas natukene , et ütleme , et seal on tekitatud mingid ühised puurkaevud elekter on olemas , et see annab inimesele selle võimaluse , et ta saab ka koheselt siia juba tulla ."
20210727_arco_akadeemia_podcast_viljandi_maakonna_kinnisvaraturu_i_poolaasta_levaade,1,F,26.025333333333332,usun,"Ehk siis Viljandisse peaks kunagi tulema ka uus paani , kui meediast on läbi käinud , ma usun , et sellised atraktsioonid kindlasti toovad jälle rahvast juurde ."
20210727_arco_akadeemia_podcast_viljandi_maakonna_kinnisvaraturu_i_poolaasta_levaade,1,F,26.025333333333332,usun,"No loodame , et ta tuleb , tõepoolest , usun , et selline turismiturismi nagu osakaal Eestis võiks veel ju kasvada ."
20210727_arco_akadeemia_podcast_viljandi_maakonna_kinnisvaraturu_i_poolaasta_levaade,1,F,26.025333333333332,arvan,"Just kui vaadata viimast kümmet aastat ja seda kõveri , kuidas kinnisvarahinnad on Viljandis või üldse Eestis tõusnud , siis me oleme näinud tegelikult ainult ühte joont ja see on ainult ülespoole olnud , et kujutan ette , aime , kui me oleks 15 aastat tagasi rääkinud , ühel hetkel on Viljandi kahe-kolmetoalise korteri ruutmeetri hind 1000 eurot , siis ma arvan , et võib-olla oleks sel hetkel isegi pidanud seda inimest hulluks , et et ei oleks seda arvanud ."
20210727_arco_akadeemia_podcast_viljandi_maakonna_kinnisvaraturu_i_poolaasta_levaade,1,F,26.025333333333332,ütleme,"Aga mis , kui me siin äripindade juurde veel tulime , siis mis on huvitav vaadata , et päris palju kohvikuid on Viljandis juurde tulnud , et seda on tore tore näha ja kui mingil ja nii-öelda ajakirjandus kirjutas , et Viljandi selline üks vanalinna nii-öelda Tartu tänav on täis selliseid kasutatud rõivaste poodi ja see oli üks trend siin ütleme selline viis aastat tagasi ."
20210727_arco_akadeemia_podcast_viljandi_maakonna_kinnisvaraturu_i_poolaasta_levaade,1,F,26.025333333333332,tundub,"Üldse tundub , nagu , et Viljandis on äge ja rääkimata sellest , et ka infrat tuleb juurde , tuleb ka seda teenindust , kus sa saad , kus sa saad , kui peredega peredega olla , et sul on võimalus seal ka puhata , nii et see on , see on olnud podkast võib-olla nüüd küll Viljandi kiituseks , aga inimesed elavad ju seal , kus neile üldiselt meeldib elada ja , ja kui , kui ma olen ise pannud tähele just seda , et ma olen ise kolinud kaks aastat tagasi Haapsallu üsna samadel põhjustel , et kui lastel on seal ikkagi viie minutiga võimalus kooli minna viie minutiga minna trenni ja , ja ilma , et peaks siis transportööriks hakkama siis tegelikult ja lisaks teenused on kättesaadavad , siis tegelikult võiks arvata , et meie , meie väikelinnad ei ole ammu enam masendavad ja meie väikelinnad on tegelikult niisugused armsad armsad keskused , kus on käia hea puhkamas ja kus on väga hea ka elada ."
20210727_arco_akadeemia_podcast_viljandi_maakonna_kinnisvaraturu_i_poolaasta_levaade,1,F,26.025333333333332,ütleme,"No kui ma mihkli siis meie analüütiku turuülevaadet vaatan , siis üks , mida ta välja toob , ongi see , et see soov ütleme , liikuda siis korterist tegelikult elamusse Eramusse on tegelikult kasvamas ja see on kasvamas igas väikelinnas ja seetõttu tundub just , et see on ka Viljandi teema , et tegelikult inimeste soov suurema elamispinna järgi ja oma murulapi järgi eriti kui sa oled sellises väiksemas armsas väikelinnas on tegelikult selline noh , uus uus uus nõudlus või uus uus vajadus ."
20210727_arco_akadeemia_podcast_viljandi_maakonna_kinnisvaraturu_i_poolaasta_levaade,1,F,26.025333333333332,tundub,"No kui ma mihkli siis meie analüütiku turuülevaadet vaatan , siis üks , mida ta välja toob , ongi see , et see soov ütleme , liikuda siis korterist tegelikult elamusse Eramusse on tegelikult kasvamas ja see on kasvamas igas väikelinnas ja seetõttu tundub just , et see on ka Viljandi teema , et tegelikult inimeste soov suurema elamispinna järgi ja oma murulapi järgi eriti kui sa oled sellises väiksemas armsas väikelinnas on tegelikult selline noh , uus uus uus nõudlus või uus uus vajadus ."
20210727_arco_akadeemia_podcast_viljandi_maakonna_kinnisvaraturu_i_poolaasta_levaade,1,F,26.025333333333332,ütleme,"Ja et ütleme sellised järelturumajad millede hind oli varem siin 80 kuni 100000 , siis nende hinnaga praegu on siin 100 kuni , 150000 ja ega väga võtta ei ole ka ."
20220216_kristina_kallas_eesti_200_ei_tegele_kersti_kaljulaiu_teemaga,0,F,20.730666666666668,arvan,"Ma ei pea silmas seda , et meil on füüsiline rünnak , vaid et toimub näiteks küberrünnak , et me , ma arvan , me peame kõikideks nendeks stsenaariumiteks valmis olema ja mitte ainult täna peame ikka üsna-üsna iga päev praktiliselt selleks ikkagi valmis olema ."
20220216_kristina_kallas_eesti_200_ei_tegele_kersti_kaljulaiu_teemaga,0,F,20.730666666666668,arvan,"Ma arvan , et seda on vaja ikkagi tema käest küsida , et tema peab omaenda plaanid ju ära tegema ."
20220216_kristina_kallas_eesti_200_ei_tegele_kersti_kaljulaiu_teemaga,0,F,20.730666666666668,arvan,"Ma arvan , et selle taga on väga suur rahulolematus ühiskonnas , noh nii nagu ka EKRE toetuse taga See rahulolematus kanaliseerub täna nendesse alternatiivsetesse erakondade , see rahulolematus on olemas olevate erakondadega , kes on ammu poliitikas toimetanud ja võimul olnud ."
20220216_kristina_kallas_eesti_200_ei_tegele_kersti_kaljulaiu_teemaga,0,F,20.730666666666668,arvan,"Tõsi , see on vähetõenäoline , nüüd ma arvan , aga siiski , kas see on võimalik ?"
20220216_kristina_kallas_eesti_200_ei_tegele_kersti_kaljulaiu_teemaga,0,F,20.730666666666668,arvan,"Ei , ma arvan , et see ei ole võimalik , ehk siis tegelikult me oleme järgmises valitsuses ja järgmises valitsuses on meie roll survestada seda , et me teeme otsuseid , mis vaatavad kümme-viisteist aastat ette , muuhulgas ka neid , mis on vaja täna teha ."
20220216_kristina_kallas_eesti_200_ei_tegele_kersti_kaljulaiu_teemaga,0,F,20.730666666666668,arvan,"Meil läks kohalikel valimistel üldse hästi , ma arvan , et seal taga on ka see toetuse tõus ."
20220216_kristina_kallas_eesti_200_ei_tegele_kersti_kaljulaiu_teemaga,0,F,20.730666666666668,arvan,"Ma elan Tartus , ma elan Tartus 26 aastat , et ma arvan , et oleks ebaaus , kui ma oleks tulnud Tallinnasse volikogus ajama Tallinna asju linnas , kus ma tegelikult ei ela ."
20220216_kristina_kallas_eesti_200_ei_tegele_kersti_kaljulaiu_teemaga,0,F,20.730666666666668,arvan,"Ma arvan , see ei oleks aus ."
20220216_kristina_kallas_eesti_200_ei_tegele_kersti_kaljulaiu_teemaga,0,F,20.730666666666668,arvan,"Ja ma arvan , et kõige kriitilisem minu arust kõige suuremad vead tehti kusjuures ikkagi selle vaktsineerimise korraldamisega , sealt edasi on nagu õppetunnid juba tulnud ja paremini läinud ."
20220216_kristina_kallas_eesti_200_ei_tegele_kersti_kaljulaiu_teemaga,0,F,20.730666666666668,arvan,"Ei kõrvalt on ju väga lihtne targutada , aga ma arvan , et niisugust otsusekindlust ikkagi soovitaks talle , et Jüri Ratas ja , ja mitte ainult Jüri Ratas , aga opositsioon loomulikult ka mängib sellist poliitilist mängu ja ma saan aru , et väga ebameeldiv on seda kaasa teha , kui sa pead samal ajal tegelikult kriiside lahendamisega tegelema ."
20220216_kristina_kallas_eesti_200_ei_tegele_kersti_kaljulaiu_teemaga,0,F,20.730666666666668,arvan,"Ja , ja see peakski olema Eesti selline pikk plaan , mismoodi meist saab õnnelike ja rikaste inimeste riik , ma arvan , Singapur on siin muuseas väga hea näide selline vaene kaluriküla , kes otsustas , et ainuke vara , mis tal on , millesse investeerida , on tema inimene ja ta seda tegi ja , ja sealt see rikkus ja heaolu tegelikult tuleb ja meil on täpselt sama tee ."
20220216_kristina_kallas_eesti_200_ei_tegele_kersti_kaljulaiu_teemaga,0,F,20.730666666666668,arvan,"Ma arvan , et me peaksime sellest pandeemia strateegiast minema nagu selliste viiruste hooaja strateegiasse , et et me ei tegele enam pandeemiaga , me tegeleme sellega , et meil on kõrgendatud viiruste hooaeg , see tähendab seda , et inimesi tuleb suunata vaktsineerima võimalikult palju vaktsineerimine hästi kättesaadav , pidevalt meelde tuletada ."
20220216_kristina_kallas_eesti_200_ei_tegele_kersti_kaljulaiu_teemaga,0,F,20.730666666666668,arvan,"Kaotada tuleb käsi , pesta , tuleb distantsi hoida , tuleb kontakte vähendada , koroonapass kaotada või , aga ma arvan , et see ei täida täna enam oma funktsiooni siia riiki ."
20220216_kristina_kallas_eesti_200_ei_tegele_kersti_kaljulaiu_teemaga,0,F,20.730666666666668,tundub,"Kahjuks mulle tundub , et valitsusel ei ole plaani rohepöörde osas , nad ei ole selget aru saama sellest , mis nüüd siis tegema tuleb hakata , sellest räägitakse ."
20220308_sodiaagisosinad_07031303_tundekllane_ndalalpp_loob_unenolise_atmosfri,0,F,17.593000000000004,arvan,"Aga just siis , kui tuleb Ja me arutasime seda vist eelmisel nädalal , et väga huvitaval kombel me võtsime eelmise aasta lõpus teemaks sellise ühenduse inimese sünnikaardil nagu päikese ja veenuse konjunktsioon , et mis see täpselt tähendab , ja ma arvan , et meil on praegu hea korraks sinna tagasi minna , sellepärast et ."
20220308_sodiaagisosinad_07031303_tundekllane_ndalalpp_loob_unenolise_atmosfri,0,F,17.593000000000004,tundub,"Ja et see on väga huvitav jah , et kõik veebalajad , et jah , pange tähele , et praegu tundub tõesti , et hästi suur selline kosmose pool hästi suur tähelepanu veealajatel ."
20220308_sodiaagisosinad_07031303_tundekllane_ndalalpp_loob_unenolise_atmosfri,0,F,17.593000000000004,arvan,"Merkuur läheb kaladesse ja ma vaatan praegu , et väga ilusal kellaajal kolm 33 , nii et kui sa oled inimene , kellele korduvad numbrid on mingiks märguandeks , siis kolm , 33 Merkuur siseneb kaladesse , tuues kaasa suhtlusesse väga palju sellist unistuslikku unelevat , fantaseerivat vibi ja ma arvan , et on inimesi , kelle jaoks on see väga märgiline , et see just toimub sellisel kellaajal ."
20220308_sodiaagisosinad_07031303_tundekllane_ndalalpp_loob_unenolise_atmosfri,0,F,17.593000000000004,ütleme,"Ka sellist , pigem nagu tunnete väljendamiseks ja tundemaailma väljendamiseks , et kui tahad väljendada midagi abstraktset ja et noh , aga see ei sobi nagu hästi selliste numbritega ega tegelemiseks ja nagu mingi sellise ütleme , kas see finantspoolega tegelemine on natukene keerulisem sellel ajal ja nagu raamatupidamine ja kõik selline asi on raskendatud , et noh , võib tulla igasuguseid veidrusi sinna sisse , et mõistus töötab nagu teisel tasandil Õnneks läheb Merkuur muidugi kuu lõpus juba jää ."
20220308_sodiaagisosinad_07031303_tundekllane_ndalalpp_loob_unenolise_atmosfri,0,F,17.593000000000004,paistab,"Et jah , et , et see kindlasti kõik on omavahel seotud , vähemalt niimoodi kaardi pealt küll paistab praegu ."
20220308_sodiaagisosinad_07031303_tundekllane_ndalalpp_loob_unenolise_atmosfri,0,F,17.593000000000004,tundub,"Mulle tundub , mulle tundub , aga eks me näe , eks me näe ."
20220308_sodiaagisosinad_07031303_tundekllane_ndalalpp_loob_unenolise_atmosfri,0,F,17.593000000000004,tundub,"Mulle tundub , mulle tundub , aga eks me näe , eks me näe ."
20220308_sodiaagisosinad_07031303_tundekllane_ndalalpp_loob_unenolise_atmosfri,2,F,15.383333333333333,ütleme,"Ja mõnes mõttes , kui , nagu suhetes see sünastrias on aktiveeritud see kupido , aga ütleme , et on ka muud asjad , mis selle suhte tugevaks teevad siis iseenesest see kupido igal juhul ta lisab sellist särtsu ja sellist põnevust ja lisab seda , et , et selles suhtes ei hakka jah , võib-olla igav , et , et noh , see võib aeg-ajalt neid nooli nagu uuesti tulla ja niimoodi , et tuleb ja läheb , aga et ta nagu selline jah , et ta võib-olla hoiab nagu suhte natukene ka noorusliku ja värskena tegelikult kui seal on natukene kupidot sees ."
20220308_sodiaagisosinad_07031303_tundekllane_ndalalpp_loob_unenolise_atmosfri,2,F,15.383333333333333,arvan,"Aga aga ma arvan , et see seletab väga hästi seda , et miks ma , ma pole isegi Tinderit nagu lahti pidanud tegema , sellepärast et mul tuleb igalt poolt sisse kogu aeg nagu Mid on täis erinevaid inimesi , ma lihtsalt nagu ma ei suuda nagu ära imestada , kuidas see võimalik on , ma ei tee mitte midagi , enned , raiped kirjutada ."
20220308_sodiaagisosinad_07031303_tundekllane_ndalalpp_loob_unenolise_atmosfri,2,F,15.383333333333333,arvan,"Jah , kohtusin nädalavahetusel sünnipäeval ühe oma lapsepõlve ühe inimesega , kellega me lapsepõlves koos mängisime ja siis ta ütles , et ta mäletab minu kohta seda , et me meie põhiliseks teemaks oli mingi sugune , ma ei tea , kas nagu mingi fan , fiction aga olid väga nagu niisugused Durtid ja , ja rongid , et ma ei mäleta , mida iganes me kirjutasime , aga ma arvan , et seal olid seotud ."
20220308_sodiaagisosinad_07031303_tundekllane_ndalalpp_loob_unenolise_atmosfri,2,F,15.383333333333333,ütleme,"Eks see , kui aga no eks ma ise olen ka natuke ettevaatlik , et ma ütleme , ma tean ka neid inimesi ma elus ma olen neid ilusti jälginud , et kellel on siis näiteks täpne Marsi kuppide ühendus ja noh , ma , nad saadavad küll neid noolekesi ja oma marsiga väga paljudesse kohtadesse ."
20220308_sodiaagisosinad_07031303_tundekllane_ndalalpp_loob_unenolise_atmosfri,4,F,2.3818333333333386,arvan,"Ma arvan , et see on väga hea sõnum , millega ."
20210112_abielurefendum_vib_lpetada_riigikohtus_viitab_lle_madise,0,F,18.557333333333336,usun,"Ja ma usun , et kõik argumendid ei ole veel välja öeldud ."
20210112_abielurefendum_vib_lpetada_riigikohtus_viitab_lle_madise,0,F,18.557333333333336,usun,"Aga samal ajal , kui küsimus jõuab kohtusse Et siis kohus peaks seal vähemalt senise domineeriva seisukoha järgi otsustama ka arvestades rahva tahet , et näiteks kui rahvahääletusel on küsimus , kas lubada mitmikkodakondsust Ja nüüd Eesti võtab kelleltki Eesti kodakondsuse ära põhjendusega , et tal on mõned teised kodakondsuse veel , see jõuab kohtusse ja oletame , et on rahva otsus , et mitmikkodakondsust tuleb lubada siis kohus tõenäoliselt teeks otsuse , juhindudes ka rahva otsusest , et see on olnud senine domineeriv seisukoht , aga veel kord , see arutelu on väga huvitav ja ma usun , et see kestab veel mõnda aega , vähemalt ma tahaks seda loota ."
20210112_abielurefendum_vib_lpetada_riigikohtus_viitab_lle_madise,0,F,18.557333333333336,arvan,"Ajaga ette valmistatavat hääletust , mis on juba tehniliselt , ma arvan , küllaltki suur väljakutse ."
20210112_abielurefendum_vib_lpetada_riigikohtus_viitab_lle_madise,0,F,18.557333333333336,tundub,"Et mulle tundub , et need tasakaalumehhanismid , mis põhiseadusesse on valitud , et erakorralised valimised ähvardavad juhul , kui ei suudeta peaministrit paika panna , see on koalitsioonivalitsuse ja paljude fraktsioonidega riigikogu puhul ka väga vajalik , et ei ole võimalik lõpmatuseni vaielda , vaid ühel hetkel peab see valitsus sündima , et on ju riike , kus valimistest saab mööda juba aasta või poolteist valitsust ikka ei ole ."
20210112_abielurefendum_vib_lpetada_riigikohtus_viitab_lle_madise,0,F,18.557333333333336,tundub,"Et kellele tundub , et , et väikese iluvõimleja treening treeneri juhendamisel õhurihkas spordisaalis , et see pole ju vajalik ."
20210112_abielurefendum_vib_lpetada_riigikohtus_viitab_lle_madise,1,F,4.169000000000001,tundub,"Eesti valitsus on siiamaani olnud pigem tubli , ma ütleks , sest kui me vaatame ringi , siis tundub , et paljud riigid on teinud päris suuri vigu ja see on ka see , miks ma ütlen , et teistelt riikidelt on ennekõike õppida , mida mitte teha , mitte seda , mida teha ."
20210112_abielurefendum_vib_lpetada_riigikohtus_viitab_lle_madise,1,F,4.169000000000001,tundub,"Ja meil mulle tundub , on pigem läinud päris hästi , et on see teadusnõukoda , kus on oma valdkonna parimad eksperdid ."
20190408_68_saade__hingamisterapeudid_annavad_npuniteid_kuidas_end_terveks_ja_nnelikuks_hingata,0,F,39.769999999999996,arvan,"Pille Allik , trepp ma arvan , et ma ütlesin õigesti ."
20190408_68_saade__hingamisterapeudid_annavad_npuniteid_kuidas_end_terveks_ja_nnelikuks_hingata,0,F,39.769999999999996,ütleme,"Aga niisugused krambilaadsed asjad tekivad , ütleme ühel kolmandikul ja pärast viiendat-kuuendat seanss on need läinud , et , et tegelikult on see see , et hingamine ei tekita mingisuguseid pingeid , vaid need on lihtsalt vanad pinged , mis tulevad esile ja peab olema armastav terapeut , armastav energia ."
20190408_68_saade__hingamisterapeudid_annavad_npuniteid_kuidas_end_terveks_ja_nnelikuks_hingata,0,F,39.769999999999996,ütleme,"Ma olen väga uudishimulik , ma tahaks teada , mis toimub nagu mis , mis kehas konkreetselt toimub seal sel ajal , kui sa , et see ei ole ju mingi selline , mida me ette kujutame , nagu see nii-öelda siis esoteerika pool vaid see on päris reaalne inimene , hingab , mis , mis on selle , mis vahet sellel on , et kui ma noh , nii , ma saan aru , et see intensiivsem , aga mis mu kehas sest toimub ja mis nagu no ütleme , võtame sellesama klaasi vett , et kui siin põhjas on mingit sodi mustust ja , ja kui sa hakkad noh , liigutama lusikaga , siis see sodi tuleb nagu ülesse ja kui valla valada veel puhast vett nüüd peale ütleme , puhast õhku õhku , siis see sodi hakkab vaikselt välja voolama ja lõpuks on siis ikkagi meil puhas klaas ."
20190408_68_saade__hingamisterapeudid_annavad_npuniteid_kuidas_end_terveks_ja_nnelikuks_hingata,0,F,39.769999999999996,ütleme,"Ma olen väga uudishimulik , ma tahaks teada , mis toimub nagu mis , mis kehas konkreetselt toimub seal sel ajal , kui sa , et see ei ole ju mingi selline , mida me ette kujutame , nagu see nii-öelda siis esoteerika pool vaid see on päris reaalne inimene , hingab , mis , mis on selle , mis vahet sellel on , et kui ma noh , nii , ma saan aru , et see intensiivsem , aga mis mu kehas sest toimub ja mis nagu no ütleme , võtame sellesama klaasi vett , et kui siin põhjas on mingit sodi mustust ja , ja kui sa hakkad noh , liigutama lusikaga , siis see sodi tuleb nagu ülesse ja kui valla valada veel puhast vett nüüd peale ütleme , puhast õhku õhku , siis see sodi hakkab vaikselt välja voolama ja lõpuks on siis ikkagi meil puhas klaas ."
20190408_68_saade__hingamisterapeudid_annavad_npuniteid_kuidas_end_terveks_ja_nnelikuks_hingata,0,F,39.769999999999996,ütleme,"Mürgid mustus , kui inimene on , ütleme , suitsetanud , palju , joonud , ebatervislikult , söönud ka kõik mürgid hakkavad kehas liikuma hingamisega , see on nagu tolmuime , aga puhastab keha ."
20190408_68_saade__hingamisterapeudid_annavad_npuniteid_kuidas_end_terveks_ja_nnelikuks_hingata,0,F,39.769999999999996,ütleme,"Et kui sul ongi , ütleme , eelmine nädal olnud suur tüli kellegagi , siis esimese asjana sa töötad selle tüli läbi järgmise asjana tulevad siis kõik need kehalised pinged , et esimesed seansid ongi väga paljud ja lihtsalt kehalised , kuna , kuna on vaja keha kõigepealt puhastada ja , ja siis hakkavad võib-olla tulema lapsepõlves lõpetamata asjad mingid läbi elamata tunded ja , ja , ja siis , kui sa oled selles osas nagu puhas , siis sa võid juba rännata , trippima , minna minevikku või tulevikku , et see on jah , et ajulained on siis , siis ongi teetalained ."
20190408_68_saade__hingamisterapeudid_annavad_npuniteid_kuidas_end_terveks_ja_nnelikuks_hingata,0,F,39.769999999999996,ütleme,"Aga , aga mis see , mis puhul siis seda ütleme , hingamisteraapiasse tulla üldse , et noh , et kas mina , kellel põhimõtteliselt no ei ole probleeme , ütleme nii , enda arust et ."
20190408_68_saade__hingamisterapeudid_annavad_npuniteid_kuidas_end_terveks_ja_nnelikuks_hingata,0,F,39.769999999999996,ütleme,"Aga , aga mis see , mis puhul siis seda ütleme , hingamisteraapiasse tulla üldse , et noh , et kas mina , kellel põhimõtteliselt no ei ole probleeme , ütleme nii , enda arust et ."
20190408_68_saade__hingamisterapeudid_annavad_npuniteid_kuidas_end_terveks_ja_nnelikuks_hingata,0,F,39.769999999999996,ütleme,"Tegelikult muidugi on , eks ju ka , ja ma tahtsin tegelikult jõuda nüüd oma isikliku probleemi juurde , mis kõiki vaatajaid tõenäoliselt , kes on nagu regulaarsed vaatajad on ära ära ära tüüdanud on see , et ütleme , mul on migreenid ja mul siis üks arst ütles ka , et , et kuulge , et ju hingata valesti , et sellepärast veel ongi need migreenid tulnud ."
20210220_podcast_noorteaken_4__vaimne_tervis,2,F,48.436166666666665,ütleme,"See ütleme niimoodi , et täitsa esimene seeme pandi võrsuma siis , kui 2015. Aastal peaasjalikult ."
20210220_podcast_noorteaken_4__vaimne_tervis,2,F,48.436166666666665,ütleme,"Võtame võtame niimoodi mõnusasti , tegelikult ka seda organisatsioonis tegutsemist , aga et võib-olla et niimoodi kõige paremini ülevaadet anda , siis saamegi nagu ütleme , kolme kolme haru või sellise kolme eesmärgi põhjal ."
20210220_podcast_noorteaken_4__vaimne_tervis,2,F,48.436166666666665,ütleme,"Just just no ütleme , võib olla huvikaitse vallas , kindlasti on meil nagu hästi tore olnud see , et me oleme tõesti saanud kaasa rääkida , õigemini mitte ainult kaasa rääkida , vaid nagu kõvasti panustada sellisesse asja nagu vaimse tervise rohelise raamatu koostamine ."
20210220_podcast_noorteaken_4__vaimne_tervis,2,F,48.436166666666665,ütleme,"Ehk et ütleme niimoodi , et Eestis on vaimse tervise edendamine riiklikul tasandil Kui väga pehmelt ?"
20210220_podcast_noorteaken_4__vaimne_tervis,2,F,48.436166666666665,ütleme,"Et , et tegelikult me ülejäänud Euroopaga võrreldes me oleme hästi noh , ütleme tegelikult natukene maha jäänud , et selles mõttes meil ei , ei ole sellist asja nagu vaimse tervise poliitika poliitika , mis jagab , või nagu juhiks seda , kuidas neid otsuseid tehakse ja et kuidas me üldse keskendume mingi vaimse tervise probleemide ennetusele , kuidas me tagame seda , et meie noored saaksid kasvada toetavates keskkondades , ehk et nüüd on koostatud selline esimene samm selle suunas , et et ehk et ehk et roheline raamat mille põhjal siis neid poliitikaid hakatakse looma ja meie saime ka seda ma ei tea , mitu ringi tagasisidestada ja juurde kirjutada , et me ikkagi ikkagi saime seal panust ja , ja no mis siis veel ikkagi meie liikumise esindajad on ikkagi kui on peaministri kohtumised olnud noortega , siis seal oleme saanud neid teemasid esile esile tuua ."
20210220_podcast_noorteaken_4__vaimne_tervis,2,F,48.436166666666665,arvan,"Mantlipärijad saavad edasi arendada , et noh , tegelikult ka see , et kuidas me enda liikmeid nagu veel paremini kaasame ja et kuna meil on nii palju ägedaid noori , kes tahavad ise midagi nagu selles valdkonnas muuta , et kuidas me neid kõige paremini toetame ja tõesti nende tegudeni aitame , et ma arvan , et see on ka niisugune arengu arengukoht tegelikult no ressursi rakendamine ."
20210220_podcast_noorteaken_4__vaimne_tervis,2,F,48.436166666666665,arvan,"Aga , aga jah , et ma arvan , et need on nagu kõige levinumad ja võib-olla selline ."
20210220_podcast_noorteaken_4__vaimne_tervis,2,F,48.436166666666665,ütleme,"No ütleme niimoodi , et kui Vaadata neid muresid , siis need kõige levinumad kindlasti tegelikult noh , eriti kui me räägime näiteks ärevusest depressioonist ka tegelikult sellisest ennast nagu lõhki töötamisest või õppimisest ."
20210220_podcast_noorteaken_4__vaimne_tervis,2,F,48.436166666666665,arvan,"Aga ma arvan , et mis on noorte puhul niimoodi erinevamad või erilisemad , on see , et vähemasti mulle tundub , et noored on avatumad nendest teemadest rääkima ."
20210220_podcast_noorteaken_4__vaimne_tervis,2,F,48.436166666666665,tundub,"Aga ma arvan , et mis on noorte puhul niimoodi erinevamad või erilisemad , on see , et vähemasti mulle tundub , et noored on avatumad nendest teemadest rääkima ."
20210220_podcast_noorteaken_4__vaimne_tervis,2,F,48.436166666666665,arvan,"Et noortest ma arvan ka , et väga suur oluline osa on see , et ."
20210220_podcast_noorteaken_4__vaimne_tervis,2,F,48.436166666666665,arvan,"Aga ometi ometi jällegi nendel ma arvan , et siis poliitika dokument peaks olemas olema ."
20210220_podcast_noorteaken_4__vaimne_tervis,2,F,48.436166666666665,ütleme,"Kui vaatame naabreid , siis näeme nii arengusuundi , suundi kui ka natuke seda , et kust me oleme juba võib-olla võib-olla läbi käinud , ütleme siis niimoodi , et oleme kuskil täpselt keskel ."
20210220_podcast_noorteaken_4__vaimne_tervis,2,F,48.436166666666665,ütleme,"Niimoodi sinna sisse nagu tuuma sissepoole , et et me oleme rääkinud , et mis siin , millised on need üldisemad ütleme siis ."
20210220_podcast_noorteaken_4__vaimne_tervis,2,F,48.436166666666665,arvan,"Võib-olla rääkida natukene sellest , et mis , nagu need üleüldised jooned on nagu vaimse tervise mured või nagu psüühikahäired , kui üldiselt tekivad ja siis ma arvan , et Mirjam saab nagu Kooli ."
20210220_podcast_noorteaken_4__vaimne_tervis,2,F,48.436166666666665,ütleme,"Mis aga , aga kui me vaatame hästi laialt , siis vaimse tervise mured , häired nagu ütleme , nende tekke põhjused saab jagada kahte suurde portsu nii-öelda ."
