episode_id,section_index,gender,minutes,verb,lause
20200105_episood_47__vilkurid_ja_lennukid,10,M,2.975333333333333,ütleme,"Olgu ma pean küsima , sul on see valge kittel ja sa näed ülistiilne välja , sul on läbimõeldud nägu , et ja , ja prillid ja prillid on ka sul sellised stiilsed ja kõik on täpselt nii nagu peab siis kuidas sellega nagu naistemaailmas läheb , et , et kas , kas sul on lihtsam , kui , kui kuidagi pudeneb välja see , et sa oled arst , kas ütleme midagi naise näo ilmes muutub ?"
20200105_episood_47__vilkurid_ja_lennukid,11,M,9.482666666666667,tundub,"Ma küsisingi seda , sest see tundubki niimoodi , see viib nagu tagasi lapsepõlve , see tundub , et sul on mingisugune peaaegu nagu Lisens to kill ."
20200105_episood_47__vilkurid_ja_lennukid,11,M,9.482666666666667,ütleme,"Olgem ausad , aga see tüüp , see ütleme liiga palju roolis olnud tüüp , kes kuidas asi välja näeb , tuleb väljakutse ."
20200105_episood_47__vilkurid_ja_lennukid,11,M,9.482666666666667,ütleme,"Okei , no ütleme niimoodi , et vilkurid , me paneme üldse tööle nagu ühel juhul 10-st , kui sedagi , onju need on need juhud ."
20200105_episood_47__vilkurid_ja_lennukid,11,M,9.482666666666667,ütleme,"Kas sa saad mõnest konkreetsest loost rääkida kuidagi millisest näiteks midagi sellist , mis noh , oleks ütleme filmimaterjal ."
20200105_episood_47__vilkurid_ja_lennukid,12,M,5.412166666666667,tundub,"Olgu , ma kuulan su lõpuni ja siis ma argumenteerin Et surmaga tundub , et on sama teema , et me tahaks , et see oleks kuskil mujal ."
20200105_episood_47__vilkurid_ja_lennukid,12,M,5.412166666666667,arvan,"Et inimese esimene reaktsioon on lihtsalt paanika ja helistamine ja , ja , ja noh , keegi , Maailmas on , ma arvan , sõna otseses mõttes null inimest , kes seisaks oma ükskõik kui vana sureva lähedase kõrval ja hoiaks tal käest ja lihtsalt , et las ta siis läheb , et kõik reageeriksid ikkagi kuhugi helistades kuhugi joostes ."
20200105_episood_47__vilkurid_ja_lennukid,15,M,1.1386666666666618,ütleme,"Ja siis üks küsimus neile oli ka , mida nad kogu aeg kuulevad , on see , et näiteks kui inimese geenid näitavad , et tal on ülisuur tõenäosus näiteks saada Alseimer siis nende seisukoht on , et nad ei ütle seda inimesele sellepärast , et miks ta peaks seda teadma , ütleme ta on 25 kolmekümnene ja Altsemer hakkab noh , tuleb seal kuskil 60 70 võib-olla siis tal ei ole vaja lihtsalt elada selle teadmisega ."
20200105_episood_47__vilkurid_ja_lennukid,19,M,0.2906666666666676,ütleme,"Mida teeb siis see arst peab otsustama , kes seda surmatõendit kirjutab , onju , aga sageli jah , me ütleme , et ta suri millessegi ."
20200105_episood_47__vilkurid_ja_lennukid,20,M,5.591333333333334,ütleme,"See on nagu see , et , Kui palju ütleme , meil on inimene , kes on minekul siis , kui palju on selles hoolimist ja kui palju on meie isiklikku egoismi , ehk siis lihtsalt meie ei taha noh , et ta ära sureb , sest see on meile raske ."
20200105_episood_47__vilkurid_ja_lennukid,21,M,7.128999999999996,arvan,"Ma arvan , et seda saaks muuta üleüldise kasvatuse ja , ja , ja mõtteviisi läbi , et kui meid kui surm ei ole selline kogu aeg seal selline midagi väga müstilist ja halba , mis ühel päeval tuleb , kui ta oleks nagu rohkem meie elus , siis ma arvan , et oleks kuidagi kergem , kogu see mäng ja elul oleks ka kuidagi väärtus sees ."
20200105_episood_47__vilkurid_ja_lennukid,21,M,7.128999999999996,arvan,"Ma arvan , et seda saaks muuta üleüldise kasvatuse ja , ja , ja mõtteviisi läbi , et kui meid kui surm ei ole selline kogu aeg seal selline midagi väga müstilist ja halba , mis ühel päeval tuleb , kui ta oleks nagu rohkem meie elus , siis ma arvan , et oleks kuidagi kergem , kogu see mäng ja elul oleks ka kuidagi väärtus sees ."
20200105_episood_47__vilkurid_ja_lennukid,21,M,7.128999999999996,arvan,"Millal see jutuajamine nagu maha pidada on ju , aga ma arvan , et , Kui lihtsalt hoida seda pidevalt kuklas seda seda mõtet , et inimesed tõesti vahepeal surevad ära siis võib-olla meil õnnestub , nagu võib-olla mul õnnestub arstina nagu sellest õigel ajal inimestega rääkida ."
20200105_episood_47__vilkurid_ja_lennukid,21,M,7.128999999999996,arvan,"No ilmselgelt noh , ei ole aega tegeleda nii süveneda igasse inimesesse Ma arvan , et kindlasti , et see hetk , kui inimesele öelda , et nagu tal on päevad loetud , siis see on , sa oled see inimene , kes seda ütleb , järelikult sa oled ka see inimene , kes peab teda toetama , selles ."
20200105_episood_47__vilkurid_ja_lennukid,21,M,7.128999999999996,arvan,"Küsid tema käest infot tagasi , et sa nagu ütled , et okei , ma arvan , et tal on nagu nii palju jäänud , onju et kuidas seletada seda haigust ja , ja , ja , ja , ja , ja ravi ja mida iganes ."
20200105_episood_47__vilkurid_ja_lennukid,21,M,7.128999999999996,arvan,"No tekibki ja ma arvan , et see läheb selle klassikalise stsenaariumi järgi , et algul on eitamine ja siis mis see , mis see kolmik oli ."
20200105_episood_47__vilkurid_ja_lennukid,21,M,7.128999999999996,tundub,"Et aga see tundub olevat paratamatu protsess , ükskõik mis selliste ."
20200105_episood_47__vilkurid_ja_lennukid,22,M,2.0489999999999933,arvan,"Mulle meeldib selline teema , mis võtab mul kõri pihku ja surub mu sellesse elu paratamatuse sisse , et ma suplen selles ja , ja , ja , ja , ja , ja see karastab , ma arvan , see on , see on , see on parem kui , kui sellest mitte rääkimine minu jaoks ."
20200105_episood_47__vilkurid_ja_lennukid,22,M,2.0489999999999933,arvan,"Ma arvan , sügavamat elu tunnetamist , ehk siis , kui sa tahad elu sügavamale tunnetada , siis sa pead mõtisklema , surma ."
20200105_episood_47__vilkurid_ja_lennukid,22,M,2.0489999999999933,tundub,See tundub mulle täiesti nagu ABC .
20200105_episood_47__vilkurid_ja_lennukid,28,M,7.664999999999994,arvan,"Ma arvan , aga ega ta haiglasse ei tahtnud minna , ta tahtis lihtsalt keegi kuulaks seda kopsu ."
20200105_episood_47__vilkurid_ja_lennukid,28,M,7.664999999999994,ütleme,"Noh , see võib päris raske olla , see ütleme , kui sa valid elukutseks olla arst , siis kas näiteks , kui sina selle valisid , kas selline mingi päästmisevajadus on sees või see on lihtsalt mingisugune töö ?"
20200105_episood_47__vilkurid_ja_lennukid,28,M,7.664999999999994,usun,"Inimene on sotsiaalne olend ja mina usun küll sellesse , et inimesed on kõik head ."
20200105_episood_47__vilkurid_ja_lennukid,28,M,7.664999999999994,usun,"Aga nagu ma usun küll seda , et nagu inimesed on head ja tahavad teistele head ja lihtsalt Kui see kukub vahel halvasti välja , siis on nagu ."
20200105_episood_47__vilkurid_ja_lennukid,28,M,7.664999999999994,arvan,"Siis on nii , aga nagu ma arvan , et ükskõik , kes oleks nagu minu kingades oleks kogemata sattunud meditsiini õppima , siis nagu sa lihtsalt nagu näed inimesi nende nõrkuse hetkel see ongi nagu see , mida sa teed ja ."
20200105_episood_47__vilkurid_ja_lennukid,28,M,7.664999999999994,arvan,"Või vähemalt olla lihtsalt seal , nagu et ma arvan , et see on nagu inimlik , mitte nagu see , et minule see amet kuidagi sobiks ."
20200105_episood_47__vilkurid_ja_lennukid,29,M,2.898666666666668,ütleme,"Ja , ja , ja siis on inimesed , kes lähevad lihtsalt arstiks õppima ja mõnes mõttes on see nagu ka okei , et võib-olla need inimesed , kes lähevadki , ütleme ."
20200105_episood_47__vilkurid_ja_lennukid,30,M,2.0393333333333277,ütleme,"No ütleme , et inimene ajab kargu alla ja läheb eluga edasi oma äranägemise järgi ."
20200105_episood_47__vilkurid_ja_lennukid,30,M,2.0393333333333277,arvan,"Ma ei teagi Vot see ongi see küsimus , ma arvan , et ükskord , kui ma täiesti Oli üks tüüp oli ."
20200105_episood_47__vilkurid_ja_lennukid,30,M,2.0393333333333277,arvan,"Ma arvan , et see oli kõige lähemal , mis ma olin elupäästmisele ."
20200105_episood_47__vilkurid_ja_lennukid,31,M,2.5273333333333388,arvan,"Ma arvan , et see ei ole keeruline ette kujutada nagu ükskõik mis elukutse ."
20200105_episood_47__vilkurid_ja_lennukid,36,M,2.4009999999999914,ütleme,"Longstari Shorton siis see , et nagu nõudmised ja ressursid olid lihtsalt nii räiges vastuolus , et ei olnudki võimalik tagada seda , mida nõuti ütleme nii , aga see ja lihtsalt nagu tehes rohkem , kui ma jaksasin mingite reservide arvelt , kasutades medikamente nagu ."
20201108_juubel_75_075_08112020,3,M,16.409,arvan,"Väike väike , see on juba suur jubilei 75 on päris suur jubinai , tegelikult on juba see , et sott enam mina nii palju kaugele küll välja ei vea , ma arvan ."
20201108_juubel_75_075_08112020,4,M,5.370666666666667,arvan,"Nusson olema , kusjuures ma arvan , et ma jään vastuse võlgu , aga see väga uus lugu on see , ma arvan , et siin 20 19. 20 20 20 19 on see lugu , jah , jaa , mis aastaaeg , ma arvan , lõhnab niisuguse suve lõpu vananaiste suve järgi niimoodi ja meie meie kliimavööndis nagu august september ."
20201108_juubel_75_075_08112020,4,M,5.370666666666667,arvan,"Nusson olema , kusjuures ma arvan , et ma jään vastuse võlgu , aga see väga uus lugu on see , ma arvan , et siin 20 19. 20 20 20 19 on see lugu , jah , jaa , mis aastaaeg , ma arvan , lõhnab niisuguse suve lõpu vananaiste suve järgi niimoodi ja meie meie kliimavööndis nagu august september ."
20201108_juubel_75_075_08112020,4,M,5.370666666666667,arvan,"Nusson olema , kusjuures ma arvan , et ma jään vastuse võlgu , aga see väga uus lugu on see , ma arvan , et siin 20 19. 20 20 20 19 on see lugu , jah , jaa , mis aastaaeg , ma arvan , lõhnab niisuguse suve lõpu vananaiste suve järgi niimoodi ja meie meie kliimavööndis nagu august september ."
20201108_juubel_75_075_08112020,10,M,2.2346666666666652,tundub,"Eldo raado , Eldo raado , see on mingi espanioli värk , rohkem vist , tundub küll , jah , ma ei tea , ei no see ."
20201108_juubel_75_075_08112020,11,M,19.655333333333335,arvan,"Aga ma arvan , et võiks olla ainukene koht , kus pole amortidest ."
20201108_juubel_75_075_08112020,11,M,19.655333333333335,arvan,"Ma arvan , et ei sõida ka , aga kas unes sõitmine läheb ?"
20201108_juubel_75_075_08112020,11,M,19.655333333333335,arvan,"Oota , ma küsin järg enda oma kõige n ju praegu esimesena ju , kas unes , kui sa näed unes , et sa unes lendab , kas siis ise arvan , et ei lähe arvesse ."
20201108_juubel_75_075_08112020,11,M,19.655333333333335,usun,"Ju ta hiljem sai aru , et ta tegelikult ei pingutanud piisavalt ja ma usun , et nüüd kolmanda korraga on ta ennast nagu kokku võtnud ja oma need kõrvakuradi argid on endal paika seadnud , mis , mis sinu maitsemeele järgi siin see asi , mina ei tea , mina ole käskinud ."
20200407_1__linnulauluhommikud,0,M,5.128,tundub,"Ja kuigi see tundub esmapilgul hirmutav , siis tegelikult kui sellest unest võitu saada ja loodusesse minna , siis kõik need värvid , see päikesetõus , need linnu hääled annavad terveks selleks päevaks väga vahva emotsiooni ."
20200407_1__linnulauluhommikud,0,M,5.128,usun,"Kui te küsite nõu kas siis linnuhuviliste foorumis või siis ka näiteks silma õpikoja Facebooki , siis ma usun , et saate vastuse , et kui see lindistus on nüüd selline , et see hääl tõesti sealt kostab siis on võimalik võimalik see häälitseja siis kindlaks teha ."
20210124_kiire_saade_086_24012021,2,M,4.213833333333333,loodan,"Tänane tund , loodan , et lustite kaasa ."
20210124_kiire_saade_086_24012021,10,M,2.572166666666669,näib,"Kogu uudis teavad , kuidas teema käib , peab tal , aga pole päris nii , nagu näib , kõik on oma kasu peal , kedagi ei koti sinu muret , nii et ära loodan teiste peale , kas kuuled , siin on igasugu tüve eri härra politseinik , mida ma valesti tegi vahepeal ma küll ütlen , et ma kohe ära pommid lennutavad ainult viie euro pärast , kellegile ei ole raha , nii et iga bänd on kitsi alati et tüdrukud panevad litsi joobes jobud , kes ei oska ennast valitseda , aineid liigub kiiremini , kui sa uued silmapilgud tada , pole siin midagi ."
20210124_kiire_saade_086_24012021,10,M,2.572166666666669,loodan,"Kogu uudis teavad , kuidas teema käib , peab tal , aga pole päris nii , nagu näib , kõik on oma kasu peal , kedagi ei koti sinu muret , nii et ära loodan teiste peale , kas kuuled , siin on igasugu tüve eri härra politseinik , mida ma valesti tegi vahepeal ma küll ütlen , et ma kohe ära pommid lennutavad ainult viie euro pärast , kellegile ei ole raha , nii et iga bänd on kitsi alati et tüdrukud panevad litsi joobes jobud , kes ei oska ennast valitseda , aineid liigub kiiremini , kui sa uued silmapilgud tada , pole siin midagi ."
20210124_kiire_saade_086_24012021,11,M,6.745000000000001,ütleme,"Saan rääkida nüüd Lääne Lääne värgist , ütleme siis tiivi ja selle poolega siis tegelikult on Eesti umbes kaks aastat nagu hiljaks jäänud ."
20210124_kiire_saade_086_24012021,11,M,6.745000000000001,ütleme,"Et ütleme , niisugune ."
20210124_kiire_saade_086_24012021,11,M,6.745000000000001,ütleme,"Võrdluseks kui kassett ka , et ütleme , Tiit ütleme , produtsendid , kes annavad nagu nii vinüülil kui kassetil , nagu aga antakse välismaal kasseti peal ."
20210124_kiire_saade_086_24012021,11,M,6.745000000000001,ütleme,"Võrdluseks kui kassett ka , et ütleme , Tiit ütleme , produtsendid , kes annavad nagu nii vinüülil kui kassetil , nagu aga antakse välismaal kasseti peal ."
20210124_kiire_saade_086_24012021,11,M,6.745000000000001,ütleme,"Just ma räägingi , et paar aastat tagasi anti näiteks tobe tegu ja värki ei liikunud üldse , ütleme siis , sa ei saanudki , ütleme MP kolme ega vavina sa ei saanudki , oligi vinüül ja kassett nagu et tuli on nüüd alles hiljaaegu tugevalt tulema tagasi tulema hakanud ja ma usun , et Ta tuli , et jääda ."
20210124_kiire_saade_086_24012021,11,M,6.745000000000001,ütleme,"Just ma räägingi , et paar aastat tagasi anti näiteks tobe tegu ja värki ei liikunud üldse , ütleme siis , sa ei saanudki , ütleme MP kolme ega vavina sa ei saanudki , oligi vinüül ja kassett nagu et tuli on nüüd alles hiljaaegu tugevalt tulema tagasi tulema hakanud ja ma usun , et Ta tuli , et jääda ."
20210124_kiire_saade_086_24012021,11,M,6.745000000000001,usun,"Just ma räägingi , et paar aastat tagasi anti näiteks tobe tegu ja värki ei liikunud üldse , ütleme siis , sa ei saanudki , ütleme MP kolme ega vavina sa ei saanudki , oligi vinüül ja kassett nagu et tuli on nüüd alles hiljaaegu tugevalt tulema tagasi tulema hakanud ja ma usun , et Ta tuli , et jääda ."
20210124_kiire_saade_086_24012021,11,M,6.745000000000001,usun,"No aga vastu näitab , ma usun , et ka see tuli , et jääda nüüd , et ."
20210124_kiire_saade_086_24012021,11,M,6.745000000000001,loodan,"Masinate tootjad hakkavad uuesti ka setimängijad tutikana tootma , ma loodan , ei ole vaja , taaskasutus on loodussõbralik ja väga hea , igapidi nagu seda küll ."
20210124_kiire_saade_086_24012021,21,M,2.4521666666666686,arvan,"Mängija vanus ei olnud ja ma arvan , et selle saab selles mingi mudelinumbri järgi kuskilt välja uurida ."
20210124_kiire_saade_086_24012021,24,M,3.221833333333332,arvan,"Ja sorry , Tommy kirjutas mulle ka ja kahjuks ma jäin natukene hiljaks , aga ma arvan , et kunagi võib-olla pole nii hilja , aga Tommy boll ja Tipikul floul tuli välja selline vinüül nagu sketchia ehk sketš ."
20210124_kiire_saade_086_24012021,43,M,3.9481666666666646,tundub,"See töötab , täiesti ilus asi , et tundub , et see nüüd teise laine , buum , pap kui tohib seda , no buum papiks kutsuda tundub , et vanad on nagu veel vihasemad kuradi kohati kui kui algne , kuradi teema reis , et et sellel üheksakümnendatel oli järelikult see mingi eetika või mingi niisugune asi oli nagu vana mingi asi oli kaasas veel kuidagi või , või enesetsensuur kuidagipidi nagu võib-olla no see minu minu kuidagi tunne , et praegu seda enam pole , nüüd panevad kõik nii täpselt kuidas tahavad , et kui ennem vanasti või tundus , et ei kurat siin üle piiri , siis nüüd ei ole neid piire enam nagu et nüüd on täiesti vaba tulek , nagu , et see , see mulle kuidagi tundub , et on hästi mõnus ."
20210124_kiire_saade_086_24012021,43,M,3.9481666666666646,tundub,"See töötab , täiesti ilus asi , et tundub , et see nüüd teise laine , buum , pap kui tohib seda , no buum papiks kutsuda tundub , et vanad on nagu veel vihasemad kuradi kohati kui kui algne , kuradi teema reis , et et sellel üheksakümnendatel oli järelikult see mingi eetika või mingi niisugune asi oli nagu vana mingi asi oli kaasas veel kuidagi või , või enesetsensuur kuidagipidi nagu võib-olla no see minu minu kuidagi tunne , et praegu seda enam pole , nüüd panevad kõik nii täpselt kuidas tahavad , et kui ennem vanasti või tundus , et ei kurat siin üle piiri , siis nüüd ei ole neid piire enam nagu et nüüd on täiesti vaba tulek , nagu , et see , see mulle kuidagi tundub , et on hästi mõnus ."
20210124_kiire_saade_086_24012021,43,M,3.9481666666666646,tundub,"See töötab , täiesti ilus asi , et tundub , et see nüüd teise laine , buum , pap kui tohib seda , no buum papiks kutsuda tundub , et vanad on nagu veel vihasemad kuradi kohati kui kui algne , kuradi teema reis , et et sellel üheksakümnendatel oli järelikult see mingi eetika või mingi niisugune asi oli nagu vana mingi asi oli kaasas veel kuidagi või , või enesetsensuur kuidagipidi nagu võib-olla no see minu minu kuidagi tunne , et praegu seda enam pole , nüüd panevad kõik nii täpselt kuidas tahavad , et kui ennem vanasti või tundus , et ei kurat siin üle piiri , siis nüüd ei ole neid piire enam nagu et nüüd on täiesti vaba tulek , nagu , et see , see mulle kuidagi tundub , et on hästi mõnus ."
20210124_kiire_saade_086_24012021,44,M,9.336999999999996,usun,Mina küll usun .
20210928_bipolaarne_muusika_8,0,M,20.077333333333335,arvan,"Osa osaliselt , osa osa on päris hea see venelase kot , ma ei , ma ei tea , mingi salapärase naise hääleline seal , kes selle refrääni nagu ära päästab jalgpallur , tütar , või ma ei usu , et see Liis on , ma arvan , see on jälle mingi helina porn , kes seal alus pükstegi laulus ."
20210928_bipolaarne_muusika_8,0,M,20.077333333333335,tundub,"Mul oli ka , ma hommikul kuulasin , siis sa nagu ei haipinud , aga siis päeva poole nagu see asi keris , mida rohkem sa kuulasid , seda rohkem , mida sa nagu üldse ootasid , siis minu meelest on nende kõigi laulude puhul niimoodi , et esimene kord täpselt nagu sa rääkisid nagu kuulad , tundub väga-väga mõttetu , onju ."
20210928_bipolaarne_muusika_8,0,M,20.077333333333335,arvan,"Ma arvan , Boadcastion täpselt sama niimoodi mina rääkida ei julgenud ."
20210928_bipolaarne_muusika_8,0,M,20.077333333333335,arvan,"No ta kirjutas ikka väga võikaid asju ka , ma arvan ."
20210928_bipolaarne_muusika_8,0,M,20.077333333333335,tundub,"Vaata aga nüüd tundub nagu , et ma ei tea , sajandi lõpuks on kindlasti see maailma lõpp käes ."
20210928_bipolaarne_muusika_8,0,M,20.077333333333335,usun,"Ma usun küll Siin Euroopas me vist väga ei huvita sellest või see on niisugune lambine , pigem meil siis kui tuleb , siis tuleb nagu enam sitemaks minna ei saa ."
20210928_bipolaarne_muusika_8,1,M,40.22183333333333,arvan,"Ma arvan , ta oli mingi 14 16 äkki ."
20210928_bipolaarne_muusika_8,1,M,40.22183333333333,ütleme,"Ma ei tea , kas see on nagu vana kool , vana kool , ta on ikka vana kooli räppa , noh ütleme nites siis seda nagu Ameerika räppi nagu oligi , pigist sai alguse ja siis ma hakkasin kuulama neid kõiki , siis ma hakkasin mingi hetk vinüüli asju ostma ."
20210928_bipolaarne_muusika_8,1,M,40.22183333333333,arvan,"Ei midagi , kusjuures tõestage vastupidist meile , kui te elate Jõgeva , kirjutage meile , tead , tead , mis mina arvan või siin on see valimine probleem , ma tegin just ühte kooli asja , siis ma vaatasin , et Jõgeval on kõige vähem kõrgharitud inimesi nagu protsentuaalselt Eestis ."
20210928_bipolaarne_muusika_8,1,M,40.22183333333333,tundub,"Kas ta on nagu mingi Triinu paar , muidugi ei tea , kus see Triinu paar täpselt asub , aga ta tundub ka , et mingisugune pärapõrgus , aga ikka on seal mingi 500 inimest ."
20210928_bipolaarne_muusika_8,1,M,40.22183333333333,arvan,"Siis aga ma arvan ja tõenäoliselt küll , jah , Tusami reporter tuts ."
20210928_bipolaarne_muusika_8,1,M,40.22183333333333,arvan,"Aga nagu selles selles suhtes , et ma arvan , et see on vaata , see , et see on nii spetsialiseerutud ala , et samamoodi nagu vaata mingi kindel pobisleidingu tüüp , vaata kus on nagu noh , natukene lihtsam kui mingit tavalist jooksmisel vaata jõuda nagu kuhugi kõrgele ."
20210928_bipolaarne_muusika_8,1,M,40.22183333333333,arvan,"Ka tood selle kuuma , selle raua vaate , kus on nüüd see Texase , see märk peal , vaata see sulle , ma arvan , meeldiks osariigi märk ju ."
20210928_bipolaarne_muusika_8,1,M,40.22183333333333,tundub,"Okei , niisugune mulle tundub , et niisugune nõukogude asi on , vaata seda , nagu rohkem liigub siin , et see võib-olla rohkem liigub ja see on nagu niisuguse ."
20210928_bipolaarne_muusika_8,1,M,40.22183333333333,usun,"Kuule , aga see seal võib päris nagu korraliku summa eest olla ja ma usun küll , ma usun küll seal räigelt nagu ."
20210928_bipolaarne_muusika_8,1,M,40.22183333333333,usun,"Kuule , aga see seal võib päris nagu korraliku summa eest olla ja ma usun küll , ma usun küll seal räigelt nagu ."
20210928_bipolaarne_muusika_8,1,M,40.22183333333333,arvan,"Ta on niisugune hästi pehmest materjalist kast , põhimõtteliselt ongi musta pesu kast siis panin sinna sisse , need on kogu aeg poolviltu sed ehk siis ma arvan , et nad mingi hetk lähevad ves viltu nagu kaardu või kuidagi ."
20210928_bipolaarne_muusika_8,1,M,40.22183333333333,arvan,"Mõttetu ei , selles suhtes , ma arvan , sa ei saa lihtsalt sellest aru , miks nad seda teevad ."
20210928_bipolaarne_muusika_8,1,M,40.22183333333333,arvan,"Ma arvan , see on forfan tehtud nagu ."
20210928_bipolaarne_muusika_8,1,M,40.22183333333333,arvan,"Kurat , ma ei tea , need mingi kaheteistaastase na , ma arvan usuvadki , et muidugi päriselt nagu mingi räppstaarid vaatan kutsusid kunagi , et sa oled Youtube r noh selles suhtes , et see oli palju nagu tervislikum hobi , kui mingi räpp ."
20210928_bipolaarne_muusika_8,2,M,0.20416666666666666,arvan,"Ma arvan , me vist üldse äkki , palju me lindistan , oleme ?"
20210928_bipolaarne_muusika_8,3,M,1.908499999999996,arvan,"Ta raudselt tuleks , tuleks , ma arvan küll ."
20220206_kollektiivne_katk_14006022022,2,M,14.377,tundub,"Akna aga kuradi õitsvad kirsid , vaid on lumeanged ja tundub , et märtsini läheb nii see aasta välja klitterit täis nagu läigivad jah , nagu kalasoomused ."
20220206_kollektiivne_katk_14006022022,2,M,14.377,ütleme,"Ma olen nendega nüüd käinud mitmelgi üritusel ja ütleme niimoodi , et poiss ja , ja just nimelt naiste rahvaste seas on kuidagi väga minekut ."
20220206_kollektiivne_katk_14006022022,2,M,14.377,tundub,"Ja mulle tundub , et õrnemal soole räige läige läige meeldib , südameläige aga st meenutab veid seda ho uut stiili ka ."
20220206_kollektiivne_katk_14006022022,2,M,14.377,ütleme,"Tähendab , see on nagu inimeste inimesena ja ütleme niisuguse ."
20220206_kollektiivne_katk_14006022022,2,M,14.377,arvan,"Tätsapäudet , see külm ja kuum korraga nagu üle keha higistad , korra liigutad , jõhkrad külmavärinad nagu ja ma , ma , ma jäin selle palavikuga mõtlema seal oma nelja seina vahel , et mis maalt siis nagu tuleks teda alandama hakata , et nagu , mis maalt võib mulle kehale koormuse ks onju osutuda või nii ja guugeldasin apteegi apteegi lehel on kirjas , et läheb üle 38 , hakka alandama , olin skeptiline , kõrval olid kohe rohud , olin skeptiline , guugeldasin edasi ja mingid koolitööd ja asjad olid , et kui läheb üle 38 poole ja on seal tükk aega , siis hakka ehk siis apteegilehel info oli niiugune , kallutatud , väga kallutatud ja mul oli nagu suured küsimärgid olid , mis pask see on ja nii , nii , ta on farma farma , täpselt see oli , ma arvan , et see Big farma või mitte ."
20220206_kollektiivne_katk_14006022022,2,M,14.377,arvan,"Ja palavikku polnud , kusjuures vist üks oli nagu tõmbasin naisest ja lapsest teise tuppa lahku magama , öösel nagu lautasin ära ennast teise tuppa , üks oli mingi rämedat külmavärina , ma arvan , et mul oli siis palavik ."
20220206_kollektiivne_katk_14006022022,2,M,14.377,loodan,"Vaata sama oli minu arust see kehavalud selg ja põlved ja hüppeliigesed lihtsalt valutasid üks päev nagu see oli kreisitunne , sellest ma pole sellist asja tundnud varem see oli nagu siugune mõnus , loodan , et vanainimestele kuidagi liiga ei tee , aga korraks oli nagu küll , niisugune tunne paar päeva nagu ma tean , mis tunnen 96 aastane olla , vaata selles suhtes , et liigesed ja seljad ja , ja kõik need liha , see päris rets , see oli väga huvitav seda , see oli minu jaoks uus kogemus , tunda sellist asja sama värdis , sama värdis , tuneli , okei , aga kogeme vähe mussi ja siis kurat , kogeme edasi asju või muusika muusika ."
20220206_kollektiivne_katk_14006022022,6,M,15.423333333333334,loodan,"Sellest lumehangedest tõi korraks nagu , oh , aga me nüüd ju uus aasta tiksub iga samm ju kurat soojale lähemale , kui tuumatalve ei tule , aga , aga loodan , et ei tule ."
20220206_kollektiivne_katk_14006022022,6,M,15.423333333333334,ütleme,"20 21 aastasse jäävad need lood suure tõenäosusega asjad lindistatud eelmise aasta teises pooles , ütleme nii peale peale ."
